,product_id,data_product_id,link_item,title,original_price,current_price,quantity_sold,product_variant,review_count
485,422209004,103015,https://hasaki.vn/san-pham/tam-goi-nuoc-hoa-x-men-fire-2in1-thom-lau-sach-sau-650g-103015.html,Tắm Gội Nước Hoa X-Men Fire 2in1 Thơm Lâu Sạch Sâu 650g,193.000 ₫,158.000 ₫,6,650g,
486,378200003,82589,https://hasaki.vn/san-pham/sua-tam-hasi-kokeshi-chiet-xuat-sua-bo-ngoc-trai-600ml-82589.html,Sữa Tắm Hasi Kokeshi Sữa Bò & Ngọc Trai Sáng Mịn Da 600ml,130.000 ₫,85.000 ₫,11,600ml,7
487,422211624,107550,https://hasaki.vn/san-pham/lan-khu-mui-enchanteur-huong-nuoc-hoa-charming-50ml-107550.html,Lăn Khử Mùi Enchanteur Hương Nước Hoa Charming 50ml,84.500 ₫,62.000 ₫,15,50ml,1
488,422203355,93955,https://hasaki.vn/san-pham/muoi-tam-argussy-tay-te-bao-chet-sang-min-da-300g-93955.html,Muối Tắm Argussy Tẩy Tế Bào Chết Sáng Da Hương Cam 300g,37.000 ₫,32.000 ₫,29,300g,8
489,422211576,107624,https://hasaki.vn/san-pham/lan-khu-mui-romano-huong-nuoc-hoa-classic-50ml-107624.html,Lăn Khử Mùi Romano Hương Nước Hoa Classic 50ml,65.000 ₫,56.000 ₫,17,50ml,1
490,309300020,57262,https://hasaki.vn/san-pham/tay-te-bao-chet-toan-than-trang-da-sua-bo-cathy-doll-320ml-57262.html,Tẩy Tế Bào Chết Toàn Thân Cathy Doll Sáng Da Sữa Bò 320ml,100.000 ₫,149.000 ₫,7,320ml,8
491,422211581,107588,https://hasaki.vn/san-pham/xit-khu-mui-romano-huong-nuoc-hoa-force-195ml-107588.html,Xịt Khử Mùi Romano Hương Nước Hoa Force 150ml,346.000 ₫,77.000 ₫,12,150ml,1
492,422209915,104609,https://hasaki.vn/san-pham/combo-cerave-sua-duong-am-ban-dem-52ml-sua-duong-the-da-kho-20ml-104609.html,Combo CeraVe Sữa Dưỡng Ẩm Ban Đêm 52ml + Sữa Dưỡng Thể Da Khô 20ml,65.000 ₫,305.000 ₫,3,2 món,
493,422211578,107628,https://hasaki.vn/san-pham/lan-khu-mui-romano-huong-nuoc-hoa-attitude-50ml-107628.html,Lăn Khử Mùi Romano Hương Nước Hoa Attitude 50ml,65.000 ₫,49.000 ₫,19,50ml,1
494,422203253,93833,https://hasaki.vn/san-pham/lan-khu-mui-refre-natural-chiet-xuat-huong-hong-moc-lan-40ml-93833.html,Lăn Khử Mùi Refre Natural Hương Hồng Mộc Lan 40ml,90.000 ₫,50.000 ₫,18,40ml,5
495,422211558,107562,https://hasaki.vn/san-pham/lan-khu-mui-enchanteur-sang-da-delightful-50ml-107562.html,Lăn Khử Mùi Enchanteur Sáng Da Delightful 50ml,59.000 ₫,77.000 ₫,12,50ml,1
496,334900006,70287,https://hasaki.vn/san-pham/lan-khu-mui-refre-whitening-huong-tinh-te-40ml-70287.html,Lăn Khử Mùi Refre Whitening Perfume Hương Thanh Nhã 40ml,79.000 ₫,48.000 ₫,18,40ml,14
497,213300028,29145,https://hasaki.vn/san-pham/serum-chong-nang-duong-the-biore-khang-bui-duong-am-sau-spf-50-pa-50ml-29145.html,Serum Chống Nắng Dưỡng Thể Bioré Dưỡng Ẩm Vượt Trội 50ml,230.000 ₫,72.000 ₫,12,50ml,38
498,422212954,108754,https://hasaki.vn/san-pham/gel-chong-nang-biore-mang-nuoc-duong-am-huong-hoa-mau-don-90ml-108754.html,Gel Chống Nắng Bioré Màng Nước Dưỡng Ẩm Hương Hoa Mẫu Đơn 90ml,96.000 ₫,172.000 ₫,5,90ml,
499,422211559,112711,https://hasaki.vn/san-pham/xit-khu-mui-enchanteur-huong-nuoc-hoa-delightful-150ml-112711.html,Xịt Khử Mùi Enchanteur Hương Nước Hoa Delightful 150ml,175.000 ₫,95.000 ₫,9,150ml,
500,422207037,100225,https://hasaki.vn/san-pham/sua-tam-nuoc-hoa-tesori-d-oriente-hoang-gia-yemen-250ml-100225.html,Sữa Tắm Nước Hoa Tesori d'Oriente Hoàng Gia Yemen 250ml,72.000 ₫,169.000 ₫,5,250ml,9
501,206500005,87183,https://hasaki.vn/san-pham/lan-khu-mui-cho-nam-old-spice-pure-sport-85g-87183.html,Sáp Khử Mùi Old Spice Hương Pure Sport Năng Động 85g (Trắng),170.000 ₫,167.000 ₫,5,85g,
502,393800038,88295,https://hasaki.vn/san-pham/kem-duong-da-tay-frudia-chiet-xuat-cam-quyt-30ml-88295.html,Kem Dưỡng Da Tay Frudia Chiết Xuất Cam Quýt 30ml,175.000 ₫,49.000 ₫,17,30ml,33
503,422210413,105729,https://hasaki.vn/san-pham/sua-tam-jmella-huong-vai-va-hue-trang-phuong-dong-500ml-105729.html,Sữa Tắm Jmella Hương Vải Và Huệ Trắng Phương Đông 500ml,418.000 ₫,119.000 ₫,7,500ml,
504,422211635,107612,https://hasaki.vn/san-pham/dau-tam-goi-romano-2-trong-1-danh-cho-nam-force-650g-107612.html,Tắm Gội 2 Trong 1 Romano Hương Nước Hoa Force 650g,115.000 ₫,144.000 ₫,6,650g,
505,422209693,104287,https://hasaki.vn/san-pham/combo-2-sua-tam-goi-nerman-huong-nuoc-hoa-cao-cap-350mlx2-104287.html,Combo 2 Sữa Tắm Gội Nerman Hương Nước Hoa Cao Cấp 350ml,184.000 ₫,401.000 ₫,2,2x350ml,1
506,422212525,108096,https://hasaki.vn/san-pham/mini-dung-dich-ve-sinh-nam-gioi-nerman-sanda-perfume-30g-108096.html,[Mini] Dung Dịch Vệ Sinh Nam Giới Nerman - Sanda Perfume 30g,220.000 ₫,40.000 ₫,20,30g,4
507,422204025,95447,https://hasaki.vn/san-pham/xit-khu-mui-cho-nam-nivea-men-cool-kick-cool-fresh-150ml-95447.html,Xịt Khử Mùi Nivea Men Mát Lạnh Thơm Sảng Khoái 150ml,125.000 ₫,112.000 ₫,8,150ml,
508,422209009,103025,https://hasaki.vn/san-pham/tam-goi-x-men-for-boss-intense-2in1-huong-tram-noi-luc-850g-103025.html,Tắm Gội X-Men For Boss Intense 2in1 Hương Trầm Nội Lực 850g,248.000 ₫,198.000 ₫,4,850g,
509,393800041,88301,https://hasaki.vn/san-pham/kem-duong-da-tay-frudia-chiet-xuat-xoai-30ml-88301.html,Kem Dưỡng Da Tay Frudia Chiết Xuất Xoài 30ml,72.000 ₫,49.000 ₫,16,30ml,33
510,378200004,82587,https://hasaki.vn/san-pham/sua-tam-hasi-kokeshi-duong-am-lam-sang-da-chiet-xuat-nha-dam-olive-600ml-82587.html,Sữa Tắm Hasi Kokeshi Nha Đam & Olive Ẩm Mịn Da 600ml,130.000 ₫,85.000 ₫,9,600ml,7
511,422210323,105505,https://hasaki.vn/san-pham/combo-nerman-black-panther-sua-rua-mat-100g-sua-tam-goi-2in1-350g-105505.html,Combo Nerman Black Panther Sữa Tắm Gội 2in1 350g + Sữa Rửa Mặt 100g,408.000 ₫,379.000 ₫,2,2 món,
512,422202708,93107,https://hasaki.vn/san-pham/sua-duong-the-malissa-kiss-sang-da-sweet-vanilla-226g-93107.html,Sữa Dưỡng Thể Malissa Kiss Sáng Da #Sweet Vanilla 226g,189.000 ₫,161.000 ₫,5,226g,10
513,422203206,93759,https://hasaki.vn/san-pham/gel-tay-te-bao-chet-felina-chiet-xuat-qua-bo-300ml-93759.html,Gel Tẩy Tế Bào Chết Felina Chiết Xuất Quả Bơ 300ml,150.000 ₫,114.000 ₫,7,300ml,54
514,206200067,86287,https://hasaki.vn/san-pham/xit-khu-mui-cho-nam-nivea-men-than-den-huong-rung-amazon-150ml-86287.html,Xịt Khử Mùi Nivea Men Than Hoạt Tính Hương Rừng 150ml,125.000 ₫,98.000 ₫,8,150ml,
515,331300012,71129,https://hasaki.vn/san-pham/sua-tam-toan-than-curel-cap-am-chuyen-sau-420ml-71129.html,Sữa Tắm Toàn Thân Curél Cấp Ẩm Chuyên Sâu 420ml,339.000 ₫,247.000 ₫,3,420ml,
516,422211562,112709,https://hasaki.vn/san-pham/xit-khu-mui-enchanteur-huong-nuoc-hoa-sensation-150ml-112709.html,Xịt Khử Mùi Enchanteur Hương Nước Hoa Sensation 150ml,179.000 ₫,96.000 ₫,8,150ml,
517,422205588,98335,https://hasaki.vn/san-pham/sua-duong-the-huong-nuoc-hoa-cathy-doll-sweet-dew-150ml-98335.html,Sữa Dưỡng Thể Cathy Doll Hương Sweet Dew 150ml,169.000 ₫,162.000 ₫,5,150ml,3
518,422205970,98563,https://hasaki.vn/san-pham/tay-da-chet-toan-than-organic-shop-hoa-hong-ngoc-trai-250ml-98563.html,Tẩy Da Chết Toàn Thân Organic Shop Hoa Hồng & Muối 250ml,169.000 ₫,89.000 ₫,8,250ml,29
519,422201165,91583,https://hasaki.vn/san-pham/tay-da-chet-toan-than-organic-shop-huong-ca-phe-250ml-91583.html,Tẩy Da Chết Toàn Thân Organic Shop Hương Cà Phê 250ml,189.000 ₫,75.000 ₫,10,250ml,29
520,422208827,102667,https://hasaki.vn/san-pham/duong-the-chong-nang-malissa-kiss-huong-nuoc-hoa-sweetie-200g-102667.html,Dưỡng Thể Chống Nắng Malissa Kiss Hương Nước Hoa Sweetie 200g,175.000 ₫,142.000 ₫,5,200g,5
521,422211594,107606,https://hasaki.vn/san-pham/sua-tam-romano-huong-nuoc-hoa-attitude-650g-107606.html,Sữa Tắm Romano Hương Nước Hoa Attitude 650g,85.000 ₫,147.000 ₫,5,650g,
522,100220050,3559,https://hasaki.vn/san-pham/muoi-tam-yoko-tay-te-bao-chet-lam-sang-da-220g-3559.html,Muối Tắm Yoko Tẩy Tế Bào Chết Làm Sáng Da 220g,193.000 ₫,69.000 ₫,10,220gr,3
523,422209003,103013,https://hasaki.vn/san-pham/tam-goi-nuoc-hoa-x-men-wood-2in1-thom-lau-sach-sau-650g-103013.html,Tắm Gội Nước Hoa X-Men Wood 2in1 Thơm Lâu Sạch Sâu 650g,170.000 ₫,173.000 ₫,4,650g,
524,422210660,105953,https://hasaki.vn/san-pham/tay-te-bao-chet-toan-than-milaganics-muoi-hong-himalaya-250g-105953.html,Tẩy Tế Bào Chết Toàn Thân Milaganics Muối Hồng 250g,275.000 ₫,108.000 ₫,7,250g,
525,422207042,100239,https://hasaki.vn/san-pham/sua-tam-nuoc-hoa-tesori-d-oriente-huong-ayurveda-500ml-100239.html,Sữa Tắm Nước Hoa Tesori d'Oriente Hương Ayurveda 500ml,108.000 ₫,219.000 ₫,4,500ml,9
526,422207451,100963,https://hasaki.vn/san-pham/xit-ngan-mui-nivea-shaveless-ngoc-trai-dep-quyen-ru-150ml-100963.html,Xịt Khử Mùi Nivea Shaveless Ngọc Trai Đẹp Quyến Rũ 150ml,124.000 ₫,97.000 ₫,7,150ml,2
527,422203917,95159,https://hasaki.vn/san-pham/lotion-duong-the-hasi-sang-da-chiet-xuat-cam-chanh-180g-95159.html,"Lotion Dưỡng Thể Hasi Sáng Da Chiết Xuất Cam, Chanh 180g",189.000 ₫,105.000 ₫,7,180g,8
528,422202706,93103,https://hasaki.vn/san-pham/sua-duong-the-malissa-kiss-sang-da-fresh-escape-226g-93103.html,Sữa Dưỡng Thể Malissa Kiss Sáng Da #Fresh Escape 226g,179.000 ₫,95.000 ₫,7,226g,3
529,395200008,89221,https://hasaki.vn/san-pham/sua-tam-bouncia-tinh-chat-sua-duong-da-500ml-mau-xanh-89221.html,Sữa Tắm Cow Bouncia Sữa Bò Tươi Hương Hoa Cỏ 500ml,275.000 ₫,95.000 ₫,7,500ml,3
530,422209386,103641,https://hasaki.vn/san-pham/sua-tam-nuoc-hoa-tesori-d-oriente-tinh-dau-macca-500ml-103641.html,Sữa Tắm Nước Hoa Tesori d'Oriente Tinh Dầu Macca 500ml,450.000 ₫,224.000 ₫,3,500ml,9
531,422209378,103633,https://hasaki.vn/san-pham/combo-cocoon-tay-te-bao-chet-toan-than-tu-ca-phe-dak-lak-103633.html,Combo Cocoon Tẩy Da Chết Toàn Thân Từ Cà Phê Đắk Lắk,441.000 ₫,360.000 ₫,2,800ml,4
532,331300013,71127,https://hasaki.vn/san-pham/gel-duong-toan-than-curel-cap-am-chuyen-sau-220ml-71127.html,Gel Dưỡng Toàn Thân Curél Cấp Ẩm Chuyên Sâu 220ml,115.000 ₫,264.000 ₫,3,220ml,
533,422201793,91963,https://hasaki.vn/san-pham/sua-tam-double-rich-tuoi-sang-da-huong-hoa-anh-dao-550g-91963.html,Sữa Tắm Double Rich Blooming Love Hương Hoa Anh Đào 550g,109.000 ₫,98.000 ₫,7,550g,7
534,422210523,105839,https://hasaki.vn/san-pham/bo-san-pham-acnes-cham-soc-mun-cho-da-kho-nhay-cam-5-mon-105839.html,"Bộ Sản Phẩm Acnes Chăm Sóc Mụn Cho Da Khô, Nhạy Cảm 5 Món",240.000 ₫,108.000 ₫,6,5 món,
535,200400057,89399,https://hasaki.vn/san-pham/gel-tam-bioderma-diu-nhe-cho-da-thuong-kho-nhay-cam-100ml-89399.html,Gel Tắm Bioderma Dịu Nhẹ Cho Da Thường & Khô Nhạy Cảm 100ml,109.000 ₫,216.000 ₫,3,100ml,
536,422215144,112717,https://hasaki.vn/san-pham/tam-goi-2-trong-1-romano-vip-huong-passion-650g-112717.html,Tắm Gội 2 Trong 1 Romano Vip Hương Passion 650g,440.000 ₫,196.000 ₫,4,650g,
537,422210972,106251,https://hasaki.vn/san-pham/sap-ngan-mui-nam-nivea-men-phan-tu-bac-50ml-106251.html,Sáp Khử Mùi Nivea Men Cho Nam Phân Tử Bạc 50ml,37.000 ₫,80.000 ₫,8,50ml,
538,397400012,85105,https://hasaki.vn/san-pham/tay-te-bao-chet-toan-than-tree-hut-chiet-xuat-vanilla-dau-monoi-510g-85105.html,Tẩy Tế Bào Chết Toàn Thân Tree Hut Vanilla & Dầu Monoi 510g,280.000 ₫,382.000 ₫,2,510g,13
539,422202626,93793,https://hasaki.vn/san-pham/muoi-tam-argussy-ca-phe-tay-te-bao-chet-280g-93793.html,Muối Tắm Argussy Tẩy Tế Bào Chết Hương Cà Phê 280g,96.000 ₫,32.000 ₫,20,280g,8
540,422204615,96209,https://hasaki.vn/san-pham/sua-tam-rohto-deou-lam-sach-khu-mui-cho-nam-520ml-96209.html,"Sữa Tắm Rohto Deou Làm Sạch, Khử Mùi Cho Nam 520ml",52.000 ₫,213.000 ₫,3,520ml,
541,206200083,87483,https://hasaki.vn/san-pham/lan-khu-mui-cho-nam-nivea-than-den-hoat-tinh-huong-rung-amazon-50ml-87483.html,Lăn Khử Mùi Nivea Men Than Hoạt Tính Hương Rừng 50ml,79.000 ₫,86.000 ₫,8,50ml,
542,249600043,89223,https://hasaki.vn/san-pham/dao-cao-kai-cho-nu-3-cai-89223.html,Dao Cạo Cho Nữ KAI Dành Cho Cơ Thể Cán Chữ T (3 Cây),22.000 ₫,49.000 ₫,13,3cái,1
543,422208250,102637,https://hasaki.vn/san-pham/lan-khu-mui-x-men-for-boss-legend-50ml-102637.html,Lăn Khử Mùi X-Men For Boss Legend Hương Tinh Tế 50ml,218.000 ₫,63.000 ₫,10,50ml,1
544,422205692,98159,https://hasaki.vn/san-pham/sap-duong-am-vaseline-pure-petroleum-jelly-100ml-98159.html,Sáp Dưỡng Ẩm Vaseline Pure Petroleum Jelly 100ml,550.000 ₫,104.000 ₫,6,100ml,7
545,422206765,100421,https://hasaki.vn/san-pham/lan-khu-mui-angel-s-liquid-mo-tham-sang-da-60ml-mau-moi-100421.html,"Lăn Nách Angel’s Liquid Mờ Thâm, Sáng Da 60ml",499.000 ₫,294.000 ₫,3,60ml,23
546,422214098,110748,https://hasaki.vn/san-pham/xit-chong-nang-the-thao-banana-boat-mat-lanh-170g-110748.html,Xịt Chống Nắng Thể Thao Banana Boat Mát Lạnh 170g,271.000 ₫,259.000 ₫,3,170g,
547,422206954,100109,https://hasaki.vn/san-pham/tay-da-chet-co-the-cocoon-duong-thot-not-an-giang-200ml-100109.html,Tẩy Da Chết Toàn Thân Cocoon Đường Thốt Nốt An Giang 200ml,165.000 ₫,140.000 ₫,5,200ml,2
548,422209662,104245,https://hasaki.vn/san-pham/bo-sua-tam-va-duong-the-de-memoria-huong-vanilla-on-mars-2x300ml-104245.html,Bộ Sữa Tắm Và Dưỡng Thể De Memoria Hương Vanilla On Mars 2x300ml,1.100.000 ₫,590.000 ₫,1,2x300ml,
549,422209660,104247,https://hasaki.vn/san-pham/bo-sua-tam-va-duong-the-de-memoria-huong-jasmine-on-moon-2x300ml-104247.html,Bộ Sữa Tắm Và Dưỡng Thể De Memoria Hương Jasmine On Moon 2x300ml,1.100.000 ₫,589.000 ₫,1,2x300ml,
550,422211566,107568,https://hasaki.vn/san-pham/sap-khu-mui-enchanteur-sang-da-sensation-40g-107568.html,Sáp Khử Mùi Enchanteur Sáng Da Sensation 40g,84.000 ₫,72.000 ₫,8,40g,
551,422216481,114687,https://hasaki.vn/san-pham/combo-goi-xa-ogx-hoa-anh-dao-385ml-chai-sua-tam-johnson-s-adult-hanh-nhan-750ml-114687.html,Combo Gội & Xả OGX Hoa Anh Đào (385ml/ Chai) + Sữa Tắm Johnson's Adult Hạnh Nhân 750ml,761.000 ₫,757.000 ₫,1,3 món,
552,422205418,97699,https://hasaki.vn/san-pham/tay-te-bao-chet-toan-than-nuxe-cho-da-kho-nhay-cam-175ml-97699.html,"Tẩy Tế Bào Chết Toàn Thân Nuxe Cho Da Khô, Nhạy Cảm 175ml",665.000 ₫,599.000 ₫,1,175ml,
553,318300002,65516,https://hasaki.vn/san-pham/bong-bot-bien-tay-te-bao-chet-mira-suri-e279-65516.html,Bông Bọt Biển Tẩy Tế Bào Chết Mira Suri E279,79.000 ₫,43.000 ₫,13,1 miếng,6
554,422208248,102633,https://hasaki.vn/san-pham/lan-khu-mui-x-men-for-boss-motion-nang-dong-tuoi-mat-50ml-102633.html,Lăn Khử Mùi X-Men For Boss Motion Năng Động Tươi Mát 50ml,359.000 ₫,62.000 ₫,9,50ml,1
555,422208142,102105,https://hasaki.vn/san-pham/duong-the-organic-shop-chiet-xuat-sua-chuoi-450ml-102105.html,Dưỡng Thể Organic Shop Chiết Xuất Sữa Chuối 450ml,159.000 ₫,276.000 ₫,2,450ml,
556,422208940,102903,https://hasaki.vn/san-pham/sua-tam-double-rich-duong-da-sang-hong-huong-hoa-lily-800g-102903.html,Sữa Tắm Double Rich White Purity Hương Hoa Lily 800g,670.000 ₫,134.000 ₫,5,800g,7
557,422204595,96079,https://hasaki.vn/san-pham/bo-san-pham-la-roche-posay-giam-mun-kiem-soat-dau-2-mon-96079.html,Combo La Roche-Posay Chống Nắng Kiềm Dầu + Gel Rửa Mặt & Tắm,129.000 ₫,550.000 ₫,1,2 món,
558,422207496,101089,https://hasaki.vn/san-pham/kem-duong-da-tay-kissme-cho-tre-em-huong-cam-chanh-60g-101089.html,Kem Dưỡng Da Tay Kissme Cho Trẻ Em Hương Cam Chanh 60g,129.000 ₫,116.000 ₫,5,60g,1
559,422207495,101087,https://hasaki.vn/san-pham/kem-duong-da-tay-kissme-cho-tre-em-khong-mui-60g-101087.html,Kem Dưỡng Da Tay Kissme Cho Trẻ Em Không Mùi 60g,140.000 ₫,103.000 ₫,6,60g,1
560,422202917,93419,https://hasaki.vn/san-pham/muoi-tam-tay-te-bao-chet-felina-tinh-dau-dua-500g-93419.html,Muối Tắm Tẩy Tế Bào Chết Felina Tinh Dầu Dừa 500g,200.000 ₫,109.000 ₫,5,500g,162
561,422203710,95095,https://hasaki.vn/san-pham/lan-khu-mui-perspi-rock-tu-nhien-chiet-xuat-lo-hoi-50ml-95095.html,Lăn Khử Mùi Perspi-Rock Tự Nhiên Chiết Xuất Lô Hội 50ml,111.000 ₫,109.000 ₫,5,50ml,
562,422203823,97509,https://hasaki.vn/san-pham/sua-tam-hazeline-tay-da-chet-sang-da-cam-yuzu-cherry-moi-900g-97509.html,Sữa Tắm Hazeline Cam Yuzu & Cherry Sáng Mịn Sạch Sâu 900g,72.000 ₫,90.000 ₫,6,900g,
563,393800043,88305,https://hasaki.vn/san-pham/kem-duong-da-tay-frudia-chiet-xuat-chanh-day-30ml-88305.html,Kem Dưỡng Da Tay Frudia Chiết Xuất Chanh Dây 30ml,355.000 ₫,49.000 ₫,11,30ml,33
564,201600037,37959,https://hasaki.vn/san-pham/xit-khu-mui-giau-khoang-vichy-giup-vung-da-duoi-canh-tay-kho-thoang-125ml-37959.html,Xịt Khử Mùi Vichy Giữ Khô Thoáng Suốt 48 Giờ 125ml,43.000 ₫,267.000 ₫,2,125ml,4
565,422202437,92961,https://hasaki.vn/san-pham/dao-cao-nu-gillette-venus-simply-2-basic-2-luoi-vi-4-cay-92961.html,Dao Cạo Cho Nữ Gillette Venus Simply 2 Basic 2 Lưỡi (4 Cây),350.000 ₫,38.000 ₫,14,4cái,1
566,422207859,101915,https://hasaki.vn/san-pham/kem-duong-emmie-lam-sang-da-huong-peachy-love-230g-101915.html,Kem Dưỡng Emmié Làm Sáng Da Hương Peachy Love 230g,179.000 ₫,280.000 ₫,2,230g,
567,422214697,111751,https://hasaki.vn/san-pham/sua-tam-parisian-nuoc-hoa-nu-lux-for-her-480g-111751.html,Sữa Tắm Parisian Nước Hoa Nữ - Lux For Her 480g,179.000 ₫,129.000 ₫,4,480g,9
568,422205589,98339,https://hasaki.vn/san-pham/sua-duong-the-huong-nuoc-hoa-cathy-doll-red-rule-150ml-98339.html,Sữa Dưỡng Thể Cathy Doll Hương Nước Hoa Red Rule 150ml,84.000 ₫,162.000 ₫,4,150ml,3
569,422211564,107564,https://hasaki.vn/san-pham/sap-khu-mui-enchanteur-sang-da-romantic-40g-107564.html,Sáp Khử Mùi Enchanteur Sáng Da Romantic 40g,86.000 ₫,72.000 ₫,7,40g,
570,100080040,3206,https://hasaki.vn/san-pham/lan-khu-mui-cho-nam-nivea-men-phan-tu-bac-khang-khuan-50ml-3206.html,Lăn Khử Mùi Nivea Men Phân Tử Bạc Kháng Khuẩn 50ml,249.000 ₫,55.000 ₫,9,50ml,
571,422208306,102411,https://hasaki.vn/san-pham/kem-duong-toan-than-felina-sang-da-tu-re-nhan-sam-250g-102411.html,Kem Dưỡng Toàn Thân Felina Sáng Da Từ Rễ Nhân Sâm 250g,65.000 ₫,247.000 ₫,2,250g,21
572,422211577,107626,https://hasaki.vn/san-pham/lan-khu-mui-romano-huong-nuoc-hoa-force-50ml-107626.html,Lăn Khử Mùi Romano Hương Nước Hoa Force 50ml,378.000 ₫,51.000 ₫,10,50ml,1
573,422215743,113603,https://hasaki.vn/san-pham/combo-gennie-nuoc-hoa-sua-tam-little-black-dress-50ml-450ml-113603.html,Combo Gennie Nước Hoa + Sữa Tắm Little Black Dress 50ml + 450ml,129.000 ₫,189.000 ₫,3,2 món,1
574,422212388,107976,https://hasaki.vn/san-pham/kem-tam-tay-te-bao-chet-felina-chiet-xuat-bo-200g-107976.html,Kem Tắm Tẩy Tế Bào Chết Felina Chiết Xuất Bơ 200g,169.000 ₫,97.000 ₫,5,200g,1
575,422207279,100669,https://hasaki.vn/san-pham/xa-phong-tam-pelican-danh-cho-vung-nguc-70g-100669.html,Xà Phòng Tắm Pelican Dành Cho Vùng Ngực 70g,169.000 ₫,119.000 ₫,4,135g,
576,422205965,98553,https://hasaki.vn/san-pham/tay-da-chet-toan-than-organic-shop-huong-cam-250ml-98553.html,"Tẩy Da Chết Toàn Thân Organic Shop Từ Cam, Đường 250ml",64.000 ₫,79.000 ₫,6,250ml,29
577,100220061,3566,https://hasaki.vn/san-pham/muoi-tam-tay-te-bao-chet-yoko-huong-sua-bo-300g-3566.html,Muối Tắm Tẩy Tế Bào Chết Yoko Hương Sữa Bò 300g,190.000 ₫,59.000 ₫,8,300gr,6
578,206400003,64952,https://hasaki.vn/san-pham/sua-tam-duong-da-chong-lao-hoa-olay-650ml-64952.html,Sữa Tắm Olay Ngăn Ngừa Lão Hoá Với Vitamin E 650ml,189.000 ₫,189.000 ₫,3,650ml,9
579,422205503,97803,https://hasaki.vn/san-pham/sua-duong-the-malissa-kiss-sang-da-adore-you-226g-97803.html,Sữa Dưỡng Thể Malissa Kiss Sáng Da #Adore You 226g,150.000 ₫,141.000 ₫,4,226g,2
580,422204621,96219,https://hasaki.vn/san-pham/sua-tam-st-ives-chiet-xuat-muoi-bien-lam-sach-sau-473ml-96219.html,Sữa Tắm St.Ives Tẩy Tế Bào Chết Muối Biển & Tảo Bẹ 473ml,249.000 ₫,137.000 ₫,4,473ml,14
581,422209203,103371,https://hasaki.vn/san-pham/gel-tam-tinh-dau-felina-oliu-hanh-nhan-800ml-103371.html,Gel Tắm Tinh Dầu Felina Oliu & Hạnh Nhân 800ml,186.000 ₫,225.000 ₫,2,800ml,44
582,422209914,104607,https://hasaki.vn/san-pham/combo-cerave-sua-rua-mat-cho-da-kho-88ml-sua-duong-the-cho-da-kho-20ml-104607.html,Combo CeraVe Sữa Rửa Mặt Cho Da Khô 88ml + Sữa Dưỡng Thể Cho Da Khô 20ml,245.000 ₫,145.000 ₫,3,88ml + 20ml,3
583,100120059,3068,https://hasaki.vn/san-pham/sua-tam-purite-thu-gian-tinh-dau-huong-thom-aroma-850ml-3068.html,Sữa Tắm Purité Thư Giãn Tinh Dầu Hương Thơm Aroma 850ml,159.000 ₫,198.000 ₫,3,850ml,12
584,422202915,93423,https://hasaki.vn/san-pham/muoi-tam-tay-te-bao-chet-felina-tu-cam-yuzu-500g-93423.html,Muối Tắm Tẩy Tế Bào Chết Felina Từ Cam Yuzu 500g,140.000 ₫,109.000 ₫,4,500g,162
585,422202914,93425,https://hasaki.vn/san-pham/tay-te-bao-chet-felina-dang-muoi-tu-hoa-oai-huong-500g-93425.html,Muối Tắm Tẩy Tế Bào Chết Felina Từ Hoa Oải Hương 500g,140.000 ₫,109.000 ₫,4,500g,162
586,422202913,93427,https://hasaki.vn/san-pham/muoi-tam-tay-te-bao-chet-felina-tu-lo-hoi-500g-93427.html,Muối Tắm Tẩy Tế Bào Chết Felina Từ Lô Hội 500g,140.000 ₫,109.000 ₫,4,500g,162
587,422200163,90055,https://hasaki.vn/san-pham/sua-tam-purite-giup-thu-gian-chiet-xuat-hoa-mau-don-850ml-90055.html,Sữa Tắm Purité Thư Giãn Da Hương Hoa Mẫu Đơn 850ml,245.000 ₫,217.000 ₫,2,850ml,12
588,422216020,114083,https://hasaki.vn/san-pham/combo-dau-goi-tsubaki-duong-bong-muot-490ml-sua-tam-senka-hoa-tuoi-mat-500ml-114083.html,Combo Dầu Gội Tsubaki Dưỡng Bóng Mượt 490ml + Sữa Tắm Senka Hoa Tươi Mát 500ml,413.000 ₫,297.000 ₫,2,490ml + 500ml,209
589,422210419,105717,https://hasaki.vn/san-pham/sua-duong-the-jmella-huong-chanh-va-hung-que-tuoi-mat-500ml-105717.html,Sữa Dưỡng Thể Jmella Hương Chanh Và Húng Quế Tươi Mát 500ml,190.000 ₫,133.000 ₫,3,500ml,2
590,422210038,104887,https://hasaki.vn/san-pham/bo-san-pham-oxy-lam-sach-sau-giam-nhon-kem-rua-mat-100g-sua-tam-500g-tang-dau-goi-180g-104887.html,"Bộ Sản Phẩm OXY Làm Sạch Sâu, Giảm Nhờn (Kem Rửa Mặt 100g + Sữa Tắm 500g + Tặng Dầu Gội 180g)",220.000 ₫,198.000 ₫,2,3 món,
591,422207634,101221,https://hasaki.vn/san-pham/tay-te-bao-chet-toan-than-milaganics-tu-ca-phe-200g-moi-101221.html,Tẩy Tế Bào Chết Toàn Thân Milaganics Từ Cà Phê 200g (Mới),199.000 ₫,129.000 ₫,3,200g,
592,422205667,98113,https://hasaki.vn/san-pham/gel-tam-old-spice-huong-tuoi-mat-va-song-dong-532ml-98113.html,Gel Tắm Old Spice Hương Tươi Mát Và Sống Động 532ml,152.000 ₫,139.000 ₫,3,532ml,
593,200900012,8434,https://hasaki.vn/san-pham/sua-tam-cetaphil-duong-am-da-cho-be-230ml-8434.html,Sữa Tắm Cetaphil Dưỡng Ẩm Dịu Lành Cho Bé 230ml,225.000 ₫,189.000 ₫,2,230ml,1
594,422211808,107277,https://hasaki.vn/san-pham/gift-sample-sua-tam-nuoc-hoa-tesori-d-oriente-goi-7ml-107277.html,[Mini] 1 Gói Sữa Tắm Nước Hoa Tesori d'Oriente 7ml (Mùi Ngẫu Nhiên),48.000 ₫,15.000 ₫,25,7ml,2
595,252500001,14614,https://hasaki.vn/san-pham/kem-bo-tay-long-cleo-cho-da-thuong-25g-14614.html,Kem Tẩy Lông Cléo Dành Cho Da Thường 25g,218.000 ₫,41.000 ₫,9,25g,15
596,422208245,102629,https://hasaki.vn/san-pham/tam-goi-x-men-for-boss-intense-2in1-huong-tram-noi-luc-650g-102629.html,Tắm Gội X-Men For Boss Intense 2in1 Hương Trầm Nội Lực 650g,189.000 ₫,178.000 ₫,2,650g,
597,422205975,98543,https://hasaki.vn/san-pham/sua-duong-the-nivea-radiant-smooth-duong-da-sang-min-600ml-98543.html,Sữa Dưỡng Thể Nivea Mịn Mượt Sáng Da Ban Ngày 550ml,96.000 ₫,183.000 ₫,2,550ml,29
598,422216343,114739,https://hasaki.vn/san-pham/sua-tam-daiichi-sekken-purefeel-huong-ma-tien-thao-450ml-114739.html,Sữa Tắm Daiichi Sekken Purefeel Hương Mã Tiên Thảo 450ml,169.000 ₫,175.000 ₫,2,450ml,
599,422211561,112707,https://hasaki.vn/san-pham/xit-khu-mui-enchanteur-huong-nuoc-hoa-romantic-150ml-112707.html,Xịt Khử Mùi Enchanteur Hương Nước Hoa Romantic 150ml,72.000 ₫,95.000 ₫,4,150ml,
600,422201166,91593,https://hasaki.vn/san-pham/tay-da-chet-toan-than-organic-shop-huong-mat-ong-que-250ml-91593.html,Tẩy Da Chết Toàn Thân Organic Shop Hương Mật Ong Quế 250ml,107.000 ₫,109.000 ₫,4,250ml,29
601,393800042,88303,https://hasaki.vn/san-pham/kem-duong-da-tay-frudia-chiet-xuat-mang-cut-30ml-88303.html,Kem Dưỡng Da Tay Frudia Chiết Xuất Măng Cụt 30ml,182.000 ₫,49.000 ₫,7,30ml,12
602,422210454,105631,https://hasaki.vn/san-pham/xa-phong-milaganics-thao-moc-tra-xanh-100g-105631.html,Xà Phòng Milaganics Thảo Mộc Trà Xanh 100g,21.500 ₫,68.000 ₫,5,100g,1
603,378200010,82591,https://hasaki.vn/san-pham/sua-tam-hasi-kokeshi-duong-am-lam-sang-da-chiet-xuat-sua-bo-ngoc-trai-950ml-82591.html,Sữa Tắm Hasi Kokeshi Sữa Bò & Ngọc Trai Sáng Mịn Da 950ml,92.000 ₫,154.000 ₫,3,950ml,7
604,209600039,83897,https://hasaki.vn/san-pham/dao-cao-nu-gillette-daisy-goi-2-cay-83897.html,Dao Cạo Nữ Gillette Daisy (Gói 2 Cây),92.000 ₫,20.500 ₫,16,2 cây,1
605,422207453,100967,https://hasaki.vn/san-pham/lan-ngan-mui-nivea-shaveless-ngoc-trai-dep-quyen-ru-50ml-100967.html,Lăn Khử Mùi Nivea Shaveless Ngọc Trai Đẹp Quyến Rũ 50ml,432.000 ₫,81.000 ₫,5,50ml,
