,product_id,data_product_id,link_item,title,original_price,current_price,quantity_sold,product_variant,review_count
244,200900001,3822,https://hasaki.vn/san-pham/kem-duong-am-cetaphil-cho-da-co-dia-295ml-3822.html,Sữa Dưỡng Thể Cetaphil Dịu Lành Cho Viêm Da Cơ Địa 295ml,189.000 ₫,739.000 ₫,5,295ml,2
245,241600003,11236,https://hasaki.vn/san-pham/xit-lam-giam-mun-lung-pelican-100ml-11236.html,Xịt Làm Giảm Mụn Lưng Pelican 100ml,98.000 ₫,109.000 ₫,34,100ml,3
246,422202529,92903,https://hasaki.vn/san-pham/kem-duong-da-tay-treaclemoon-raspberry-qua-mam-xoi-75ml-92903.html,Kem Dưỡng Da Tay Treaclemoon Raspberry Quả Mâm Xôi 75ml,181.000 ₫,83.000 ₫,44,75ml,6
247,422208321,102331,https://hasaki.vn/san-pham/sua-tam-lifebuoy-mat-lanh-sang-khoai-voi-bac-ha-800g-102331.html,Sữa Tắm Lifebuoy Mát Lạnh Sảng Khoái Với Bạc Hà 800g (Mới),190.000 ₫,159.000 ₫,23,800g,1
248,206400026,88623,https://hasaki.vn/san-pham/sua-tam-olay-duong-am-dau-va-bac-ha-650ml-88623.html,Sữa Tắm Olay Tươi Mát Dài Lâu Với Dâu Trắng Và Bạc Hà 650ml,550.000 ₫,170.000 ₫,22,650ml,9
249,422209573,104119,https://hasaki.vn/san-pham/duong-the-de-memoria-sang-da-huong-jasmine-on-moon-300ml-104119.html,Dưỡng Thể De Memoria Sáng Da Hương Jasmine On Moon 300ml,86.000 ₫,299.000 ₫,12,300ml,1
250,206200039,39819,https://hasaki.vn/san-pham/lan-ngan-mui-nivea-men-mat-lanh-thom-nang-dong-50ml-39819.html,Lăn Khử Mùi Nivea Men Mát Lạnh Thơm Năng Động 50ml,139.000 ₫,64.000 ₫,56,50ml,5
251,422200346,90403,https://hasaki.vn/san-pham/kem-giam-tham-nach-cleo-35g-90403.html,Kem Giảm Thâm Nách Cléo Chiết Xuất Lá Lộc Đề 35g,59.000 ₫,114.000 ₫,32,35g,27
252,214000008,70064,https://hasaki.vn/san-pham/xit-khu-mui-refre-whitening-huong-tinh-te-30ml-70064.html,Xịt Khử Mùi Refre Whitening Perfume Hương Thanh Nhã 30ml,629.000 ₫,48.000 ₫,72,30ml,10
253,422216286,114711,https://hasaki.vn/san-pham/xit-mun-lung-derladie-mo-tham-giam-viem-nang-long-150ml-114711.html,"Xịt Mụn Lưng Derladie Mờ Thâm, Giảm Viêm Nang Lông 150ml",159.000 ₫,379.000 ₫,9,150ml,6
254,357100009,89265,https://hasaki.vn/san-pham/sua-duong-the-hatomugi-duong-sang-da-250ml-89265.html,Sữa Dưỡng Thể Hatomugi Làm Sáng Da Chiết Xuất Ý Dĩ 250ml,175.000 ₫,69.000 ₫,49,250ml,45
255,422211637,107616,https://hasaki.vn/san-pham/dau-tam-goi-romano-2-trong-1-danh-cho-nam-gentleman-650g-107616.html,Tắm Gội 2 Trong 1 Romano Hương Nước Hoa Gentleman 650g,265.000 ₫,148.000 ₫,23,650g,2
256,422205769,98295,https://hasaki.vn/san-pham/muoi-tam-baresoul-da-nang-cho-da-dau-co-the-300g-98295.html,Muối Tắm BareSoul Đa Năng Cho Da Đầu & Cơ Thể 330g,155.000 ₫,198.000 ₫,18,330g,1
257,422208035,101867,https://hasaki.vn/san-pham/tinh-chat-duong-the-nivea-sang-da-mo-tham-nam-180ml-101867.html,"Tinh Chất Dưỡng Thể Nivea Sáng Da, Mờ Thâm Nám 180ml",135.000 ₫,89.000 ₫,38,180ml,3
258,422210473,105661,https://hasaki.vn/san-pham/bo-san-pham-nuxe-duong-da-tay-sap-duong-moi-dau-da-nang-105661.html,Bộ Sản Phẩm Nuxe Dưỡng Da Tay + Sáp Dưỡng Môi + Dầu Đa Năng,31.000 ₫,560.000 ₫,6,3 món,
259,422207219,100573,https://hasaki.vn/san-pham/gel-rua-mat-svr-lam-sach-da-khong-chua-xa-phong-55ml-100573.html,"Gel Rửa Mặt SVR Không Xà Phòng Cho Da Khô, Nhạy Cảm 55ml",98.000 ₫,115.000 ₫,30,55ml,4
260,256700001,16841,https://hasaki.vn/san-pham/bot-cam-gao-milaganics-giup-lam-sang-da-100g-16841.html,"Bột Cám Gạo Milaganics Dưỡng Da Sáng Mịn, Mờ Thâm 100g",62.000 ₫,18.000 ₫,180,100g,10
261,422202528,92905,https://hasaki.vn/san-pham/kem-duong-da-tay-treaclemoon-marshmallow-huong-keo-ngot-75ml-92905.html,Kem Dưỡng Tay Treaclemoon Marshmallow Hương Kẹo Ngọt 75ml,62.000 ₫,83.000 ₫,39,75ml,6
262,422203255,93827,https://hasaki.vn/san-pham/xit-khu-mui-refre-duong-sang-da-huong-tinh-yeu-30ml-93827.html,Xịt Khử Mùi Refre Whitening Perfume Hương Tình Yêu 30ml,109.000 ₫,48.000 ₫,68,30ml,10
263,214000007,70070,https://hasaki.vn/san-pham/xit-khu-mui-refre-whitening-huong-ngot-ngao-30ml-70070.html,Xịt Khử Mùi Refre Whitening Perfume Hương Ngọt Ngào 30ml,190.000 ₫,48.000 ₫,67,30ml,10
264,256700012,16877,https://hasaki.vn/san-pham/gel-nha-dam-milaganics-duong-am-lam-mem-da-150ml-16877.html,Gel Nha Đam Milaganics Dưỡng Ẩm & Làm Mềm Da 150ml,59.000 ₫,43.000 ₫,74,150ml,25
265,422210122,105031,https://hasaki.vn/san-pham/sua-tam-olay-tuoi-mat-dai-lau-lavender-nuoc-bach-duong-650ml-105031.html,[Hộp Quà] Sữa Tắm Olay Tươi Mát Dài Lâu Lavender & Nước Bạch Dương 650ml,161.000 ₫,189.000 ₫,17,650ml,9
266,214000009,70060,https://hasaki.vn/san-pham/xit-khu-mui-refre-whitening-huong-phan-thom-30ml-70060.html,Xịt Khử Mùi Refre Whitening Perfume Hương Phấn Thơm 30ml,216.000 ₫,48.000 ₫,66,30ml,10
267,422205666,98111,https://hasaki.vn/san-pham/gel-tam-goi-old-spice-2in1-sang-khoai-tien-loi-532ml-98111.html,Gel Tắm Gội Old Spice 2in1 Sảng Khoái & Tiện Lợi 532ml,32.000 ₫,134.000 ₫,24,532ml,2
268,422212955,108756,https://hasaki.vn/san-pham/serum-chong-nang-duong-the-biore-sang-da-huong-qua-mong-150ml-108756.html,Serum Chống Nắng Dưỡng Thể Bioré Sáng Da Hương Quả Mọng 150ml,108.000 ₫,182.000 ₫,18,150ml,38
269,422202435,92965,https://hasaki.vn/san-pham/dao-cao-nu-gillette-venus-3-basic-3-luoi-vi-2-cay-92965.html,Dao Cạo Nữ Gillette Simply Venus Basic 3 Lưỡi (Vỉ 2 Cây),421.000 ₫,28.000 ₫,109,2cây,4
270,422205320,97535,https://hasaki.vn/san-pham/xit-nuoc-hoa-toan-than-axe-cho-nam-black-135ml-97535.html,Xịt Khử Mùi AXE Cho Nam Hương Nước Hoa Black 135ml,180.000 ₫,75.000 ₫,41,135ml,4
271,422209911,104601,https://hasaki.vn/san-pham/combo-cerave-sua-rua-mat-cho-da-kho-473ml-sua-duong-the-cho-da-kho-20ml-104601.html,Combo CeraVe Sữa Rửa Mặt Cho Da Khô 473ml + Sữa Dưỡng Thể Cho Da Khô 20ml,242.000 ₫,379.000 ₫,8,473ml + 20ml,3
272,422205847,98369,https://hasaki.vn/san-pham/sua-tam-st-ives-hoa-hong-va-lo-hoi-tuoi-moi-da-650ml-98369.html,Sữa Tắm St.Ives Tươi Mát Hoa Hồng Và Lô Hội 650ml,550.000 ₫,178.000 ₫,17,650ml,14
273,422208034,101869,https://hasaki.vn/san-pham/tinh-chat-duong-the-nivea-vitamin-super-c-sang-da-320ml-101869.html,Tinh Chất Dưỡng Thể Nivea Vitamin Super C+ Sáng Da 320ml,265.000 ₫,235.000 ₫,13,320ml,3
274,422209572,104121,https://hasaki.vn/san-pham/sua-tam-de-memoria-sang-da-huong-vanilla-on-mars-300ml-104121.html,Sữa Tắm De Memoria Sáng Da Hương Vanilla On Mars 300ml,99.000 ₫,299.000 ₫,10,300ml,1
275,422208870,102725,https://hasaki.vn/san-pham/xit-tham-mun-lung-cocoon-chiet-xuat-bi-dao-140ml-102725.html,Xịt Thâm Mụn Lưng Cocoon Chiết Xuất Bí Đao 140ml,79.000 ₫,225.000 ₫,14,140ml,1
276,422209643,104187,https://hasaki.vn/san-pham/combo-cocoon-tay-da-chet-ca-phe-dak-lak-lam-sach-co-the-moi-104187.html,Combo Cocoon Tẩy Da Chết Toàn Thân & Môi Từ Cà Phê Đắk Lắk,200.000 ₫,160.000 ₫,19,2 món,1
277,207300001,5042,https://hasaki.vn/san-pham/sua-duong-the-st-ives-ho-tro-tre-hoa-da-621ml-5042.html,Sữa Dưỡng Thể St.Ives Collagen & Elastin Trẻ Hóa Da 621ml,192.000 ₫,171.000 ₫,17,621ml,97
278,206200070,86293,https://hasaki.vn/san-pham/lan-ngan-mui-nivea-serum-sang-min-huong-hoa-lily-40ml-86293.html,Lăn Khử Mùi Nivea Serum Sáng Mịn Hương Hoa Lily 40ml,108.000 ₫,98.000 ₫,30,40ml,12
279,206400032,88633,https://hasaki.vn/san-pham/sua-tam-olay-thanh-loc-da-nuoc-bach-duong-oai-huong-887ml-88633.html,Sữa Tắm Olay Tươi Mát Dài Lâu Lavender & Nước Bạch Dương 887ml,229.000 ₫,217.000 ₫,14,887ml,9
280,213300001,6488,https://hasaki.vn/san-pham/sua-chong-nang-biore-mat-lanh-bac-ha-25ml-6488.html,Sữa Chống Nắng Bioré Bảo Vệ Hoàn Hảo - Mát Lạnh 25ml,70.000 ₫,58.000 ₫,50,25ml,11
281,422207036,100227,https://hasaki.vn/san-pham/sua-tam-nuoc-hoa-tesori-d-oriente-huong-thanh-long-250ml-100227.html,Sữa Tắm Nước Hoa Tesori d'Oriente Hương Thanh Long 250ml,175.000 ₫,149.000 ₫,20,250ml,9
282,393800017,84873,https://hasaki.vn/san-pham/kem-duong-tay-frudia-chiet-xuat-anh-dao-30ml-84873.html,Kem Dưỡng Da Tay Frudia Chiết Xuất Anh Đào 30ml,72.000 ₫,48.000 ₫,60,30ml,33
283,422213095,109254,https://hasaki.vn/san-pham/serum-nach-baresoul-khu-mui-giam-san-duong-sang-20g-109254.html,"Serum Nách BareSoul Khử Mùi, Giảm Sần & Dưỡng Sáng 20g",249.000 ₫,205.000 ₫,14,20g,1
284,422204622,96221,https://hasaki.vn/san-pham/sua-tam-st-ives-chiet-xuat-cam-chanh-lam-sang-da-473ml-96221.html,Sữa Tắm St.Ives Tẩy Tế Bào Chết Hương Cam Chanh 473ml,150.000 ₫,128.000 ₫,23,473ml,14
285,422210230,105351,https://hasaki.vn/san-pham/mua-1-tang-1-sua-tam-biore-khang-khuan-mat-lanh-sang-khoai-800g-220g-105351.html,[Mua 1 Tặng 1] Sữa Tắm Bioré Guard Kháng Khuẩn Mát Lạnh Sảng Khoái 800g+220g,142.000 ₫,141.000 ₫,20,2 món,2
286,206200064,85915,https://hasaki.vn/san-pham/xit-ngan-mui-nivea-serum-duong-sang-da-huong-hoa-anh-dao-150ml-85915.html,Xịt Khử Mùi Nivea Serum Sáng Da Hoa Anh Đào 150ml,125.000 ₫,112.000 ₫,25,150ml,3
287,422212627,108286,https://hasaki.vn/san-pham/sap-khu-mui-old-spice-huong-suc-hut-hoang-da-85g-108286.html,Sáp Khử Mùi Old Spice Hương Wilderness Sức Hút Hoang Dã 85g,167.000 ₫,141.000 ₫,20,85g,27
288,422203252,93835,https://hasaki.vn/san-pham/xit-khu-mui-refre-ngan-tiet-mo-hoi-huong-go-30ml-93835.html,Xịt Khử Mùi Refre Natural Hương Gỗ 30ml,65.000 ₫,51.000 ₫,54,30ml,8
289,422208978,102969,https://hasaki.vn/san-pham/sua-duong-the-cerave-cho-da-kho-den-rat-kho-473ml-102969.html,Sữa Dưỡng Thể CeraVe Cho Da Thường Đến Da Khô 473ml,490.000 ₫,456.000 ₫,6,473ml,2
290,100160067,2263,https://hasaki.vn/san-pham/kem-chong-nang-banana-boat-spf50-90ml-2263.html,Kem Chống Nắng Banana Boat SPF50 PA+++ 90ml,170.000 ₫,149.000 ₫,18,90ml,1
291,206200073,86299,https://hasaki.vn/san-pham/xit-khu-mui-cho-nu-nivea-giam-vet-o-vang-150ml-86299.html,Xịt Khử Mùi Nivea Ngăn Ố Vàng Thanh Mát Dịu Nhẹ 150ml,109.000 ₫,86.000 ₫,31,150ml,1
292,422208938,102899,https://hasaki.vn/san-pham/sua-tam-double-rich-tuoi-sang-da-huong-hoa-anh-dao-800g-102899.html,Sữa Tắm Double Rich Blooming Love Hương Hoa Anh Đào 800g,159.000 ₫,134.000 ₫,20,800g,7
293,422212628,108294,https://hasaki.vn/san-pham/sap-khu-mui-old-spice-huong-nightpanther-am-ap-va-lich-lam-85g-108294.html,Sáp Khử Mùi Old Spice Hương NightPanther Ấm Áp Và Lịch Lãm 85g,167.000 ₫,166.000 ₫,16,85g,27
294,422216661,115049,https://hasaki.vn/san-pham/combo-2-lan-khu-mui-nivea-sang-min-se-khit-lo-chan-long-50ml-115049.html,Combo 2 Lăn Khử Mùi Nivea Sáng Mịn Se Khít Lỗ Chân Lông 50ml,184.000 ₫,178.000 ₫,15,2x50ml,1
295,422201174,91357,https://hasaki.vn/san-pham/sua-tam-nuoc-hoa-nu-parisian-chic-for-her-265ml-91357.html,Sữa Tắm Parisian Nước Hoa Nữ - Chic For Her 265ml,109.000 ₫,71.000 ₫,38,265ml,9
296,248700116,89513,https://hasaki.vn/san-pham/sua-tam-naris-nature-diu-nhe-huong-hoa-tuoi-mat-500ml-89513.html,Sữa Tắm Naris Nature Dịu Nhẹ Hương Hoa Tươi Mát 500ml,395.000 ₫,315.000 ₫,9,500ml,2
297,422211574,107582,https://hasaki.vn/san-pham/sua-tam-enchanteur-duong-da-huong-nuoc-hoa-sensation-650g-107582.html,Sữa Tắm Enchanteur Nước Hoa Dưỡng Da Sensation 650g,187.000 ₫,145.000 ₫,18,650g,1
298,422205319,97537,https://hasaki.vn/san-pham/xit-nuoc-hoa-toan-than-axe-cho-nam-gold-temptation-135ml-97537.html,Xịt Khử Mùi AXE Cho Nam Hương Nước Hoa Gold Temptation 135ml,108.000 ₫,88.000 ₫,30,135ml,3
299,422214690,111731,https://hasaki.vn/san-pham/combo-vaseline-serum-duong-the-chong-nang-sua-duong-the-nang-tong-tuc-thi-111731.html,Combo Vaseline Serum Dưỡng Thể Chống Nắng 300ml + Sữa Dưỡng Thể Nâng Tông 300ml,398.000 ₫,278.000 ₫,10,2 món,1
300,422213083,109268,https://hasaki.vn/san-pham/dung-dich-ve-sinh-nam-gioi-loli-and-the-wolf-original-80ml-109268.html,Dung Dịch Vệ Sinh Nam Giới Loli And The Wolf Original 80ml,99.000 ₫,82.000 ₫,31,80ml,1
301,303700001,42175,https://hasaki.vn/san-pham/sua-tam-new-moon-lam-sang-min-da-huong-nuoc-hoa-750ml-42175.html,Sữa Tắm Avatar Thơm Mịn Da Jojoba Bông Hoa 750ml,220.000 ₫,140.000 ₫,18,750ml,8
302,422207301,100703,https://hasaki.vn/san-pham/tinh-chat-chong-nang-duong-the-nivea-duong-am-180ml-100703.html,Serum Chống Nắng Dưỡng Thể Nivea Dưỡng Ẩm Vượt Trội 180ml,198.000 ₫,187.000 ₫,14,180ml,1
303,422209012,103031,https://hasaki.vn/san-pham/xit-khu-mui-x-men-for-boss-luxury-sang-trong-tinh-te-150ml-103031.html,Xịt Khử Mùi X-Men For Boss Luxury Sang Trọng Tinh Tế 150ml,117.000 ₫,107.000 ₫,24,150ml,2
304,422205318,97539,https://hasaki.vn/san-pham/xit-nuoc-hoa-toan-than-axe-cho-nam-dark-temptation-135ml-97539.html,Xịt Khử Mùi AXE Cho Nam Hương Nước Hoa Dark Temptation 135ml,108.000 ₫,89.000 ₫,28,135ml,2
305,422211595,107608,https://hasaki.vn/san-pham/sua-tam-romano-huong-nuoc-hoa-gentleman-650g-107608.html,Sữa Tắm Romano Hương Nước Hoa Gentleman 650g,175.000 ₫,142.000 ₫,18,650g,1
306,422216662,115051,https://hasaki.vn/san-pham/combo-2-lan-khu-mui-nivea-serum-sang-min-huong-hoa-hong-40ml-115051.html,Combo 2 Lăn Khử Mùi Nivea Serum Sáng Mịn Hương Hoa Hồng 40ml,216.000 ₫,208.000 ₫,12,2x40ml,12
307,422209190,103361,https://hasaki.vn/san-pham/sua-tam-duong-the-dove-da-bong-min-luu-huong-thom-mat-500g-103361.html,Sữa Tắm Dưỡng Thể Dove Da Bóng Mịn Lưu Hương Thơm Mát 500g,142.500 ₫,116.000 ₫,21,500g,11
308,334900002,70279,https://hasaki.vn/san-pham/xit-khu-mui-refre-natural-huong-thao-30ml-70279.html,Xịt Khử Mùi Refre Natural Chiết Xuất Hương Thảo 30ml,65.000 ₫,50.000 ₫,48,30ml,8
309,422203704,94661,https://hasaki.vn/san-pham/xit-ngan-mo-hoi-toan-than-perspi-guard-hieu-qua-toi-uu-30ml-94661.html,Xịt Khử Mùi Perspi-Guard Hiệu Quả Tối Ưu 30ml,300.000 ₫,299.000 ₫,8,30ml,3
310,422211554,107552,https://hasaki.vn/san-pham/lan-khu-mui-enchanteur-sang-da-charming-50ml-107552.html,Lăn Khử Mùi Enchanteur Sáng Da Charming 50ml,90.000 ₫,71.000 ₫,34,50ml,3
311,422204964,96941,https://hasaki.vn/san-pham/sua-tam-goi-tre-em-lactacyd-bb-giam-rom-say-ham-ke-250ml-96941.html,Sữa Tắm Gội Trẻ Em Lactacyd Bb Giảm Rôm Sảy & Hăm Kẽ 250ml,495.000 ₫,89.000 ₫,27,250ml,1
312,248700027,11764,https://hasaki.vn/san-pham/xit-chong-nang-naris-parasola-uv-spf50-pa-90g-11764.html,Xịt Chống Nắng Naris Cosmetics Dưỡng Sáng Da 90g,157.000 ₫,371.000 ₫,7,90g,8
313,422214294,111028,https://hasaki.vn/san-pham/sua-tam-lux-botanicals-hoa-hong-phap-nong-nan-570g-111028.html,Sữa Tắm Lux Botanicals Hoa Hồng Pháp Nồng Nàn 570g,181.000 ₫,155.000 ₫,16,570g,1
314,422212311,107904,https://hasaki.vn/san-pham/tam-goi-romano-2-trong-1-gen-z-huong-sea-breeze-610g-107904.html,Tắm Gội 2 Trong 1 Romano Gen Z Hương Sea Breeze 610g,175.000 ₫,138.000 ₫,17,610g,1
315,422210310,105485,https://hasaki.vn/san-pham/combo-nerman-sua-tam-goi-350ml-gel-rua-mat-cho-nam-100ml-105485.html,Combo Nerman Sữa Tắm Gội 350ml & Gel Rửa Mặt Cho Nam 100ml,358.000 ₫,332.000 ₫,7,2 món,
316,422214157,110804,https://hasaki.vn/san-pham/combo-cocoon-tinh-dau-buoi-140ml-tay-te-bao-chet-toan-than-200ml-110804.html,Combo Cocoon Nước Dưỡng Tóc Bưởi 140ml + Tẩy Da Chết Toàn Thân 200ml,290.000 ₫,246.000 ₫,10,2 món,1
317,422201907,92077,https://hasaki.vn/san-pham/tay-te-bao-chet-milaganics-ca-phe-sang-da-mo-tham-280g-92077.html,"Tẩy Tế Bào Chết Milaganics Cà Phê Sáng Da, Mờ Thâm 280g",183.000 ₫,99.000 ₫,24,280g,6
318,422201791,91967,https://hasaki.vn/san-pham/sua-tam-double-rich-can-bang-am-huong-hoa-hong-550g-91967.html,Sữa Tắm Double Rich Eva's Secret Hương Hoa Hồng 550g,115.000 ₫,98.000 ₫,24,550g,7
319,422215805,113727,https://hasaki.vn/san-pham/lan-ngan-mui-dove-tinh-chat-serum-sang-min-deu-mau-45ml-113727.html,Lăn Ngăn Mùi Dove Tinh Chất Serum Sáng Mịn Đều Màu 45ml,97.000 ₫,74.000 ₫,32,45ml,4
320,422203251,93837,https://hasaki.vn/san-pham/xit-khu-mui-refre-ngan-tiet-mo-hoi-huong-hong-moc-lan-30ml-93837.html,Xịt Khử Mùi Refre Natural Hương Hồng Mộc Lan 30ml,65.000 ₫,50.000 ₫,46,30ml,8
321,422208320,102329,https://hasaki.vn/san-pham/sua-tam-lifebuoy-sua-duong-am-da-bao-ve-khoi-vi-khuan-800g-102329.html,Sữa Tắm Lifebuoy Chăm Sóc Da Bảo Vệ Khỏi Vi Khuẩn 800g (Mới),181.000 ₫,159.000 ₫,15,800g,1
322,422208243,102623,https://hasaki.vn/san-pham/tam-goi-x-men-clean-fresh-2in1-sach-sau-630g-102623.html,Tắm Gội X-Men Clean & Fresh 2in1 Sạch Sâu 630g,193.000 ₫,158.000 ₫,15,630g,1
323,223600053,85681,https://hasaki.vn/san-pham/sua-tam-duong-am-senka-huong-hoa-tuoi-mat-500ml-85681.html,Sữa Tắm Dưỡng Ẩm Senka Hương Hoa Tươi Mát 500ml,198.000 ₫,109.000 ₫,21,500ml,13
324,422213094,109252,https://hasaki.vn/san-pham/serum-nach-baresoul-ngan-mo-hoi-khu-mui-duong-sang-20g-109252.html,"Serum Nách Baresoul Ngăn Mồ Hôi, Khử Mùi & Dưỡng Sáng 20g",229.000 ₫,178.000 ₫,13,20ml,1
325,422211575,107584,https://hasaki.vn/san-pham/sua-tam-enchanteur-duong-da-huong-nuoc-hoa-delightful-650g-107584.html,Sữa Tắm Enchanteur Nước Hoa Dưỡng Da Delightful 650g,187.000 ₫,164.000 ₫,14,650g,1
326,422209913,104605,https://hasaki.vn/san-pham/combo-cerave-sua-rua-mat-cho-da-dau-88ml-sua-duong-the-cho-da-kho-20ml-104605.html,Combo CeraVe Sữa Rửa Mặt Cho Da Dầu 88ml + Sữa Dưỡng Thể Cho Da Khô 20ml,186.000 ₫,145.000 ₫,15,88ml + 20ml,3
327,100080043,3209,https://hasaki.vn/san-pham/xit-khu-mui-cho-nam-nivea-men-phan-tu-bac-khang-khuan-150ml-3209.html,Xịt Khử Mùi Nivea Men Phân Tử Bạc Kháng Khuẩn 150ml,115.000 ₫,90.000 ₫,24,150ml,2
328,422207815,101489,https://hasaki.vn/san-pham/bot-dau-do-milaganics-ngua-mun-duong-da-sang-min-100g-hu-101489.html,"Bột Đậu Đỏ Milaganics Ngừa Mụn, Dưỡng Sáng Da 100g (Hũ)",41.000 ₫,34.000 ₫,63,100g,7
329,201100318,85691,https://hasaki.vn/san-pham/co-cha-got-chan-vacosi-p02-mau-hong-85691.html,Cọ Chà Gót Chân Vacosi P02 (Màu Hồng),55.000 ₫,46.000 ₫,46,,1
330,422204960,96949,https://hasaki.vn/san-pham/kem-tay-long-veet-silk-fresh-danh-cho-da-thuong-50g-96949.html,Kem Tẩy Lông Veet Silk & Fresh Dành Cho Da Thường 50g,76.000 ₫,65.000 ₫,33,50g,2
331,206200058,85887,https://hasaki.vn/san-pham/lan-khu-mui-cho-nu-nivea-tuoi-mat-50ml-85887.html,Lăn Khử Mùi Cho Nữ Nivea Tươi Mát 50ml,79.000 ₫,71.000 ₫,30,50ml,1
332,422205220,97361,https://hasaki.vn/san-pham/sua-tam-monsavon-chiet-xuat-sua-va-hoa-vani-1000ml-97361.html,Sữa Tắm Monsavon Chiết Xuất Sữa Và Hoa Vani 1000ml,36.000 ₫,219.000 ₫,10,1000ml,1
333,223000003,76948,https://hasaki.vn/san-pham/xa-phong-coast-113g-76948.html,Xà Bông Tắm Coast Hương Cổ Điển 113g,167.000 ₫,21.000 ₫,99,113g,3
334,422212629,108292,https://hasaki.vn/san-pham/sap-khu-mui-old-spice-huong-soi-dong-va-tao-bao-85g-108292.html,Sáp Khử Mùi Old Spice Hương ElkLord Sôi Động & Táo Bạo 85g,157.000 ₫,141.000 ₫,15,85g,27
335,422214295,111030,https://hasaki.vn/san-pham/sua-tam-lux-botanicals-huong-lan-tien-tram-tra-570g-111030.html,Sữa Tắm Lux Botanicals Hương Lan Tiên & Tràm Trà 570g,220.000 ₫,155.000 ₫,14,570g,1
336,422203709,94651,https://hasaki.vn/san-pham/lan-khu-mo-hoi-perspi-shield-khong-chua-muoi-nhom-50ml-94651.html,Lăn Khử Mùi Perspi-Shield Không Chứa Muối Nhôm 50ml,92.000 ₫,114.000 ₫,18,50ml,4
337,422206493,99371,https://hasaki.vn/san-pham/lan-ngan-mui-nivea-extra-brightening-sang-min-toi-uu-50ml-99371.html,Lăn Khử Mùi Nivea Extra Brightening Sáng Mịn Tối Ưu 50ml,218.000 ₫,71.000 ₫,29,50ml,2
338,422210309,105483,https://hasaki.vn/san-pham/combo-2-dung-dich-ve-sinh-nam-gioi-nerman-sanda-perfume-100ml-105483.html,Combo 2 Dung Dịch Vệ Sinh Nam Giới Nerman Sanda Perfume 100ml,161.000 ₫,209.000 ₫,10,2x100ml,4
339,100190160,3102,https://hasaki.vn/san-pham/gel-tam-old-spice-huong-fiji-thu-gian-va-tuoi-moi-473ml-3102.html,Gel Tắm Old Spice Hương Fiji Thư Giãn Nhẹ Nhàng 473ml,171.000 ₫,160.000 ₫,13,473ml,2
340,422216675,115075,https://hasaki.vn/san-pham/combo-lan-ngan-mui-nivea-tuoi-mat-50ml-ngan-vet-o-vang-48h-50ml-115075.html,Combo Lăn Ngăn Mùi Nivea Tươi Mát 50ml & Ngăn Vệt Ố Vàng 48H 50ml,328.000 ₫,165.000 ₫,13,2x50ml,1
341,422202140,92345,https://hasaki.vn/san-pham/sua-tam-hat-on-the-body-huong-muoi-hong-himalaya-600g-92345.html,Sữa Tắm Hạt On: The Body Hương Muối Hồng Himalaya 600g,88.000 ₫,239.000 ₫,9,600g,2
342,422206459,99323,https://hasaki.vn/san-pham/xit-khu-mui-cho-nam-rexona-kho-thoang-antibac-150ml-99323.html,Xịt Khử Mùi Rexona Cho Nam Khô Thoáng Antibac 150ml,359.000 ₫,77.000 ₫,26,150ml,2
343,422209455,103751,https://hasaki.vn/san-pham/bo-qua-tang-malissa-kiss-for-beloved-wanderlust-3-mon-103751.html,Bộ Quà Tặng Malissa Kiss For Beloved Wanderlust 3 Món,169.000 ₫,232.000 ₫,9,3 món,
344,422208814,102589,https://hasaki.vn/san-pham/sua-tam-shc-hatomugi-cap-am-duong-da-sang-min-800ml-102589.html,Sữa Tắm SHC Hatomugi Cấp Ẩm & Dưỡng Da Sáng Mịn 800ml,129.000 ₫,105.000 ₫,19,800ml,1
345,422204020,95437,https://hasaki.vn/san-pham/sua-duong-the-nivea-duong-sang-da-vitamin-c-e-180ml-95437.html,Sữa Dưỡng Thể Nivea Dưỡng Sáng Da Vitamin C & E 180ml,92.000 ₫,99.000 ₫,20,180ml,3
346,206200008,41438,https://hasaki.vn/san-pham/lan-khu-mui-cho-nam-nivea-men-giam-vet-o-vang-50ml-41438.html,Lăn Khử Mùi Nivea Ngăn Ố Vàng Thanh Mát Dịu Nhẹ 50ml,120.000 ₫,89.000 ₫,23,50ml,1
347,206800009,7785,https://hasaki.vn/san-pham/sua-duong-the-purite-sang-min-huong-hoa-anh-dao-250ml-7785.html,Sữa Dưỡng Thể Purité Sáng Mịn Hương Hoa Anh Đào 250ml,72.000 ₫,109.000 ₫,18,250ml,12
348,393800023,84867,https://hasaki.vn/san-pham/kem-duong-tay-frudia-chiet-xuat-bo-hat-mo-30ml-84867.html,Kem Dưỡng Da Tay Frudia Chiết Xuất Bơ Hạt Mỡ 30ml,550.000 ₫,49.000 ₫,40,30ml,12
349,422209575,104115,https://hasaki.vn/san-pham/duong-the-de-memoria-sang-da-huong-vanilla-on-mars-300ml-104115.html,Dưỡng Thể De Memoria Sáng Da Hương Vanilla On Mars 300ml,275.000 ₫,325.000 ₫,6,300ml,
350,422207041,100237,https://hasaki.vn/san-pham/sua-tam-nuoc-hoa-tesori-d-oriente-hy-lap-co-dai-500ml-100237.html,Sữa Tắm Nước Hoa Tesori d'Oriente Hy Lạp Cổ Đại 500ml,102.000 ₫,218.000 ₫,9,500ml,9
351,422209839,104581,https://hasaki.vn/san-pham/mua-1-tang-1-sua-tam-biore-am-min-lan-da-huong-hoa-anh-dao-530g-200g-104581.html,[Mua 1 Tặng 1] Sữa Tắm Bioré Ẩm Mịn Làn Da Hương Hoa Anh Đào 530g+200g,181.000 ₫,92.000 ₫,21,2 chai,1
352,422212312,107906,https://hasaki.vn/san-pham/tam-goi-romano-2-trong-1-gen-z-huong-forest-cedar-610g-107906.html,Tắm Gội 2 Trong 1 Romano Gen Z Hương Forest Cedar 610g,130.000 ₫,139.000 ₫,14,610g,1
353,422210968,106241,https://hasaki.vn/san-pham/sua-duong-am-cetaphil-cho-da-nhay-cam-59ml-moi-106241.html,Sữa Dưỡng Ẩm Cetaphil Dịu Lành Cho Da Nhạy Cảm 59ml,295.000 ₫,119.000 ₫,16,59ml,1
354,422202522,93035,https://hasaki.vn/san-pham/xit-ngan-mui-nivea-men-ngan-vet-o-vang-150ml-93035.html,Xịt Khử Mùi Nivea Men Ngăn Vệt Ố Vàng 150ml,125.000 ₫,112.000 ₫,17,150ml,1
355,422216194,114281,https://hasaki.vn/san-pham/combo-2-serum-chong-nang-duong-the-biore-sang-min-mat-lanh-150ml-114281.html,Combo 2 Serum Chống Nắng Dưỡng Thể Bioré Sáng Mịn Mát Lạnh 150ml,432.000 ₫,344.000 ₫,6,2x150ml,38
356,202600015,78786,https://hasaki.vn/san-pham/kem-tay-long-byphasse-chiet-xuat-lo-hoi-125ml-78786.html,Kem Tẩy Lông Byphasse Chiết Xuất Lô Hội 125ml,190.000 ₫,105.000 ₫,18,125ml,7
357,422213078,109266,https://hasaki.vn/san-pham/dung-dich-ve-sinh-nam-gioi-loli-and-the-wolf-bac-ha-80ml-109266.html,Dung Dịch Vệ Sinh Nam Giới Loli And The Wolf Bạc Hà 80ml,99.000 ₫,82.000 ₫,23,80ml,1
358,422211573,107580,https://hasaki.vn/san-pham/sua-tam-enchanteur-duong-da-huong-nuoc-hoa-romantic-650g-107580.html,Sữa Tắm Enchanteur Nước Hoa Dưỡng Da Romantic 650g,187.000 ₫,145.000 ₫,13,650g,1
359,422211627,107618,https://hasaki.vn/san-pham/sua-tam-enchanteur-dang-gel-duong-da-huong-hoa-lavender-510g-107618.html,Sữa Tắm Enchanteur Dưỡng Da Thiên Nhiên Lavender 510g,156.000 ₫,134.000 ₫,15,510g,1
360,248700114,89473,https://hasaki.vn/san-pham/xit-chong-nang-naris-parasola-uv-spf50-pa-50g-89473.html,Xịt Chống Nắng Naris Cosmetics Dưỡng Sáng Da 50g,295.000 ₫,236.000 ₫,8,50g,8
361,206200038,87791,https://hasaki.vn/san-pham/xit-khu-mui-cho-nam-nivea-men-cool-kick-mat-lanh-150ml-87791.html,Xịt Khử Mùi Nivea Men Mát Lạnh Thơm Năng Động 150ml,115.000 ₫,89.000 ₫,21,150ml,2
362,334900012,70000,https://hasaki.vn/san-pham/lan-khu-mui-refre-natural-chiet-xuat-tra-xanh-40ml-70000.html,Lăn Khử Mùi Refre Natural Hương Trà Xanh 40ml,65.000 ₫,50.000 ₫,37,40ml,5
363,223600054,85679,https://hasaki.vn/san-pham/sua-tam-duong-am-senka-perfect-whip-500ml-85679.html,Sữa Tắm Dưỡng Ẩm Senka Hương Hoa Hồng & Hoa Nhài 500ml,169.000 ₫,142.000 ₫,13,500ml,1
364,208200002,8650,https://hasaki.vn/san-pham/sua-duong-the-vaseline-nang-tong-tuc-thi-200ml-8650.html,Sữa Dưỡng Thể Vaseline Nâng Tông Sáng Da Tức Thì 200ml,92.000 ₫,78.000 ₫,24,200ml,14
