,product_id,data_product_id,link_item,title,original_price,current_price,quantity_sold,product_variant,review_count
365,422216002,114667,https://hasaki.vn/san-pham/combo-dove-sua-tam-duong-the-500g-smoothie-tay-da-chet-huong-hoa-anh-dao-298g-114667.html,Combo Dove Sữa Tắm Dưỡng Thể 500g + Smoothie Tẩy Da Chết Hương Hoa Anh Đào 298g,342.000 ₫,304.000 ₫,6,2 món,
366,422216018,114079,https://hasaki.vn/san-pham/combo-dau-goi-tsubaki-ngan-rung-toc-490ml-sua-tam-senka-hoa-tuoi-mat-500ml-114079.html,Combo Dầu Gội Tsubaki Ngăn Rụng Tóc 490ml + Sữa Tắm Senka Hoa Tươi Mát 500ml,413.000 ₫,307.000 ₫,6,490ml + 500ml,209
367,206200028,28134,https://hasaki.vn/san-pham/lan-khu-mui-cho-nu-nivea-kho-thoang-50ml-28134.html,Lăn Khử Mùi Nivea Comfort Khô Thoáng Cho Nữ 50ml,79.000 ₫,62.000 ₫,29,50ml,2
368,422207357,100789,https://hasaki.vn/san-pham/combo-dau-cham-soc-da-bio-oil-125ml-25ml-100789.html,Combo Dầu Chăm Sóc Da Bio-Oil 125ml + 25ml,420.000 ₫,359.000 ₫,5,125+25ml,71
369,422209188,103357,https://hasaki.vn/san-pham/sua-tam-duong-the-dove-cham-soc-lam-diu-da-nhay-cam-500g-103357.html,Sữa Tắm Dưỡng Thể Dove Chăm Sóc & Làm Dịu Da Nhạy Cảm 500g,142.500 ₫,120.000 ₫,15,500g,11
370,422207218,100571,https://hasaki.vn/san-pham/kem-duong-vacosi-lam-sang-vung-da-duoi-canh-tay-30ml-100571.html,Kem Dưỡng Vacosi Làm Sáng Vùng Da Dưới Cánh Tay 30ml,165.000 ₫,128.000 ₫,14,30ml,1
371,422209692,104285,https://hasaki.vn/san-pham/combo-face-body-hair-3-in-1-wash-dung-dich-ve-sinh-nam-elagent-men-sanda-perfume-gel-rua-mat-nano-curcumin-60s-fresh-104285.html,Combo Nerman Sữa Tắm Gội 350ml + Gel Rửa Mặt 100ml + Dung Dịch Vệ Sinh Nam 100ml,467.000 ₫,421.000 ₫,5,3 món,
372,422211583,107592,https://hasaki.vn/san-pham/xit-khu-mui-romano-huong-nuoc-hoa-gentleman-195ml-107592.html,Xịt Khử Mùi Romano Hương Nước Hoa Gentleman 150ml,100.000 ₫,77.000 ₫,23,150ml,2
373,100080048,3234,https://hasaki.vn/san-pham/lan-khu-mui-serum-sang-min-da-nivea-40ml-3234.html,Lăn Khử Mùi Nivea Serum Dưỡng Da Sáng Mịn 40ml,92.000 ₫,68.000 ₫,26,40ml,1
374,248700051,71077,https://hasaki.vn/san-pham/xit-chong-nang-naris-cosmetics-nang-tone-spf50-pa-80g-71077.html,Xịt Chống Nắng Naris Cosmetics Nâng Tông Da 80g,495.000 ₫,396.000 ₫,5,80g,4
375,422205210,97349,https://hasaki.vn/san-pham/kem-duong-emmie-lam-sang-cho-da-mat-co-the-250ml-97349.html,Kem Dưỡng Emmié Làm Sáng Cho Da Mặt & Cơ Thể 250ml,350.000 ₫,277.000 ₫,7,250ml,4
376,256700009,16856,https://hasaki.vn/san-pham/dau-dua-tinh-khiet-vitamin-e-milaganics-100ml-16856.html,Dầu Dừa Milaganics Tinh Khiết Vitamin E 100ml,117.000 ₫,46.000 ₫,38,100ml,5
377,422215367,112901,https://hasaki.vn/san-pham/duong-chat-giam-ran-da-happy-event-tang-do-dan-hoi-40g-112901.html,Dưỡng Chất Giảm Rạn Da Happy Event Tăng Độ Đàn Hồi 40g + Tặng Khăn Tắm Sợi Tre,495.000 ₫,443.000 ₫,4,40g,
378,422208146,102111,https://hasaki.vn/san-pham/kem-duong-tay-mong-organic-shop-trai-anh-dao-hoa-sen-75ml-102111.html,"Kem Dưỡng Tay & Móng Organic Shop Trái Anh Đào, Hoa Sen 75ml",139.000 ₫,90.000 ₫,20,75ml,6
379,422207038,100223,https://hasaki.vn/san-pham/sua-tam-nuoc-hoa-tesori-d-oriente-hy-lap-co-dai-250ml-100223.html,Sữa Tắm Nước Hoa Tesori d'Oriente Hy Lạp Cổ Đại 250ml,175.000 ₫,148.000 ₫,12,250ml,9
380,422209503,104001,https://hasaki.vn/san-pham/sua-tam-hazeline-sang-min-phuc-hoi-sua-ong-chua-hoa-ly-800g-104001.html,Sữa Tắm Hazeline Sáng Mịn Phục Hồi Sữa Ong Chúa & Hoa Ly 800g,98.000 ₫,82.000 ₫,21,800g,3
381,422204367,95835,https://hasaki.vn/san-pham/sua-tam-double-rich-duong-sang-da-huong-hoa-sen-800g-95835.html,Sữa Tắm Double Rich Glowing Lotus Hương Hoa Sen 800g,159.000 ₫,158.000 ₫,11,800g,7
382,100120062,3072,https://hasaki.vn/san-pham/sua-tam-purite-duong-da-mem-min-huong-hoa-hong-850ml-3072.html,Sữa Tắm Purité Dưỡng Da Mềm Mịn Hương Hoa Hồng 850ml,245.000 ₫,207.000 ₫,9,850ml,12
383,422210975,106245,https://hasaki.vn/san-pham/sap-ngan-mui-nivea-ngoc-trai-dep-quyen-ru-50ml-106245.html,Sáp Khử Mùi Nivea Ngọc Trai Đẹp Quyến Rũ 50ml,99.000 ₫,73.000 ₫,23,50ml,2
384,422208922,102941,https://hasaki.vn/san-pham/serum-duong-the-paula-s-choice-lam-sang-phuc-hoi-da-118ml-102941.html,Serum Dưỡng Thể Paula's Choice Làm Sáng & Phục Hồi Da 118ml,980.000 ₫,823.000 ₫,2,118ml,
385,422212493,108074,https://hasaki.vn/san-pham/combo-dau-kho-da-nang-nuxe-huile-prodigieuse-100ml-florale-10ml-108074.html,Combo Dầu Khô Đa Năng Nuxe Huile Classic 100ml & Hương Hoa Florale 10ml,965.000 ₫,820.000 ₫,2,2 món,
386,422203914,95153,https://hasaki.vn/san-pham/kem-duong-da-tay-hasi-thao-moc-cap-am-phuc-hoi-mong-80g-95153.html,Kem Dưỡng Tay Hasi Thảo Mộc Cấp Ẩm & Phục Hồi Móng 80g,60.000 ₫,51.000 ₫,32,80g,4
387,422205831,98393,https://hasaki.vn/san-pham/sua-tam-nuoc-hoa-gennie-loi-cuon-va-khi-chat-450ml-98393.html,Sữa Tắm Nước Hoa Nữ Gennie Lôi Cuốn & Khí Chất 450ml,159.000 ₫,104.000 ₫,16,Red,7
388,422204024,95445,https://hasaki.vn/san-pham/lan-khu-mui-cho-nam-nivea-men-cool-kick-cool-fresh-50ml-95445.html,Lăn Khử Mùi Nivea Men Mát Lạnh Thơm Sảng Khoái 50ml,86.000 ₫,60.000 ₫,27,50ml,2
389,422209297,103557,https://hasaki.vn/san-pham/lan-khu-mui-co-the-deou-danh-cho-nam-gioi-50ml-103557.html,Lăn Khử Mùi Rohto Deou Dành Cho Nam Giới 50ml (Mới),180.000 ₫,178.000 ₫,9,50ml,
390,303700003,89317,https://hasaki.vn/san-pham/sua-tam-avatar-thom-min-da-jojoba-huong-hoa-350ml-89317.html,Sữa Tắm Avatar Thơm Mịn Da Jojoba Bông Hoa 350ml,93.000 ₫,80.000 ₫,20,350ml,8
391,422205668,98115,https://hasaki.vn/san-pham/gel-tam-old-spice-huong-nang-dong-va-thanh-cong-532ml-98115.html,Gel Tắm Old Spice Hương Năng Động Và Thành Công 532ml,152.000 ₫,134.000 ₫,12,532ml,1
392,422203256,93829,https://hasaki.vn/san-pham/lan-khu-mui-refre-duong-sang-da-huong-tinh-yeu-40ml-93829.html,Lăn Khử Mùi Refre Whitening Perfume Hương Tình Yêu 40ml,62.000 ₫,48.000 ₫,33,40ml,14
393,422209011,103029,https://hasaki.vn/san-pham/xit-khu-mui-x-men-for-boss-intense-huong-tram-noi-luc-150ml-103029.html,Xịt Khử Mùi X-Men For Boss Intense Hương Trầm Nội Lực 150ml,117.000 ₫,93.000 ₫,17,150ml,1
394,206400027,88635,https://hasaki.vn/san-pham/sua-tam-olay-duong-am-hoa-lan-va-qua-ly-650ml-88635.html,Sữa Tắm Olay Tươi Mát Dài Lâu Với Hoa Lan & Quả Lý 650ml,190.000 ₫,163.000 ₫,10,650ml,9
395,422211582,107590,https://hasaki.vn/san-pham/xit-khu-mui-romano-huong-nuoc-hoa-attitude-195ml-107590.html,Xịt Khử Mùi Romano Hương Nước Hoa Attitude 150ml,100.000 ₫,82.000 ₫,20,150ml,2
396,331300014,71125,https://hasaki.vn/san-pham/sua-duong-toan-than-curel-cap-am-chuyen-sau-220ml-71125.html,Sữa Dưỡng Toàn Thân Curél Cấp Ẩm Chuyên Sâu 220ml,441.000 ₫,264.000 ₫,6,220ml,1
397,422202136,92353,https://hasaki.vn/san-pham/sua-tam-hat-on-the-body-huong-hoa-hong-muoi-bien-600g-92353.html,Sữa Tắm Hạt On: The Body Hương Hoa Hồng Pháp 600g,328.000 ₫,239.000 ₫,7,600g,2
398,422204021,95439,https://hasaki.vn/san-pham/sua-duong-the-nivea-duong-sang-da-vitamin-c-a-180ml-95439.html,Sữa Dưỡng Thể Nivea Dưỡng Sáng Da Vitamin C & A 180ml,129.000 ₫,125.000 ₫,13,180ml,3
399,422202043,92249,https://hasaki.vn/san-pham/bo-doi-cocoon-gel-tam-bi-dao-tay-da-chet-toan-than-92249.html,Combo Cocoon Gel Tắm Bí Đao 310ml + Tẩy Da Chết Toàn Thân Cà Phê Đắk Lắk 200ml,360.000 ₫,306.000 ₫,5,2món,
400,422216003,114669,https://hasaki.vn/san-pham/combo-dove-sua-tam-duong-the-am-min-500g-smoothie-tay-da-chet-huong-luu-do-298g-114669.html,Combo Dove Sữa Tắm Dưỡng Thể Hương Anh Đào 500g + Smoothie Tẩy Da Chết Hương Lựu Đỏ 298g,342.000 ₫,304.000 ₫,5,2 món,
401,422206462,99329,https://hasaki.vn/san-pham/lan-khu-mui-cho-nu-rexona-free-spirit-huong-thao-moc-50ml-99329.html,Lăn Khử Mùi Rexona Hương Thảo Mộc Thư Giãn Cho Nữ 50ml,55.000 ₫,47.000 ₫,32,50ml,3
402,100120060,17883,https://hasaki.vn/san-pham/sua-tam-purite-by-provence-hoa-oai-huong-850ml-17883.html,Sữa Tắm Purité Thư Giãn Da Hương Hoa Oải Hương 850ml,245.000 ₫,198.000 ₫,8,850ml,12
403,422209014,103035,https://hasaki.vn/san-pham/xit-khu-mui-x-men-for-boss-legend-huong-tinh-te-150ml-103035.html,Xịt Khử Mùi X-Men For Boss Legend Hương Tinh Tế 150ml,117.000 ₫,93.000 ₫,16,150ml,1
404,393800021,84869,https://hasaki.vn/san-pham/kem-duong-tay-frudia-chiet-xuat-qua-mam-xoi-30ml-84869.html,Kem Dưỡng Da Tay Frudia Chiết Xuất Quả Mâm Xôi 30ml,72.000 ₫,49.000 ₫,30,30ml,12
405,422206650,99639,https://hasaki.vn/san-pham/combo-2-sua-duong-the-vaseline-nang-tong-sang-da-tuc-thi-350mlx2-99639.html,Combo 2 Sữa Dưỡng Thể Vaseline Nâng Tông Sáng Da Tức Thì 350mlx2,286.000 ₫,242.000 ₫,6,2x350ml,79
406,334900013,69974,https://hasaki.vn/san-pham/lan-khu-mui-refre-chiet-xuat-huong-thao-40ml-69974.html,Lăn Khử Mùi Refre Natural Chiết Xuất Hương Thảo 40ml,65.000 ₫,50.000 ₫,29,40ml,5
407,422206466,99337,https://hasaki.vn/san-pham/xit-khu-mui-cho-nu-rexona-shower-clean-mat-lanh-150ml-99337.html,Xịt Khử Mùi Rexona Cho Nữ Shower Clean Mát Lạnh 150ml,90.500 ₫,85.000 ₫,17,150ml,1
408,422212919,108752,https://hasaki.vn/san-pham/kem-tay-long-cleo-chiet-xuat-bo-cong-thuc-dot-pha-50g-108752.html,Kem Tẩy Lông Cleo Chiết Xuất Bơ Công Thức Đột Phá 50g,86.000 ₫,76.000 ₫,19,50g,1
409,422211565,107566,https://hasaki.vn/san-pham/sap-khu-mui-enchanteur-sang-da-charming-40g-107566.html,Sáp Khử Mùi Enchanteur Sáng Da Charming 40g,84.000 ₫,72.000 ₫,20,40g,2
410,422206641,99631,https://hasaki.vn/san-pham/sua-duong-bio-oil-body-lotion-duong-am-toan-than-250ml-99631.html,Sữa Dưỡng Thể Bio-Oil Dưỡng Ẩm Toàn Thân 250ml,295.000 ₫,285.000 ₫,5,250ml,
411,422205978,98549,https://hasaki.vn/san-pham/sua-duong-the-nivea-duong-am-da-chuyen-sau-600ml-98549.html,Sữa Dưỡng Thể Nivea Dưỡng Ẩm Chuyên Sâu 48H 550ml,189.000 ₫,183.000 ₫,8,550ml,7
412,422202921,93411,https://hasaki.vn/san-pham/tay-te-bao-chet-felina-dang-muoi-tinh-chat-sua-500g-93411.html,Muối Tắm Tẩy Tế Bào Chết Felina Tinh Chất Sữa 500g,140.000 ₫,109.000 ₫,13,500g,162
413,422208252,102639,https://hasaki.vn/san-pham/lan-khu-mui-x-men-for-boss-luxury-50ml-102639.html,Lăn Khử Mùi X-Men For Boss Luxury Sang Trọng Tinh Tế 50ml,79.000 ₫,61.000 ₫,23,50ml,1
414,422215147,112713,https://hasaki.vn/san-pham/xit-khu-mui-romano-vip-huong-passion-150ml-112713.html,Xịt Khử Mùi Romano Vip Hương Passion 150ml,117.000 ₫,93.000 ₫,16,150ml,1
415,422208311,102311,https://hasaki.vn/san-pham/sua-tam-hazeline-yen-mach-dau-tam-sang-min-duong-am-900g-102311.html,Sữa Tắm Hazeline Sáng Mịn Dưỡng Ẩm Yến Mạch & Dâu Tằm Túi 900g,102.000 ₫,83.000 ₫,17,900g,3
416,422211266,106773,https://hasaki.vn/san-pham/dao-cao-cho-nu-gilette-venus-smooth-3-luoi-vi-1-cai-106773.html,Dao Cạo Cho Nữ Gillette Venus Smooth 2UP (1 Cán + 2 Lưỡi),186.000 ₫,173.000 ₫,9,1 cái,2
417,334900008,70311,https://hasaki.vn/san-pham/lan-khu-mui-refre-whitening-huong-sang-trong-40ml-70311.html,Lăn Khử Mùi Refre Whitening Perfume Hương Sang Trọng 40ml,62.000 ₫,48.000 ₫,29,40ml,14
418,422205832,98391,https://hasaki.vn/san-pham/sua-tam-nuoc-hoa-nu-gennie-kieu-ky-diu-dang-450ml-98391.html,Sữa Tắm Nước Hoa Nữ Gennie Kiêu Kỳ & Dịu Dàng 450ml,159.000 ₫,104.000 ₫,14,Rose,7
419,422209792,104353,https://hasaki.vn/san-pham/combo-cocoon-lam-sach-da-chet-va-duong-am-co-the-tu-ca-phe-104353.html,Combo Cocoon Làm Sạch Da Chết Và Dưỡng Ẩm Cơ Thể Từ Cà Phê,380.000 ₫,304.000 ₫,5,2 món,
420,422202710,93111,https://hasaki.vn/san-pham/sua-duong-the-malissa-kiss-sang-da-crazy-in-love-226g-93111.html,Sữa Dưỡng Thể Malissa Kiss Sáng Da #Crazy In Love 226g,189.000 ₫,141.000 ₫,10,226g,10
421,208200006,8689,https://hasaki.vn/san-pham/sua-duong-the-vaseline-sang-da-chong-nang-ngua-o-nhiem-spf24-pa-200ml-8689.html,Sữa Dưỡng Thể Vaseline Sáng Da Chống Nắng Và Ô Nhiễm 200ml,92.000 ₫,78.000 ₫,18,200ml,14
422,422208241,102267,https://hasaki.vn/san-pham/duong-the-chong-nang-malissa-kiss-huong-nuoc-hoa-delight-200g-102267.html,Dưỡng Thể Chống Nắng Malissa Kiss Hương Nước Hoa Delight 200g,189.000 ₫,161.000 ₫,9,200g,5
423,422205587,98337,https://hasaki.vn/san-pham/sua-duong-the-huong-nuoc-hoa-cathy-doll-bare-heart-150ml-98337.html,Sữa Dưỡng Thể Cathy Doll Hương Nước Hoa Bare Heart 150ml,179.000 ₫,162.000 ₫,9,150ml,3
424,422211151,106487,https://hasaki.vn/san-pham/combo-2-sua-duong-the-vaseline-bao-ve-sang-min-ban-ngay-330ml-106487.html,Combo 2 Sữa Dưỡng Thể Vaseline Bảo Vệ Sáng Mịn Ban Ngày 330ml,300.000 ₫,239.000 ₫,6,2 x 330ml,16
425,334900005,70263,https://hasaki.vn/san-pham/lan-khu-mui-refre-huong-ngot-ngao-40ml-70263.html,Lăn Khử Mùi Refre Whitening Perfume Hương Ngọt Ngào 40ml,62.000 ₫,48.000 ₫,28,40ml,14
426,422208145,102109,https://hasaki.vn/san-pham/kem-duong-tay-mong-organic-shop-ngoc-lan-tay-burity-75ml-102109.html,"Kem Dưỡng Tay & Móng Organic Shop Ngọc Lan Tây, Burity 75ml",139.000 ₫,119.000 ₫,12,75ml,6
427,422201173,91355,https://hasaki.vn/san-pham/sua-tam-nuoc-hoa-nu-parisian-lux-for-her-265ml-91355.html,Sữa Tắm Parisian Nước Hoa Nữ - Lux For Her 265ml,109.000 ₫,71.000 ₫,19,265ml,9
428,422216674,115081,https://hasaki.vn/san-pham/combo-lan-khu-mui-sang-min-mo-tham-50ml-huong-hoa-hong-hokkaido-40ml-115081.html,Combo Lăn Khử Mùi Sáng Mịn Mờ Thâm 50ml & Hương Hoa Hồng Hokkaido 40ml,200.000 ₫,191.000 ₫,7,2 món,1
429,206800010,7787,https://hasaki.vn/san-pham/sua-duong-the-purite-mem-min-huong-hoa-hong-250ml-7787.html,Sữa Dưỡng Thể Purité Mềm Mịn Hương Hoa Hồng 250ml,123.000 ₫,109.000 ₫,12,250ml,12
430,422209571,104123,https://hasaki.vn/san-pham/sua-tam-de-memoria-sang-da-huong-rose-on-venus-300ml-104123.html,Sữa Tắm De Memoria Sáng Da Hương Rose On Venus 300ml,550.000 ₫,325.000 ₫,4,300ml,
431,422202918,93417,https://hasaki.vn/san-pham/tay-te-bao-chet-felina-dang-muoi-tu-hoa-mau-don-500g-93417.html,Muối Tắm Tẩy Tế Bào Chết Felina Từ Hoa Mẫu Đơn 500g,140.000 ₫,109.000 ₫,12,500g,162
432,422207039,100241,https://hasaki.vn/san-pham/sua-tam-nuoc-hoa-tesori-d-oriente-huong-ayurveda-250ml-100241.html,Sữa Tắm Nước Hoa Tesori d'Oriente Hương Ayurveda 250ml,175.000 ₫,148.000 ₫,9,250ml,9
433,100120055,3062,https://hasaki.vn/san-pham/sua-tam-purite-duong-da-mem-min-huong-hoa-hong-250ml-3062.html,Sữa Tắm Purité Dưỡng Da Mềm Mịn Hương Hoa Hồng 250ml,77.000 ₫,68.000 ₫,19,250ml,12
434,422211636,107614,https://hasaki.vn/san-pham/dau-tam-goi-romano-2-trong-1-danh-cho-nam-attitude-650g-107614.html,Tắm Gội 2 Trong 1 Romano Hương Nước Hoa Attitude 650g,175.000 ₫,144.000 ₫,9,650g,
435,226200026,69924,https://hasaki.vn/san-pham/xa-phong-ho-tro-khang-khuan-va-ngan-ngua-mun-acnes-75g-69924.html,Xà Phòng Acnes Hỗ Trợ Kháng Khuẩn Và Ngăn Ngừa Mụn 75g,70.000 ₫,60.000 ₫,22,75g,6
436,100080038,3204,https://hasaki.vn/san-pham/lan-khu-mui-cho-nam-nivea-men-kho-thoang-48-gio-50ml-3204.html,Lăn Khử Mùi Nivea Men Khô Thoáng Da Vượt Trội 50ml,72.000 ₫,43.000 ₫,30,50ml,3
437,422204774,96487,https://hasaki.vn/san-pham/xa-phong-dokudami-cho-mat-toan-than-chiet-xuat-diep-ca-130g-96487.html,Xà Phòng Chinoshio Dokudami Cho Mặt & Toàn Thân 130g,59.000 ₫,47.000 ₫,27,130g,2
438,422211579,107630,https://hasaki.vn/san-pham/lan-khu-mui-romano-huong-nuoc-hoa-gentleman-50ml-107630.html,Lăn Khử Mùi Romano Hương Nước Hoa Gentleman 50ml,65.000 ₫,51.000 ₫,25,50ml,2
439,422203390,93995,https://hasaki.vn/san-pham/lan-khu-mui-etiaxil-ngan-mo-hoi-chuyen-biet-50ml-93995.html,Lăn Khử Mùi Etiaxil Ngăn Mồ Hôi Chuyên Biệt 50ml,249.000 ₫,209.000 ₫,6,50ml,1
440,422202709,93109,https://hasaki.vn/san-pham/sua-duong-the-malissa-kiss-sang-da-lost-in-paradise-226g-93109.html,Sữa Dưỡng Thể Malissa Kiss Sáng Da #Lost In Paradise 226g,189.000 ₫,161.000 ₫,8,226g,10
441,422202532,92897,https://hasaki.vn/san-pham/kem-tay-long-eveline-tu-lo-hoi-cho-da-nhay-cam-125ml-92897.html,Kem Tẩy Lông Eveline Từ Lô Hội Cho Da Nhạy Cảm 125ml,169.000 ₫,119.000 ₫,11,125ml,6
442,422200887,90959,https://hasaki.vn/san-pham/combo-vichy-lan-khu-mui-50ml-xit-khoang-duong-da-50ml-90959.html,Combo Vichy Lăn Khử Mùi 50ml + Xịt Khoáng Dưỡng Da 50ml,387.000 ₫,309.000 ₫,4,2món,
443,256700006,16880,https://hasaki.vn/san-pham/bot-yen-mach-milaganics-100g-16880.html,Bột Yến Mạch Milaganics Ngăn Ngừa Lão Hóa & Mụn 100g (Túi),32.000 ₫,21.000 ₫,59,100g,2
444,393800037,87879,https://hasaki.vn/san-pham/kem-duong-da-tay-frudia-chiet-xuat-buoi-30ml-87879.html,Kem Dưỡng Da Tay Frudia Chiết Xuất Bưởi 30ml,72.000 ₫,49.000 ₫,25,30ml,33
445,393800036,87869,https://hasaki.vn/san-pham/kem-duong-da-tay-frudia-chiet-xuat-qua-mong-30ml-87869.html,Kem Dưỡng Da Tay Frudia Chiết Xuất Quả Mọng 30ml,72.000 ₫,49.000 ₫,25,30ml,33
446,422210973,106249,https://hasaki.vn/san-pham/sap-ngan-mui-nam-nivea-men-mat-lanh-50ml-106249.html,Sáp Khử Mùi Nivea Men Cho Nam Mát Lạnh 50ml,109.000 ₫,76.000 ₫,16,50ml,1
447,422211592,107602,https://hasaki.vn/san-pham/sua-tam-romano-huong-nuoc-hoa-classic-650g-107602.html,Sữa Tắm Romano Hương Nước Hoa Classic 650g,175.000 ₫,136.000 ₫,9,650g,
448,422208247,102631,https://hasaki.vn/san-pham/lan-khu-mui-x-men-for-boss-intense-huong-tram-noi-luc-50ml-102631.html,Lăn Khử Mùi X-Men For Boss Intense Hương Trầm Nội Lực 50ml,79.000 ₫,63.000 ₫,19,50ml,1
449,422211560,112705,https://hasaki.vn/san-pham/xit-khu-mui-enchanteur-huong-nuoc-hoa-charming-150ml-112705.html,Xịt Khử Mùi Enchanteur Hương Nước Hoa Charming 150ml,96.000 ₫,95.000 ₫,13,150ml,1
450,100020011,3213,https://hasaki.vn/san-pham/kem-tay-long-byphasse-chiet-xuat-to-tam-125ml-3213.html,Kem Tẩy Lông Byphasse Chiết Xuất Tơ Tằm 125ml,190.000 ₫,119.000 ₫,10,125ml,7
451,422208240,102269,https://hasaki.vn/san-pham/duong-the-chong-nang-malissa-kiss-huong-nuoc-hoa-hottie-200g-102269.html,Dưỡng Thể Chống Nắng Malissa Kiss Hương Nước Hoa Hottie 200g,189.000 ₫,152.000 ₫,8,200g,5
452,422209661,104243,https://hasaki.vn/san-pham/bo-sua-tam-va-duong-the-de-memoria-huong-rose-on-venus-2x300ml-104243.html,Bộ Sữa Tắm Và Dưỡng Thể De Memoria Hương Rose On Venus 2x300ml,1.100.000 ₫,590.000 ₫,2,2x300ml,
453,422210832,106061,https://hasaki.vn/san-pham/kem-chong-nang-australis-pho-rong-bao-ve-toan-dien-125ml-106061.html,Kem Chống Nắng Australis Phổ Rộng Hương Trái Thơm 125ml,363.000 ₫,290.000 ₫,4,125ml,11
454,422203254,93831,https://hasaki.vn/san-pham/lan-khu-mui-refre-natural-chiet-xuat-huong-go-40ml-93831.html,Lăn Khử Mùi Refre Natural Chiết Xuất Hương Gỗ 40ml,65.000 ₫,50.000 ₫,23,40ml,5
455,422211580,107586,https://hasaki.vn/san-pham/xit-khu-mui-romano-huong-nuoc-hoa-classic-195ml-107586.html,Xịt Khử Mùi Romano Hương Nước Hoa Classic 150ml,100.000 ₫,86.000 ₫,14,150ml,1
456,422201169,91587,https://hasaki.vn/san-pham/tay-da-chet-toan-than-organic-shop-huong-mam-xoi-250ml-91587.html,Tẩy Da Chết Toàn Thân Organic Shop Hương Mâm Xôi 250ml,169.000 ₫,109.000 ₫,11,250ml,29
457,422204614,96207,https://hasaki.vn/san-pham/sua-tam-rohto-deou-lam-sach-khu-mui-mat-lanh-cho-nam-520ml-96207.html,"Sữa Tắm Rohto Deou Làm Sạch, Khử Mùi Mát Lạnh Cho Nam 520ml",280.000 ₫,225.000 ₫,5,520ml,
458,422211557,107560,https://hasaki.vn/san-pham/lan-khu-mui-enchanteur-sang-da-sensation-50ml-107560.html,Lăn Khử Mùi Enchanteur Sáng Da Sensation 50ml,90.000 ₫,77.000 ₫,15,50ml,1
459,422206189,98833,https://hasaki.vn/san-pham/sua-duong-the-cathy-doll-duong-sang-mo-tham-450ml-98833.html,"Sữa Dưỡng Thể Cathy Doll Dưỡng Sáng, Mờ Thâm 450ml",156.000 ₫,159.000 ₫,7,450ml,19
460,422211629,107622,https://hasaki.vn/san-pham/sua-tam-enchanteur-dang-gel-duong-da-huong-hoa-hong-510g-107622.html,Sữa Tắm Enchanteur Dưỡng Da Thiên Nhiên Hoa Hồng 510g,59.000 ₫,134.000 ₫,9,510g,1
461,334900007,70299,https://hasaki.vn/san-pham/lan-khu-mui-refre-whitening-huong-phan-thom-40ml-70299.html,Lăn Khử Mùi Refre Whitening Perfume Hương Phấn Thơm 40ml,125.000 ₫,48.000 ₫,23,40ml,14
462,206200071,86295,https://hasaki.vn/san-pham/xit-ngan-mui-nivea-serum-duong-sang-da-huong-hoa-lily-150ml-86295.html,Xịt Khử Mùi Nivea Serum Dưỡng Sáng Da Hương Hoa Lily 150ml,189.000 ₫,121.000 ₫,9,150ml,3
463,422205502,97805,https://hasaki.vn/san-pham/sua-duong-the-malissa-kiss-sang-da-sweet-poison-226g-97805.html,Sữa Dưỡng Thể Malissa Kiss Sáng Da #Sweet Poison 226g,84.000 ₫,152.000 ₫,8,226g,2
464,422211567,107570,https://hasaki.vn/san-pham/sap-khu-mui-enchanteur-sang-da-delightful-40g-107570.html,Sáp Khử Mùi Enchanteur Sáng Da Delightful 40g,278.000 ₫,72.000 ₫,15,40g,1
465,422209695,104291,https://hasaki.vn/san-pham/combo-nerman-dung-dich-ve-sinh-nam-sanda-perfume-100ml-xit-thom-mieng-cool-smile-10ml-104291.html,Combo Nerman Dung Dịch Vệ Sinh Nam Sanda Perfume + Xịt Thơm Miệng Cool Smile,150.000 ₫,269.000 ₫,4,2 món,
466,422204623,96223,https://hasaki.vn/san-pham/sua-tam-st-ives-chiet-xuat-mo-tay-te-bao-chet-473ml-96223.html,Sữa Tắm St.Ives Tẩy Tế Bào Chết Hương Mơ 473ml,209.000 ₫,150.000 ₫,8,473ml,14
467,422204620,96217,https://hasaki.vn/san-pham/sua-tam-st-ives-yen-mach-bo-hat-mo-duong-am-da-473ml-96217.html,Sữa Tắm St.Ives Dưỡng Ẩm Da Yến Mạch & Bơ Hạt Mỡ 473ml,245.000 ₫,128.000 ₫,9,473ml,14
468,422211696,107055,https://hasaki.vn/san-pham/kem-tam-tay-te-bao-chet-felina-ca-phe-tinh-dau-dua-400g-107055.html,Kem Tắm Tẩy Tế Bào Chết Felina Cà Phê & Tinh Dầu Dừa 400g,213.000 ₫,175.000 ₫,6,400g,45
469,309300012,56821,https://hasaki.vn/san-pham/kem-chong-nang-cathy-doll-sang-da-spf50-pa-138ml-56821.html,Kem Chống Nắng Cathy Doll Sáng Da SPF50/PA+++ 138ml,190.000 ₫,159.000 ₫,7,138ml,2
470,422207216,100569,https://hasaki.vn/san-pham/sua-tam-purite-duong-da-mem-min-huong-hoa-linh-lan-850ml-100569.html,Sữa Tắm Purité Dưỡng Da Mềm Mịn Hương Hoa Linh Lan 850ml,392.000 ₫,217.000 ₫,5,850ml,12
471,422202747,93187,https://hasaki.vn/san-pham/sua-tam-naris-duong-am-da-huong-cam-quyt-650ml-93187.html,Sữa Tắm Naris Dưỡng Ẩm Da Hương Cam Quýt 550ml,595.000 ₫,594.000 ₫,2,550ml,2
472,422205504,97801,https://hasaki.vn/san-pham/sua-duong-the-malissa-kiss-sang-da-call-me-maybe-226g-97801.html,Sữa Dưỡng Thể Malissa Kiss Sáng Da #Call Me Maybe 226g,189.000 ₫,161.000 ₫,7,226g,2
473,422211628,107620,https://hasaki.vn/san-pham/sua-tam-enchanteur-dang-gel-duong-da-huong-hoa-iris-510g-107620.html,Sữa Tắm Enchanteur Dưỡng Da Thiên Nhiên Hoa Iris 510g,156.000 ₫,134.000 ₫,8,510g,1
474,422211698,107053,https://hasaki.vn/san-pham/kem-tam-tay-te-bao-chet-felina-ca-phe-tinh-chat-sua-400g-107053.html,Kem Tắm Tẩy Tế Bào Chết Felina Cà Phê & Tinh Chất Sữa 400g,209.000 ₫,166.000 ₫,6,400g,45
475,422205592,98345,https://hasaki.vn/san-pham/sua-duong-the-huong-nuoc-hoa-cathy-doll-white-moon-150ml-98345.html,Sữa Dưỡng Thể Cathy Doll Hương Nước Hoa White Moon 150ml,179.000 ₫,162.000 ₫,7,150ml,3
476,422208305,102413,https://hasaki.vn/san-pham/kem-duong-toan-than-felina-sang-da-tu-tinh-chat-sua-250g-102413.html,Kem Dưỡng Toàn Thân Felina Sáng Da Từ Tinh Chất Sữa 250g,249.000 ₫,247.000 ₫,4,250g,21
477,422207234,100595,https://hasaki.vn/san-pham/dau-tam-bioderma-lam-sach-lam-diu-da-kho-nhay-cam-200ml-100595.html,"Dầu Tắm Bioderma Làm Sạch & Làm Dịu Da Khô, Nhạy Cảm 200ml",365.000 ₫,329.000 ₫,3,200ml,2
478,422209375,103627,https://hasaki.vn/san-pham/combo-2-tay-da-chet-toan-than-cocoon-duong-thot-not-an-giang-200ml-103627.html,Combo 2 Tẩy Da Chết Toàn Thân Cocoon Đường Thốt Nốt An Giang 200ml,330.000 ₫,280.000 ₫,4,2x200ml,2
479,422205590,98341,https://hasaki.vn/san-pham/sua-duong-the-huong-nuoc-hoa-cathy-doll-merry-go-round-150ml-98341.html,Sữa Dưỡng Thể Cathy Doll Nước Hoa Merry Go Round 150ml,179.000 ₫,162.000 ₫,7,150ml,3
480,422209197,103403,https://hasaki.vn/san-pham/mini-sua-duong-the-cerave-cho-da-kho-den-rat-kho-20ml-103403.html,[Mini] Sữa Dưỡng Thể CeraVe Cho Da Khô Đến Rất Khô 20ml,41.000 ₫,25.000 ₫,39,20ml,3
481,422203916,95157,https://hasaki.vn/san-pham/kem-duong-tay-hasi-thao-moc-duong-sang-da-tay-mong-80g-95157.html,Kem Dưỡng Tay Hasi Thảo Mộc Dưỡng Sáng Da Tay & Móng 80g,60.000 ₫,51.000 ₫,19,80g,4
482,208200024,88619,https://hasaki.vn/san-pham/sua-duong-the-vaseline-diu-mat-sang-da-200ml-88619.html,Sữa Dưỡng Thể Vaseline Dịu Mát Sáng Da 200ml,98.000 ₫,79.000 ₫,13,200ml,14
483,397400002,85125,https://hasaki.vn/san-pham/tay-te-bao-chet-toan-than-tree-hut-chiet-xuat-hoa-hong-510g-85125.html,Tẩy Tế Bào Chết Toàn Thân Tree Hut Hoa Hồng 510g,440.000 ₫,347.000 ₫,3,510g,13
484,422210412,105731,https://hasaki.vn/san-pham/sua-tam-jmella-huong-cam-quyt-va-mau-don-sang-trong-500ml-105731.html,Sữa Tắm Jmella Hương Cam Quýt Và Mẫu Đơn Sang Trọng 500ml,170.000 ₫,119.000 ₫,8,500ml,
