,link_item,data_product_id_list,data_product_id,name_comment,content_comment,product_variant,datetime_comment,rating
1274,https://hasaki.vn/san-pham/mat-na-naruko-y-di-nhan-do-duong-sang-da-25ml-moi-92613.html,"['97279', '97275', '73471', '55822', '55867', '97277', '97271', '97273', '92613', '55873', '55801', '55792']",92613,Ngô Thị Mỹ Dung,"SỬ DỤNG DỄ DÀNG, RẤT THOẢI MÁI, THƯ GIÃN TỘT ĐỘ.",Hộp 8 Miếng Mặt Nạ Naruko Tràm Trà Kiềm Dầu Giảm Mụn 26ml/M,17: 16 | 02/05/2023,5.0
1275,https://hasaki.vn/san-pham/mat-na-naruko-y-di-nhan-do-duong-sang-da-25ml-moi-92613.html,"['97279', '97275', '73471', '55822', '55867', '97277', '97271', '97273', '92613', '55873', '55801', '55792']",92613,Lê Thị Long,"Sử dụng dễ dàng , rất thoải mái , thư giãn tột độ",Hộp 8 Miếng Mặt Nạ Naruko Tràm Trà Kiềm Dầu Giảm Mụn 26ml/M,13: 43 | 04/05/2023,5.0
1276,https://hasaki.vn/san-pham/mat-na-naruko-y-di-nhan-do-duong-sang-da-25ml-moi-92613.html,"['97279', '97275', '73471', '55822', '55867', '97277', '97271', '97273', '92613', '55873', '55801', '55792']",92613,Dieu Hien Nguyen Thi,"SỬ DỤNG DỄ DÀNG, RẤT THOẢI MÁI, THƯ GIÃN TỘT ĐỘ.",Hộp 8 Miếng Mặt Nạ Naruko Tràm Trà Kiềm Dầu Giảm Mụn 26ml/M,13: 25 | 04/05/2023,5.0
1277,https://hasaki.vn/san-pham/mat-na-naruko-y-di-nhan-do-duong-sang-da-25ml-moi-92613.html,"['97279', '97275', '73471', '55822', '55867', '97277', '97271', '97273', '92613', '55873', '55801', '55792']",92613,Nguyễn thị nga,Sử dụng dẽ dàng thoải mái tột độ,Hộp 8 Miếng Mặt Nạ Naruko Tràm Trà Kiềm Dầu Giảm Mụn 26ml/M,13: 15 | 04/05/2023,5.0
1278,https://hasaki.vn/san-pham/mat-na-naruko-y-di-nhan-do-duong-sang-da-25ml-moi-92613.html,"['97279', '97275', '73471', '55822', '55867', '97277', '97271', '97273', '92613', '55873', '55801', '55792']",92613,ĐẶNG QUỐC VIỆT,"Quá tuyệt với luôn, hết sạch nhờn với mụn luôn",Hộp 8 Miếng Mặt Nạ Naruko Tràm Trà Kiềm Dầu Giảm Mụn 26ml/M,12: 56 | 04/05/2023,5.0
1279,https://hasaki.vn/san-pham/mat-na-naruko-y-di-nhan-do-duong-sang-da-25ml-moi-92613.html,"['97279', '97275', '73471', '55822', '55867', '97277', '97271', '97273', '92613', '55873', '55801', '55792']",92613,Linh Bùi thị thùy,"Sử dụng dễ dàng, rất thoải mái,thư giãn tột độ.",Hộp 8 Miếng Mặt Nạ Naruko Tràm Trà Kiềm Dầu Giảm Mụn 26ml/M,10: 44 | 04/05/2023,5.0
1280,https://hasaki.vn/san-pham/mat-na-naruko-y-di-nhan-do-duong-sang-da-25ml-moi-92613.html,"['97279', '97275', '73471', '55822', '55867', '97277', '97271', '97273', '92613', '55873', '55801', '55792']",92613,Hoàng Thu Teang,"Sử dụng dễ dàng, rất thoải mái,thư giãn tột độ.",Hộp 8 Miếng Mặt Nạ Naruko Tràm Trà Kiềm Dầu Giảm Mụn 26ml/M,10: 30 | 04/05/2023,5.0
1281,https://hasaki.vn/san-pham/mat-na-naruko-y-di-nhan-do-duong-sang-da-25ml-moi-92613.html,"['97279', '97275', '73471', '55822', '55867', '97277', '97271', '97273', '92613', '55873', '55801', '55792']",92613,Bùi Thị Suất,"Sử dụng dễ dàng, rất thoải mái,thư giãn tột độ.",Hộp 8 Miếng Mặt Nạ Naruko Tràm Trà Kiềm Dầu Giảm Mụn 26ml/M,10: 05 | 04/05/2023,5.0
1282,https://hasaki.vn/san-pham/mat-na-naruko-y-di-nhan-do-duong-sang-da-25ml-moi-92613.html,"['97279', '97275', '73471', '55822', '55867', '97277', '97271', '97273', '92613', '55873', '55801', '55792']",92613,Phạm Hồng Kiều,"Sử dụng dễ dàng rất thoải mái , thư giãn tột độ",Hộp 8 Miếng Mặt Nạ Naruko Tràm Trà Kiềm Dầu Giảm Mụn 26ml/M,19: 38 | 03/05/2023,5.0
1283,https://hasaki.vn/san-pham/mat-na-naruko-y-di-nhan-do-duong-sang-da-25ml-moi-92613.html,"['97279', '97275', '73471', '55822', '55867', '97277', '97271', '97273', '92613', '55873', '55801', '55792']",92613,Nguyễn Khánh Linh,"Giá thành rẻ , đắp thư giãn rất ok ạ, công dụng ko ngờ tới luôn ạ",Hộp 8 Miếng Mặt Nạ Naruko Tràm Trà Kiềm Dầu Giảm Mụn 26ml/M,17: 55 | 03/05/2023,5.0
1284,https://hasaki.vn/san-pham/mat-na-naruko-y-di-nhan-do-duong-sang-da-25ml-moi-92613.html,"['97279', '97275', '73471', '55822', '55867', '97277', '97271', '97273', '92613', '55873', '55801', '55792']",92613,Đàm thị Hải,"Sử dụng rễ dàng ,rất thoải mái,thư giãn tột độ",Hộp 8 Miếng Mặt Nạ Naruko Tràm Trà Kiềm Dầu Giảm Mụn 26ml/M,17: 45 | 03/05/2023,5.0
1285,https://hasaki.vn/san-pham/mat-na-naruko-y-di-nhan-do-duong-sang-da-25ml-moi-92613.html,"['97279', '97275', '73471', '55822', '55867', '97277', '97271', '97273', '92613', '55873', '55801', '55792']",92613,Le Cuong,sử dụng dễ dàng.rất thoải mái.thư giãn tột độ,Hộp 8 Miếng Mặt Nạ Naruko Tràm Trà Kiềm Dầu Giảm Mụn 26ml/M,20: 25 | 04/05/2023,5.0
1286,https://hasaki.vn/san-pham/mat-na-naruko-y-di-nhan-do-duong-sang-da-25ml-moi-92613.html,"['97279', '97275', '73471', '55822', '55867', '97277', '97271', '97273', '92613', '55873', '55801', '55792']",92613,Nguyễn Thưởng,"Sử dụng dễ dàng , mùi hương dễ chịu , thư giãn tột độ",Hộp 8 Miếng Mặt Nạ Naruko Tràm Trà Kiềm Dầu Giảm Mụn 26ml/M,20: 11 | 04/05/2023,5.0
1287,https://hasaki.vn/san-pham/mat-na-naruko-y-di-nhan-do-duong-sang-da-25ml-moi-92613.html,"['97279', '97275', '73471', '55822', '55867', '97277', '97271', '97273', '92613', '55873', '55801', '55792']",92613,Vy,"Sử sụng dễ dàng, rất thoải mái, thư giãn tột độ.",Hộp 8 Miếng Mặt Nạ Naruko Tràm Trà Kiềm Dầu Giảm Mụn 26ml/M Đã mua hàng online,19: 34 | 04/05/2023,5.0
1288,https://hasaki.vn/san-pham/mat-na-naruko-y-di-nhan-do-duong-sang-da-25ml-moi-92613.html,"['97279', '97275', '73471', '55822', '55867', '97277', '97271', '97273', '92613', '55873', '55801', '55792']",92613,Maii Anhh,"SỬ DỤNG DỄ DÀNG, RẤT THOẢI MÁI, THƯ GIÃN TỘT ĐỘ.",Hộp 8 Miếng Mặt Nạ Naruko Tràm Trà Kiềm Dầu Giảm Mụn 26ml/M,18: 44 | 04/05/2023,5.0
1289,https://hasaki.vn/san-pham/mat-na-naruko-y-di-nhan-do-duong-sang-da-25ml-moi-92613.html,"['97279', '97275', '73471', '55822', '55867', '97277', '97271', '97273', '92613', '55873', '55801', '55792']",92613,Phạm Thanh Trường,"SỬ DỤNG DỄ DÀNG, RẤT THOẢI MÁI, THƯ GIÃN TỘT ĐỘ.",Hộp 8 Miếng Mặt Nạ Naruko Tràm Trà Kiềm Dầu Giảm Mụn 26ml/M,18: 38 | 04/05/2023,5.0
1290,https://hasaki.vn/san-pham/mat-na-naruko-y-di-nhan-do-duong-sang-da-25ml-moi-92613.html,"['97279', '97275', '73471', '55822', '55867', '97277', '97271', '97273', '92613', '55873', '55801', '55792']",92613,Trần Bichd,"SỬ DỤNG DỄ DÀNG, RẤT THOẢI MÁI, THƯ GIÃN TỘT ĐỘ",Hộp 8 Miếng Mặt Nạ Naruko Tràm Trà Kiềm Dầu Giảm Mụn 26ml/M,18: 17 | 04/05/2023,5.0
1291,https://hasaki.vn/san-pham/mat-na-naruko-y-di-nhan-do-duong-sang-da-25ml-moi-92613.html,"['97279', '97275', '73471', '55822', '55867', '97277', '97271', '97273', '92613', '55873', '55801', '55792']",92613,lê duyên,"Sử dụng dễ dàng, rất thoải mái, thư giãn tột độ",Hộp 8 Miếng Mặt Nạ Naruko Tràm Trà Kiềm Dầu Giảm Mụn 26ml/M,17: 45 | 04/05/2023,5.0
1292,https://hasaki.vn/san-pham/mat-na-naruko-y-di-nhan-do-duong-sang-da-25ml-moi-92613.html,"['97279', '97275', '73471', '55822', '55867', '97277', '97271', '97273', '92613', '55873', '55801', '55792']",92613,Nguyễn Trần Diệu Linh,"Sử dụng dễ dàng, rất thoải mái, thư giãn tột độ",Hộp 8 Miếng Mặt Nạ Naruko Tràm Trà Kiềm Dầu Giảm Mụn 26ml/M,16: 51 | 04/05/2023,5.0
1293,https://hasaki.vn/san-pham/mat-na-naruko-y-di-nhan-do-duong-sang-da-25ml-moi-92613.html,"['97279', '97275', '73471', '55822', '55867', '97277', '97271', '97273', '92613', '55873', '55801', '55792']",92613,Nghĩa Hương,"Sử dụng dễ dàng , rất thoải mái , thư giãn tột độ",Hộp 8 Miếng Mặt Nạ Naruko Tràm Trà Kiềm Dầu Giảm Mụn 26ml/M,16: 47 | 04/05/2023,5.0
1294,https://hasaki.vn/san-pham/mat-na-naruko-y-di-nhan-do-duong-sang-da-25ml-moi-92613.html,"['97279', '97275', '73471', '55822', '55867', '97277', '97271', '97273', '92613', '55873', '55801', '55792']",92613,Nguyễn Văn Hải,"SỬ DỤNG DỄ DÀNG, RẤT THOẢI MÁI, THƯ GIÃN TỘT ĐỘ.",Hộp 8 Miếng Mặt Nạ Naruko Tràm Trà Kiềm Dầu Giảm Mụn 26ml/M,16: 18 | 04/05/2023,5.0
1295,https://hasaki.vn/san-pham/mat-na-naruko-y-di-nhan-do-duong-sang-da-25ml-moi-92613.html,"['97279', '97275', '73471', '55822', '55867', '97277', '97271', '97273', '92613', '55873', '55801', '55792']",92613,phan thi ngoc dieu,sản phẩm tốt đáng để sử dụng,Mặt Nạ Naruko Tràm Trà Kiểm Soát Dầu Và Giảm Mụn 26ml,12: 06 | 29/01/2024,5.0
1296,https://hasaki.vn/san-pham/mat-na-naruko-y-di-nhan-do-duong-sang-da-25ml-moi-92613.html,"['97279', '97275', '73471', '55822', '55867', '97277', '97271', '97273', '92613', '55873', '55801', '55792']",92613,Hảo Phan,,Mặt Nạ Naruko Tràm Trà Kiểm Soát Dầu Và Giảm Mụn 26ml,12: 02 | 22/12/2023,5.0
1297,https://hasaki.vn/san-pham/mat-na-naruko-y-di-nhan-do-duong-sang-da-25ml-moi-92613.html,"['97279', '97275', '73471', '55822', '55867', '97277', '97271', '97273', '92613', '55873', '55801', '55792']",92613,Vũ thu duyên,Sản phẩm chất lượng đáng để sử dụng,Mặt Nạ Naruko Tràm Trà Kiểm Soát Dầu Và Giảm Mụn 26ml,12: 01 | 12/12/2023,5.0
1298,https://hasaki.vn/san-pham/mat-na-naruko-y-di-nhan-do-duong-sang-da-25ml-moi-92613.html,"['97279', '97275', '73471', '55822', '55867', '97277', '97271', '97273', '92613', '55873', '55801', '55792']",92613,Tâm như,Sản phẩn chât lượng đáng sử dụg,Mặt Nạ Naruko Tràm Trà Kiểm Soát Dầu Và Giảm Mụn 26ml,13: 37 | 05/12/2023,5.0
1299,https://hasaki.vn/san-pham/mat-na-naruko-y-di-nhan-do-duong-sang-da-25ml-moi-92613.html,"['97279', '97275', '73471', '55822', '55867', '97277', '97271', '97273', '92613', '55873', '55801', '55792']",92613,võ thị ánh nguyệt,,Mặt Nạ Naruko Ý Dĩ Nhân Đỏ Dưỡng Sáng Da 25ml (Mới) Đã mua hàng online,18: 56 | 13/07/2023,4.0
1300,https://hasaki.vn/san-pham/mat-na-naruko-y-di-nhan-do-duong-sang-da-25ml-moi-92613.html,"['97279', '97275', '73471', '55822', '55867', '97277', '97271', '97273', '92613', '55873', '55801', '55792']",92613,Uyen Nguyen,"Mask đắp rất thư giãn, làm dịu da mụn hiệu quả nha",Mặt Nạ Naruko Tràm Trà Kiểm Soát Dầu Và Giảm Mụn 26ml Đã mua hàng online,17: 09 | 09/07/2023,5.0
1301,https://hasaki.vn/san-pham/mat-na-naruko-y-di-nhan-do-duong-sang-da-25ml-moi-92613.html,"['97279', '97275', '73471', '55822', '55867', '97277', '97271', '97273', '92613', '55873', '55801', '55792']",92613,Minh Kiệt,,Mặt Nạ Naruko Tràm Trà Kiểm Soát Dầu Và Giảm Mụn 26ml,22: 18 | 06/06/2023,5.0
1302,https://hasaki.vn/san-pham/mat-na-naruko-y-di-nhan-do-duong-sang-da-25ml-moi-92613.html,"['97279', '97275', '73471', '55822', '55867', '97277', '97271', '97273', '92613', '55873', '55801', '55792']",92613,Trà Hoa Sữa,Sử dụng dễ dàng rất thoải mái thư giãn tột dộ,Hộp 8 Miếng Mặt Nạ Naruko Tràm Trà Kiềm Dầu Giảm Mụn 26ml/M,10: 20 | 07/05/2023,5.0
1303,https://hasaki.vn/san-pham/mat-na-naruko-y-di-nhan-do-duong-sang-da-25ml-moi-92613.html,"['97279', '97275', '73471', '55822', '55867', '97277', '97271', '97273', '92613', '55873', '55801', '55792']",92613,Mai Yen,Okay lắm ạ,Hộp 8 Miếng Mặt Nạ Naruko Tràm Trà Kiềm Dầu Giảm Mụn 26ml/M Đã mua hàng online,10: 00 | 06/05/2023,5.0
1304,https://hasaki.vn/san-pham/mat-na-naruko-y-di-nhan-do-duong-sang-da-25ml-moi-92613.html,"['97279', '97275', '73471', '55822', '55867', '97277', '97271', '97273', '92613', '55873', '55801', '55792']",92613,Do Thi Khanh Linh,"Sử dụng dễ dàng, rất thoải mái thư giãn tột độ nhất là những ngày nóng như thế này. Cực thích. Đáng tiền lắm cả nhà ơi",Hộp 8 Miếng Mặt Nạ Naruko Tràm Trà Kiềm Dầu Giảm Mụn 26ml/M Đã mua hàng online,09: 41 | 06/05/2023,5.0
1305,https://hasaki.vn/san-pham/bo-doi-ca-phe-dak-lak-lam-sach-da-chet-cho-mat-cocoon-92253.html,"['92253', '92215']",92253,Hảo Phan,,Tẩy Da Chết Mặt Cocoon Cà Phê Đắk Lắk 150ml,12: 34 | 22/12/2023,5.0
1306,https://hasaki.vn/san-pham/bo-doi-ca-phe-dak-lak-lam-sach-da-chet-cho-mat-cocoon-92253.html,"['92253', '92215']",92253,Vũ thu duyên,Sản phẩm chất lượng đáng để sử dụng,Tẩy Da Chết Mặt Cocoon Cà Phê Đắk Lắk 150ml,12: 20 | 12/12/2023,5.0
1307,https://hasaki.vn/san-pham/bo-doi-ca-phe-dak-lak-lam-sach-da-chet-cho-mat-cocoon-92253.html,"['92253', '92215']",92253,Diễm My,"Hạt mịn, tẩy ok, nhiều ml dùng lâu",Tẩy Tế Bào Chết Da Mặt Cocoon Cà Phê Đắk Lắk 150ml Đã mua hàng online,09: 47 | 21/11/2023,5.0
1308,https://hasaki.vn/san-pham/bo-doi-ca-phe-dak-lak-lam-sach-da-chet-cho-mat-cocoon-92253.html,"['92253', '92215']",92253,Uyen Le,"Tẩy tế bào chết dùng khá okie. Tuy nhiên những ai da nhạy cảm, dễ lên mụn thì không nên dùng nhiều hoặc chà sát mạnh nhé.",Tẩy Tế Bào Chết Da Mặt Cocoon Cà Phê Đắk Lắk 150ml Đã mua hàng online,11: 58 | 19/11/2023,4.0
1309,https://hasaki.vn/san-pham/bo-doi-ca-phe-dak-lak-lam-sach-da-chet-cho-mat-cocoon-92253.html,"['92253', '92215']",92253,Duy Quang,Dùng thích lắm,Combo Tẩy Tế Bào Chết Da Mặt Cocoon Cà Phê Đắk Lắk 2x150ml Đã mua hàng online,23: 13 | 07/09/2023,5.0
1310,https://hasaki.vn/san-pham/bo-doi-ca-phe-dak-lak-lam-sach-da-chet-cho-mat-cocoon-92253.html,"['92253', '92215']",92253,Trúc Linh,"sp tẩy xog da rất mịn.nhưg có lẽ do da mình quá nhạy cảm nên dùng lên mụn đỏ nhiều lắm,ngứa nữa.chắc hợp với những bạn da ít nhạy cảm",Tẩy Tế Bào Chết Da Mặt Cocoon Cà Phê Đắk Lắk 150ml Đã mua hàng online,10: 10 | 04/09/2023,5.0
1311,https://hasaki.vn/san-pham/bo-doi-ca-phe-dak-lak-lam-sach-da-chet-cho-mat-cocoon-92253.html,"['92253', '92215']",92253,Diễm My,"Tbc nhà cocoon thì tuỵt vời khỏi bàn, siu rcm cho mn mua nhee. Nhm khi dùng thì nên rửa nhẹ vì có hạt cà phê nên rửa mạnh là đau í ạ",Tẩy Tế Bào Chết Da Mặt Cocoon Cà Phê Đắk Lắk 150ml Đã mua hàng online,08: 23 | 05/07/2023,5.0
1312,https://hasaki.vn/san-pham/bo-doi-ca-phe-dak-lak-lam-sach-da-chet-cho-mat-cocoon-92253.html,"['92253', '92215']",92253,CHỊ THẢO,"Mới mua về tẩy : mùi thơm, tẩy xong rửa mặt da mềm không khô căng, nhưng đúng là hạt hơi to nên khi tẩy dù nhẹ nhàng vẫn bị đau rát da. Phải chi hạt nhỏ mịn nữa là quá tốt luôn.",Tẩy Tế Bào Chết Da Mặt Cocoon Cà Phê Đắk Lắk 150ml,14: 42 | 14/05/2023,4.0
1313,https://hasaki.vn/san-pham/bo-doi-ca-phe-dak-lak-lam-sach-da-chet-cho-mat-cocoon-92253.html,"['92253', '92215']",92253,Nguyễn Ngọc Khánh,Tốt,Tẩy Tế Bào Chết Da Mặt Cocoon Cà Phê Đắk Lắk 150ml Đã mua hàng online,14: 22 | 03/11/2022,5.0
1314,https://hasaki.vn/san-pham/bo-doi-ca-phe-dak-lak-lam-sach-da-chet-cho-mat-cocoon-92253.html,"['92253', '92215']",92253,Phong Tran,,Cà Phê Đắk Lắk Làm Sạch Da Chết Cho Mặt Cocoon 150ml Đã mua hàng online,21: 09 | 27/11/2021,5.0
1315,https://hasaki.vn/san-pham/sua-rua-mat-cetaphil-tao-bot-diu-lanh-cho-da-nhay-cam-473ml-107912.html,"['107910', '107912']",107912,Tiến Lê,"Tạo bọt tương đối, cực kì sạch da nhưng da vẫn rất ẩm mềm. Da dầu hay da thiếu ẩm cần phục hồi nên mua em này hơn chai basic kia",Sữa Rửa Mặt Cetaphil Tạo Bọt Dịu Lành Cho Da Nhạy Cảm 473ml Đã mua hàng online,22: 29 | 07/01/2024,5.0
1316,https://hasaki.vn/san-pham/sua-rua-mat-cetaphil-tao-bot-diu-lanh-cho-da-nhay-cam-473ml-107912.html,"['107910', '107912']",107912,Trịnh thị thảo,Sao mình dùng qua tạo bọt này thì thấy da hơi bị khô không được mướt như cái cũ ạ,Sữa Rửa Mặt Cetaphil Tạo Bọt Dịu Lành Cho Da Nhạy Cảm 473ml Đã mua hàng online,16: 13 | 18/08/2023,5.0
1317,https://hasaki.vn/san-pham/sua-rua-mat-cetaphil-tao-bot-diu-lanh-cho-da-nhay-cam-473ml-107912.html,"['107910', '107912']",107912,Thuy Nguyen,"Sản phẩm ổn, giá tốt, xài xong sáng hôm qua thấy da mịn hơn. Da khô nên mua dùng nha,",Sữa Rửa Mặt Cetaphil Tạo Bọt Dịu Lành Cho Da Nhạy Cảm 473ml Đã mua hàng online,14: 35 | 20/07/2023,5.0
1318,https://hasaki.vn/san-pham/sua-rua-mat-cetaphil-tao-bot-diu-lanh-cho-da-nhay-cam-473ml-107912.html,"['107910', '107912']",107912,Le Thi Thu Hang,"Hàng xài thích lắm, có bọt mịn, mềm da và cảm giác sạch êm. Hơi có chút mùi dừa nhưng ổn",Sữa Rửa Mặt Cetaphil Tạo Bọt Dịu Lành Cho Da Nhạy Cảm 236ml Đã mua hàng online,11: 15 | 29/05/2023,5.0
1319,https://hasaki.vn/san-pham/sua-rua-mat-cetaphil-tao-bot-diu-lanh-cho-da-nhay-cam-473ml-107912.html,"['107910', '107912']",107912,Hao Tran,"Ê, hàng ngon nha, xài có 3 ngày mịn da cung cấp độ ẩm rất tốt luôn. Da khô nên xài",Sữa Rửa Mặt Cetaphil Tạo Bọt Dịu Lành Cho Da Nhạy Cảm 236ml Đã mua hàng online,07: 17 | 24/05/2023,5.0
1320,https://hasaki.vn/san-pham/nuoc-tay-trang-duong-am-l-oreal-3-in-1-danh-cho-da-thuong-da-kho-95ml-5294.html,"['5296', '102557', '74832', '19325', '34119', '5294', '95711', '19286', '99707']",5294,nguyễn thị thanh huyền,,"Nước Tẩy Trang L'oreal Dành Cho Da Dầu, Da Nhạy Cảm 400ml Đã mua hàng online",12: 52 | 14/05/2018,4.0
1321,https://hasaki.vn/san-pham/nuoc-tay-trang-duong-am-l-oreal-3-in-1-danh-cho-da-thuong-da-kho-95ml-5294.html,"['5296', '102557', '74832', '19325', '34119', '5294', '95711', '19286', '99707']",5294,Linh Nguyễn,Mình là fan ruột của sản phẩm này. Sau khi sử dụng da mặt khá sạch và cũng không hề khiến da mìn khô. Mua ở hasaki lại còn rẻ nữa. Sẽ ủng hộ tiếp!,Nước Tẩy Trang L'Oreal 3-in-1 Làm Sạch Sâu 400ml Đã mua hàng online,20: 02 | 26/10/2018,5.0
1322,https://hasaki.vn/san-pham/nuoc-tay-trang-duong-am-l-oreal-3-in-1-danh-cho-da-thuong-da-kho-95ml-5294.html,"['5296', '102557', '74832', '19325', '34119', '5294', '95711', '19286', '99707']",5294,Lan Anh Nguyen,Sp dùng cực thích,Nước Tẩy Trang Dưỡng Ẩm L'Oreal 3-in-1 Dành Cho Da Thường & Da Khô 400ml Đã mua hàng online,20: 01 | 26/10/2018,5.0
1323,https://hasaki.vn/san-pham/nuoc-tay-trang-duong-am-l-oreal-3-in-1-danh-cho-da-thuong-da-kho-95ml-5294.html,"['5296', '102557', '74832', '19325', '34119', '5294', '95711', '19286', '99707']",5294,Lan Anh Nguyen,Sp tốt làm sạch sâu,Nước Tẩy Trang L'Oreal 3-in-1 Làm Sạch Sâu 400ml Đã mua hàng online,19: 59 | 26/10/2018,4.0
1324,https://hasaki.vn/san-pham/nuoc-tay-trang-duong-am-l-oreal-3-in-1-danh-cho-da-thuong-da-kho-95ml-5294.html,"['5296', '102557', '74832', '19325', '34119', '5294', '95711', '19286', '99707']",5294,Lan Anh Nguyen,Sản phẩm dùng tốt ko mùi nhẹ dịu cho da,Nước Tẩy Trang Tươi Mát L'Oreal 3-in-1 Dành Cho Da Dầu & Da Hỗn Hợp 400ml Đã mua hàng online,19: 57 | 26/10/2018,4.0
1325,https://hasaki.vn/san-pham/nuoc-tay-trang-duong-am-l-oreal-3-in-1-danh-cho-da-thuong-da-kho-95ml-5294.html,"['5296', '102557', '74832', '19325', '34119', '5294', '95711', '19286', '99707']",5294,Tâm Minh,"xài đã dã man con ngan luôn ý, giá siêu rẻ nữa. Hết mua tiếp hihi ^^",Nước Tẩy Trang L'Oreal 3-in-1 Làm Sạch Sâu 400ml Đã mua hàng online,19: 57 | 26/10/2018,5.0
1326,https://hasaki.vn/san-pham/nuoc-tay-trang-duong-am-l-oreal-3-in-1-danh-cho-da-thuong-da-kho-95ml-5294.html,"['5296', '102557', '74832', '19325', '34119', '5294', '95711', '19286', '99707']",5294,Trần Thị Hà,"Sản phẩm tốt, phù hợp với các bạn da hỗn hợp , tẩy trang sạch, không khô da. Nên rửa lại với nước sau khi sử dụng nhé các bạn!",Nước Tẩy Trang L'Oreal 3-in-1 Làm Sạch Sâu 400ml Đã mua hàng online,19: 22 | 26/10/2018,4.0
1327,https://hasaki.vn/san-pham/nuoc-tay-trang-duong-am-l-oreal-3-in-1-danh-cho-da-thuong-da-kho-95ml-5294.html,"['5296', '102557', '74832', '19325', '34119', '5294', '95711', '19286', '99707']",5294,Ngọc Nguyễn,Dùng rất dễ chịu và nhẹ nhàng,Nước Tẩy Trang L'Oreal 3-in-1 Làm Sạch Sâu 400ml Đã mua hàng online,19: 18 | 26/10/2018,5.0
1328,https://hasaki.vn/san-pham/nuoc-tay-trang-duong-am-l-oreal-3-in-1-danh-cho-da-thuong-da-kho-95ml-5294.html,"['5296', '102557', '74832', '19325', '34119', '5294', '95711', '19286', '99707']",5294,Min Trần,"Làm sạch sâu lớp trang điểm, nhẹ nhàng, k nhờn rít.",Nước Tẩy Trang L'Oreal 3-in-1 Làm Sạch Sâu 400ml Đã mua hàng online,19: 15 | 26/10/2018,5.0
1329,https://hasaki.vn/san-pham/nuoc-tay-trang-duong-am-l-oreal-3-in-1-danh-cho-da-thuong-da-kho-95ml-5294.html,"['5296', '102557', '74832', '19325', '34119', '5294', '95711', '19286', '99707']",5294,Thiều Thảo,"Mình rất ưng sản phẩm của loreal, rất hài lòng, tẩy trang dịu nhẹ",Nước Tẩy Trang Tươi Mát L'Oreal 3-in-1 Dành Cho Da Dầu & Da Hỗn Hợp 400ml Đã mua hàng online,19: 05 | 26/10/2018,5.0
1330,https://hasaki.vn/san-pham/nuoc-tay-trang-duong-am-l-oreal-3-in-1-danh-cho-da-thuong-da-kho-95ml-5294.html,"['5296', '102557', '74832', '19325', '34119', '5294', '95711', '19286', '99707']",5294,Tien Nguyen,,Nước Tẩy Trang L'Oreal Tươi Mát 3 Trong 1 Cho Da Hỗn Hợp & Da Dầu L'Oreal 95ml Đã mua hàng online,08: 22 | 20/08/2018,5.0
1331,https://hasaki.vn/san-pham/nuoc-tay-trang-duong-am-l-oreal-3-in-1-danh-cho-da-thuong-da-kho-95ml-5294.html,"['5296', '102557', '74832', '19325', '34119', '5294', '95711', '19286', '99707']",5294,Khánh Quỳnh,Dùng rất nhiều loại nước tẩy trang chỉ ưng mỗi loại này. Dùng rất thích ko cồn dịu nhẹ trên da ko gây cảm giác bết rích. M dùng đến 6 chai loại 400ml này r và vẫn ko có ý định đổi. Hasaki luôn có giá tốt nên m sẽ ủng hộ dài dài,Nước Tẩy Trang Tươi Mát L'Oreal 3-in-1 Dành Cho Da Dầu & Da Hỗn Hợp 400ml Đã mua hàng online,19: 38 | 21/07/2019,5.0
1332,https://hasaki.vn/san-pham/nuoc-tay-trang-duong-am-l-oreal-3-in-1-danh-cho-da-thuong-da-kho-95ml-5294.html,"['5296', '102557', '74832', '19325', '34119', '5294', '95711', '19286', '99707']",5294,Nguyễn Linh,"sản phẩm đúng như mong đợi, tẩy trang sạch, diu nhẹ",Nước Tẩy Trang L'Oreal 3-in-1 Làm Sạch Sâu 400ml Đã mua hàng online,17: 46 | 16/07/2019,5.0
1333,https://hasaki.vn/san-pham/nuoc-tay-trang-duong-am-l-oreal-3-in-1-danh-cho-da-thuong-da-kho-95ml-5294.html,"['5296', '102557', '74832', '19325', '34119', '5294', '95711', '19286', '99707']",5294,Nguyễn Nhiên,"Cực kì thích loại này, ko cồn, mùi rất nhẹ, khả năng tẩy trang tốt khi chỉ sử dụng kem chống nắng hoặc vệ sinh da mặt sau khi đi ngoài đường về, mình khuyên các bạn da dầu nên dùng hihi",Nước Tẩy Trang Tươi Mát L'Oreal 3-in-1 Dành Cho Da Dầu & Da Hỗn Hợp 400ml Đã mua hàng online,18: 34 | 13/06/2019,5.0
1334,https://hasaki.vn/san-pham/nuoc-tay-trang-duong-am-l-oreal-3-in-1-danh-cho-da-thuong-da-kho-95ml-5294.html,"['5296', '102557', '74832', '19325', '34119', '5294', '95711', '19286', '99707']",5294,Linh Nguyễn,undefined,Nước Tẩy Trang L'Oreal 3-in-1 Làm Sạch Sâu 400ml Đã mua hàng online,09: 34 | 28/05/2019,4.0
1335,https://hasaki.vn/san-pham/nuoc-tay-trang-duong-am-l-oreal-3-in-1-danh-cho-da-thuong-da-kho-95ml-5294.html,"['5296', '102557', '74832', '19325', '34119', '5294', '95711', '19286', '99707']",5294,Sao Xúc Xích,"Mình luôn dùng loại deep cleaning này vì có lớp dầu nên tẩy đc cả son lì và mascara. Chai to, giá ok sài đc khá lâu.",Nước Tẩy Trang L'Oreal 3-in-1 Làm Sạch Sâu 400ml Đã mua hàng online,14: 44 | 11/05/2019,5.0
1336,https://hasaki.vn/san-pham/nuoc-tay-trang-duong-am-l-oreal-3-in-1-danh-cho-da-thuong-da-kho-95ml-5294.html,"['5296', '102557', '74832', '19325', '34119', '5294', '95711', '19286', '99707']",5294,Thao Ngo,Thông số ghi lại Xuất xứ của pháp nhưng sp mình mua là của Trung Quốc,Nước Tẩy Trang L'Oreal 3-in-1 Làm Sạch Sâu 400ml,21: 38 | 14/02/2019,2.0
1337,https://hasaki.vn/san-pham/nuoc-tay-trang-duong-am-l-oreal-3-in-1-danh-cho-da-thuong-da-kho-95ml-5294.html,"['5296', '102557', '74832', '19325', '34119', '5294', '95711', '19286', '99707']",5294,Trang Nguyễn,"Mình đã dùng thử và tin dùng bạn này. Mùi nhè nhẹ, không gây nhờn rích hay kích ứng da!",Nước Tẩy Trang Tươi Mát L'Oreal 3-in-1 Dành Cho Da Dầu & Da Hỗn Hợp 400ml Đã mua hàng online,21: 36 | 24/12/2018,4.0
