,link_item,data_product_id_list,data_product_id,name_comment,content_comment,product_variant,datetime_comment,rating
849,https://hasaki.vn/san-pham/gel-chong-nang-hatomugi-nang-tong-mau-xanh-bac-ha-70g-102355.html,"['99209', '96493', '102355']",102355,Pham Thi Ngoc Anh,"rẻ và cũng tốt nha mn bôi xong hơi bóng nhẹ, lấy giấy thấm là dc. nâng 1 tone, nhẹ thôi","Kem Chống Nắng Hatomugi Nâng Tông, Dưỡng Ẩm Da 70g Đã mua hàng online",16: 38 | 24/03/2022,5.0
850,https://hasaki.vn/san-pham/gel-chong-nang-hatomugi-nang-tong-mau-xanh-bac-ha-70g-102355.html,"['99209', '96493', '102355']",102355,Võ Thị Cẩm Lệ,"Chất kem mát mịn, thẩm thấu nhanh. Thoa xong mặt rất nhẹ ko bết dính. Ko mùi luôn mình rất thích. Lớp finish hơi bóng xíu nha mọi người.","Kem Chống Nắng Hatomugi Nâng Tông, Dưỡng Ẩm Da 70g Đã mua hàng online",08: 49 | 28/01/2022,5.0
851,https://hasaki.vn/san-pham/gel-chong-nang-hatomugi-nang-tong-mau-xanh-bac-ha-70g-102355.html,"['99209', '96493', '102355']",102355,Phạm Trần Linh Chi,"kcn bôi lên da khá mát, cảm giác nhẹ mặt nếu bôi 1 lớp mỏng, bôi 2 lớp sẽ bị vón cục gợn trắng, bôi vùng xung quanh trán chỗ gần chân tóc cũng bị vón cục gợn trắng, vùng xung quanh mắt ko bị rát gì nhưng khi gió thổi qua hoặc đi ngoài đường sẽ bị cay mắt và chảy nước mắt rất khó chịu.",Kem Chống Nắng Hatomugi Nâng Tông & Dưỡng Ẩm Da 70g Đã mua hàng online,11: 02 | 10/03/2024,3.0
852,https://hasaki.vn/san-pham/gel-chong-nang-hatomugi-nang-tong-mau-xanh-bac-ha-70g-102355.html,"['99209', '96493', '102355']",102355,Nguyễn Thị Kiều Oanh,"kcn thấm nhanh nhưng mà dễ bị xê dịch, trôi đi khi đeo khẩu trang. mùi khá là nồng, bôi từ sáng sớm đến tối vẫn còn mùi ở trên mặt và khẩu trang, sẽ gây khó chịu nếu bạn không thích mùi này. da mình là da khô khi dùng được nửa ngày thì kcn trên da bị lấm tấm nhìn tưởng da bị bong tróc v",Kem Chống Nắng Hatomugi Nâng Tông & Dưỡng Ẩm Da 70g (Xanh Bạc Hà) Đã mua hàng online,22: 56 | 23/01/2024,4.0
853,https://hasaki.vn/san-pham/gel-chong-nang-hatomugi-nang-tong-mau-xanh-bac-ha-70g-102355.html,"['99209', '96493', '102355']",102355,LƯƠNG VĨNH KHANG,"Kem không mùi, không nhờn rít, dễ tán, kiềm dầu khá tốt, nhưng hơi cay mắt nhẹ. Nên chấm kem xa vùng mắt 1 xíu, rồi tán dần vào vùng mắt thì sẽ ko bị cay mắt.",Kem Chống Nắng Hatomugi Dưỡng Ẩm & Làm Sáng Da 80g Đã mua hàng online,17: 40 | 18/01/2024,4.0
854,https://hasaki.vn/san-pham/gel-chong-nang-hatomugi-nang-tong-mau-xanh-bac-ha-70g-102355.html,"['99209', '96493', '102355']",102355,Tam Phan,"kem xài ok nha. thấm nhanh, ko gây bết dính.",Kem Chống Nắng Hatomugi Nâng Tông & Dưỡng Ẩm Da 70g Đã mua hàng online,15: 55 | 11/07/2023,5.0
855,https://hasaki.vn/san-pham/gel-chong-nang-hatomugi-nang-tong-mau-xanh-bac-ha-70g-102355.html,"['99209', '96493', '102355']",102355,Doo Loann,"Kiềm dầu ổn, nâng tone nhẹ nhưng hơi cay mắt",Kem Chống Nắng Hatomugi Nâng Tông & Dưỡng Ẩm Da 70g Đã mua hàng online,14: 05 | 06/07/2023,4.0
856,https://hasaki.vn/san-pham/gel-chong-nang-hatomugi-nang-tong-mau-xanh-bac-ha-70g-102355.html,"['99209', '96493', '102355']",102355,Thanh Xuân,"Mình da hỗn hợp thiên dầu xài cũng khá là ok, kiềm dầu tốt, giá rẻ",Kem Chống Nắng Hatomugi Nâng Tông & Dưỡng Ẩm Da 70g (Xanh Bạc Hà),08: 24 | 25/06/2023,5.0
857,https://hasaki.vn/san-pham/gel-chong-nang-hatomugi-nang-tong-mau-xanh-bac-ha-70g-102355.html,"['99209', '96493', '102355']",102355,Trần Như,,Kem Chống Nắng Hatomugi Nâng Tông & Dưỡng Ẩm Da 70g Đã mua hàng online,16: 42 | 20/06/2023,3.0
858,https://hasaki.vn/san-pham/gel-chong-nang-hatomugi-nang-tong-mau-xanh-bac-ha-70g-102355.html,"['99209', '96493', '102355']",102355,C.Phụng,cũng đc nhưng base k đẹp lắm,Kem Chống Nắng Hatomugi Nâng Tông & Dưỡng Ẩm Da 70g Đã mua hàng online,21: 53 | 25/05/2023,4.0
859,https://hasaki.vn/san-pham/gel-chong-nang-hatomugi-nang-tong-mau-xanh-bac-ha-70g-102355.html,"['99209', '96493', '102355']",102355,Rosie Bui,"test thử thấy ok nha , mỏng nhẹ, không thấy mùi cồn, hy vọng sử dụng trên da mặt làm dịu k ảnh hưởng mụn là dc. Chứ dùng mấy hãng mắc tiền như Eucerin / Laros thấy rít với bí da quá . Còn Skin aqua sunplay thì nghe mùi cồn quá",Kem Chống Nắng Hatomugi Nâng Tông & Dưỡng Ẩm Da 70g (Xanh Bạc Hà) Đã mua hàng online,18: 30 | 14/05/2023,4.0
860,https://hasaki.vn/san-pham/gel-chong-nang-hatomugi-nang-tong-mau-xanh-bac-ha-70g-102355.html,"['99209', '96493', '102355']",102355,Nguyễn Thị Quỳnh Ni,"Kem chống nắng này cho da hhtđ tới da dầu thôi. Mình hhtd thoa lên bị ghét, loang lỗ trắng xấu lắm, phải cấp ẩm nhiều với thoa bằng cách lỗ đều tay mới tệp vào được. Chấm điểm 6 thôi tại rẻ.","Gel Chống Nắng Hatomugi Ý Dĩ Cấp Ẩm, Nâng Tông Da 70g Đã mua hàng online",09: 22 | 06/05/2023,3.0
861,https://hasaki.vn/san-pham/xit-khoang-la-roche-posay-lam-diu-va-bao-ve-da-150g-995.html,"['1001', '118964', '995', '86309', '987']",995,Linh Vo,"Mua được giá sale 139 cành -3 chai free ship, tuyệt vời, xịt khoáng mát lạnh",Combo 3 Xịt Khoáng La Roche-Posay Làm Dịu Và Bảo Vệ Da 50g Đã mua hàng online,12: 04 | 25/03/2024,5.0
862,https://hasaki.vn/san-pham/xit-khoang-la-roche-posay-lam-diu-va-bao-ve-da-150g-995.html,"['1001', '118964', '995', '86309', '987']",995,Linh Lan,"quá xịn xò, mua sale combo 3 chai*50g mà có 138k, shop ship lẹ làng, xịt đã ghia! thanks shop nha!",Combo 3 Xịt Khoáng La Roche-Posay Làm Dịu Và Bảo Vệ Da 50g Đã mua hàng online,13: 16 | 09/03/2024,5.0
863,https://hasaki.vn/san-pham/xit-khoang-la-roche-posay-lam-diu-va-bao-ve-da-150g-995.html,"['1001', '118964', '995', '86309', '987']",995,Gia Hân,"Hơi k thích mùi của sp nhưng về tác dụng thì thấy ok, có cảm giác được cấp ẩm tức thì, thoáng và rất nhẹ mặt. Size mini khá tiện để mang theo ra ngoài",[Mini] Xịt Khoáng La Roche-Posay Làm Dịu Và Bảo Vệ Da 50g Đã mua hàng online,14: 31 | 15/09/2023,5.0
864,https://hasaki.vn/san-pham/xit-khoang-la-roche-posay-lam-diu-va-bao-ve-da-150g-995.html,"['1001', '118964', '995', '86309', '987']",995,Nguyễn Trương Trà My,chai này bao nhiêu ml vậy ạ ???,Xịt Khoáng La Roche-Posay Làm Dịu Và Bảo Vệ Da 300g Đã mua hàng online,14: 20 | 01/03/2022,5.0
865,https://hasaki.vn/san-pham/xit-khoang-la-roche-posay-lam-diu-va-bao-ve-da-150g-995.html,"['1001', '118964', '995', '86309', '987']",995,Trúc Giang Nguyễn,"Mình đã mua 2 chai lớn loại này rồi, mà mỗi lần dùng gần hết ( còn khoảng 50-100ml) là vòi xịt lại có vấn đề không xịt được nữa , nên khá tiếc",Xịt Khoáng La Roche-Posay Làm Dịu Và Bảo Vệ Da 300g Đã mua hàng online,17: 42 | 26/12/2021,3.0
866,https://hasaki.vn/san-pham/xit-khoang-la-roche-posay-lam-diu-va-bao-ve-da-150g-995.html,"['1001', '118964', '995', '86309', '987']",995,Nguyễn Trọng Thanh,"Sản phẩm tổt, đóng gói đẹp",Xịt Khoáng La Roche-Posay Làm Dịu Và Bảo Vệ Da 150g Đã mua hàng online,11: 28 | 26/10/2021,5.0
867,https://hasaki.vn/san-pham/xit-khoang-la-roche-posay-lam-diu-va-bao-ve-da-150g-995.html,"['1001', '118964', '995', '86309', '987']",995,Ánh Xuân,Mua kem được tặng kèm xịt ă. Nói chung với sản phẩm này thì mình thấy bình thường thôi hay tại mình không có thói quen dùng xịt khoáng nhĩ.,Xịt Khoáng La Roche-Posay Làm Dịu Và Bảo Vệ Da 50g Đã mua hàng online,08: 23 | 22/06/2021,4.0
868,https://hasaki.vn/san-pham/xit-khoang-la-roche-posay-lam-diu-va-bao-ve-da-150g-995.html,"['1001', '118964', '995', '86309', '987']",995,Hoàng Ánh,"sản phẩm tốt , không gây kích ứng ,vòi xịt khá ok , sài 2 chai rùi , không muốn đổi sang loại khác",Xịt Khoáng La Roche-Posay Làm Dịu Và Bảo Vệ Da 50g Đã mua hàng online,22: 42 | 31/07/2020,5.0
869,https://hasaki.vn/san-pham/xit-khoang-la-roche-posay-lam-diu-va-bao-ve-da-150g-995.html,"['1001', '118964', '995', '86309', '987']",995,chị TRẦN NGỌC HIẾU,,Combo 02 Xịt Khoáng La Roche-Posay Làm Dịu Và Bảo Vệ Da 50g,18: 41 | 29/03/2020,5.0
870,https://hasaki.vn/san-pham/combo-kem-chong-nang-cell-fusion-c-nang-tong-da-35ml-mat-na-duong-da-ph-thap-25ml-set-sample-2-goi-105083.html,"['102131', '102193', '102129', '105085', '105083', '115755', '102189', '102195']",105083,Sarah Phương,"K hợp với da mình, bị dị ứng và ngứa quá",Kem Chống Nắng Cell Fusion C Nâng Tông Da Tuýp 50ml Đã mua hàng online,09: 25 | 13/08/2023,3.0
871,https://hasaki.vn/san-pham/combo-kem-chong-nang-cell-fusion-c-nang-tong-da-35ml-mat-na-duong-da-ph-thap-25ml-set-sample-2-goi-105083.html,"['102131', '102193', '102129', '105085', '105083', '115755', '102189', '102195']",105083,Phương Loan,"Huhu mình mới mua mà ko hợp, ai cần mình passs re nha",Kem Chống Nắng Cell Fusion C Nâng Tông Da 35ml + Tặng 2 Sample Bất Kì Đã mua hàng online,10: 45 | 15/07/2023,5.0
872,https://hasaki.vn/san-pham/combo-kem-chong-nang-cell-fusion-c-nang-tong-da-35ml-mat-na-duong-da-ph-thap-25ml-set-sample-2-goi-105083.html,"['102131', '102193', '102129', '105085', '105083', '115755', '102189', '102195']",105083,phan thị thương,"bết và nặng mặt, trắng ko tự nhiên",Combo Kem Chống Nắng Cell Fusion C Nâng Tông Da 35mlx2 Đã mua hàng online,15: 00 | 02/06/2023,3.0
873,https://hasaki.vn/san-pham/combo-kem-chong-nang-cell-fusion-c-nang-tong-da-35ml-mat-na-duong-da-ph-thap-25ml-set-sample-2-goi-105083.html,"['102131', '102193', '102129', '105085', '105083', '115755', '102189', '102195']",105083,Phương Thảo,rất hợp đối với da hỗn hợp thiên dầu như mình .lúc trước sài skin aqua nắp vàng bị kích ứng vậy mà từ lúc đổi qua em này là da cải thiện rõ rệt. cần tẩy trang kỹ để không bị mụn ẩn,Kem Chống Nắng Cell Fusion C Nâng Tông Da 35ml + Tặng Mặt Nạ Ngẫu Nhiên & Set 2 Sample Đã mua hàng online,11: 32 | 11/05/2023,5.0
874,https://hasaki.vn/san-pham/combo-kem-chong-nang-cell-fusion-c-nang-tong-da-35ml-mat-na-duong-da-ph-thap-25ml-set-sample-2-goi-105083.html,"['102131', '102193', '102129', '105085', '105083', '115755', '102189', '102195']",105083,Thảo Đào Thị Phương,Hơi bết và trắng quá,Combo Kem Chống Nắng Cell Fusion C Nâng Tông Da 35mlx2 Đã mua hàng online,11: 20 | 17/12/2022,4.0
875,https://hasaki.vn/san-pham/combo-kem-chong-nang-cell-fusion-c-nang-tong-da-35ml-mat-na-duong-da-ph-thap-25ml-set-sample-2-goi-105083.html,"['102131', '102193', '102129', '105085', '105083', '115755', '102189', '102195']",105083,Ninh Trần,,Combo Kem Chống Nắng Cell Fusion C Nâng Tông Da 35mlx2 Đã mua hàng online,10: 23 | 17/12/2022,4.0
876,https://hasaki.vn/san-pham/combo-kem-chong-nang-cell-fusion-c-nang-tong-da-35ml-mat-na-duong-da-ph-thap-25ml-set-sample-2-goi-105083.html,"['102131', '102193', '102129', '105085', '105083', '115755', '102189', '102195']",105083,Ngọc Lan,"mình cần pass 1 tuýp 35ml, lh 0794589934",Combo Kem Chống Nắng Cell Fusion C Nâng Tông Da 35mlx2 Đã mua hàng online,23: 49 | 22/11/2022,5.0
877,https://hasaki.vn/san-pham/combo-kem-chong-nang-cell-fusion-c-nang-tong-da-35ml-mat-na-duong-da-ph-thap-25ml-set-sample-2-goi-105083.html,"['102131', '102193', '102129', '105085', '105083', '115755', '102189', '102195']",105083,Thu Hà,Ai pass lh mình 0388437121,Kem Chống Nắng Cell Fusion C Nâng Tông Da Tuýp 50ml Đã mua hàng online,14: 37 | 21/11/2022,5.0
878,https://hasaki.vn/san-pham/combo-kem-chong-nang-cell-fusion-c-nang-tong-da-35ml-mat-na-duong-da-ph-thap-25ml-set-sample-2-goi-105083.html,"['102131', '102193', '102129', '105085', '105083', '115755', '102189', '102195']",105083,Phan trần huyền trâm,@Đặng Ngọc Quỳnh cho mình xin thông tin liên hệ nhé. Thanks,Combo Kem Chống Nắng Cell Fusion C Nâng Tông Da 35mlx2 Đã mua hàng online,16: 25 | 12/11/2022,5.0
879,https://hasaki.vn/san-pham/combo-kem-chong-nang-cell-fusion-c-nang-tong-da-35ml-mat-na-duong-da-ph-thap-25ml-set-sample-2-goi-105083.html,"['102131', '102193', '102129', '105085', '105083', '115755', '102189', '102195']",105083,Đặng Ngọc Quỳnh,"m cần thanh lí kcn này, m quen dùng màu xanh mà mua nhầm màu hồng. new nguyên hộp 400k frs ạ",Kem Chống Nắng Cell Fusion C Nâng Tông Da Tuýp 50ml Đã mua hàng online,05: 53 | 11/11/2022,5.0
880,https://hasaki.vn/san-pham/sua-rua-mat-innisfree-kiem-soat-nhon-tro-nui-lua-bha-150g-moi-109244.html,"['109244', '112751', '103283']",109244,Huỳnh huy hiển,Mình dùng sữa này OK lắm luôn Á. Đỡ mụn,Sữa Rửa Mặt innisfree Kiểm Soát Nhờn Tro Núi Lửa & BHA 150g (Mới 2023) Đã mua hàng online,20: 44 | 22/01/2024,5.0
881,https://hasaki.vn/san-pham/sua-rua-mat-innisfree-kiem-soat-nhon-tro-nui-lua-bha-150g-moi-109244.html,"['109244', '112751', '103283']",109244,Xuân Như,Đc ạ,Sữa Rửa Mặt innisfree Kiểm Soát Nhờn Tro Núi Lửa & BHA 150g Đã mua hàng online,21: 01 | 22/06/2023,5.0
882,https://hasaki.vn/san-pham/sua-rua-mat-innisfree-kiem-soat-nhon-tro-nui-lua-bha-150g-moi-109244.html,"['109244', '112751', '103283']",109244,Hồng Vân,"Giá cả hợp lý, nhiều bọt,sạch da,tốt",Sữa Rửa Mặt innisfree Kiểm Soát Nhờn Tro Núi Lửa & BHA 150g Đã mua hàng online,00: 14 | 11/12/2022,4.0
883,https://hasaki.vn/san-pham/sua-rua-mat-innisfree-kiem-soat-nhon-tro-nui-lua-bha-150g-moi-109244.html,"['109244', '112751', '103283']",109244,CHỊ NHIÊN,sữa rửa mặt này sài rất là ok,Sữa Rửa Mặt innisfree Kiểm Soát Nhờn Tro Núi Lửa & BHA 150g Đã mua hàng online,15: 03 | 10/12/2022,4.0
884,https://hasaki.vn/san-pham/sua-rua-mat-la-roche-posay-danh-cho-da-dau-da-hon-hop-va-nhay-cam-125ml-1052.html,"['17745', '1052']",1052,C.DUNG,Ko biết sao mn ko thích em này lắm nhỉ. Mình thử dùng nhiều loại rồi. hôm rồi cũng chuyển sang vichy nhưng nhận ra ko srm nào mình thíc bằng e này luôn. Kể cả đã dùng Effaclar cũng ko thấy sạch. Dùng e này rửa xong sờ lên da thấy thông thoáng sạch sẽ hẳn. Sẽ mua chai to hơn để dùng đc lâu.,Sữa Rửa Mặt La Roche-Posay Cho Da Hỗn Hợp Rất Nhạy Cảm 50ml Đã mua hàng online,22: 09 | 10/05/2023,5.0
885,https://hasaki.vn/san-pham/sua-rua-mat-la-roche-posay-danh-cho-da-dau-da-hon-hop-va-nhay-cam-125ml-1052.html,"['17745', '1052']",1052,Cao Quốc Việt,"Srm tệ nhất của La roche posay. Chỉ cần 1 hạt đậu là có thể rửa toàn mặt vì nhiều bọt lắm. Rửa xong da sạch boong kin kít mặc dù da mình là da dầu. Ngày hôm sau, mặt bị nổi mụn. Giá cao nhưng mua về xài dc 1-2 lần ko dám xài tiếp. Đã xài srm dòng Effaclar của La roche thấy ok nhưng dòng Toleriane thì quá tệ.",Sữa Rửa Mặt La Roche-Posay Cho Da Hỗn Hợp Rất Nhạy Cảm 50ml Đã mua hàng online,10: 55 | 04/10/2022,2.0
886,https://hasaki.vn/san-pham/sua-rua-mat-la-roche-posay-danh-cho-da-dau-da-hon-hop-va-nhay-cam-125ml-1052.html,"['17745', '1052']",1052,Nguyễn Thư,"Cảm giác nhẹ dịu cực kì, dù da đang trong giai đoạn bị kích ứng khi sử dụng m vẫn cảm thấy dễ chịu k bị căng khô.","Sữa Rửa Mặt La Roche-Posay Dành Cho Da Dầu, Da Hỗn Hợp Và Nhạy Cảm 125ml Đã mua hàng online",21: 35 | 12/07/2020,5.0
887,https://hasaki.vn/san-pham/sua-rua-mat-la-roche-posay-danh-cho-da-dau-da-hon-hop-va-nhay-cam-125ml-1052.html,"['17745', '1052']",1052,Kim lợi,"Xài rất vừa ý, chỉ mới xài đc mấy ngày đã thấy mụn li ti giảm hẳn, lỗ chân lông sau khi rửa mặt seo đáng kể Bọt rất mịn, thoa lên mặt oi mát xa thấy rất thoải mái Rất đáng tiền mặc dù giá hơi chua",Sữa Rửa Mặt La Roche-Posay Dành Cho Da Hỗn Hợp Và Nhạy Cảm 50ml Đã mua hàng online,20: 30 | 12/07/2019,5.0
888,https://hasaki.vn/san-pham/combo-2-serum-bi-dao-cocoon-lam-giam-mun-mo-tham-70ml-109272.html,"['96811', '109272']",109272,c. MY,"xài tốt, mình mua nồng độ 7% để quen dần với nia, lúc đầu xài còn lên mụn, về sau quen rồi thì trị thâm trị mụn luôn","Serum Bí Đao Cocoon Làm Giảm Mụn, Mờ Thâm 70ml Đã mua hàng online",08: 05 | 19/11/2023,5.0
889,https://hasaki.vn/san-pham/combo-2-serum-bi-dao-cocoon-lam-giam-mun-mo-tham-70ml-109272.html,"['96811', '109272']",109272,Vĩnh Tường,"Serum nhờn rít, không hợp với da dầu như quảng cáo, thoa lên để lâu trên da vẫn còn 1 lớp rất nặng mặt","Serum Bí Đao Cocoon Làm Giảm Mụn, Mờ Thâm 70ml (Mới) Đã mua hàng online",14: 10 | 15/07/2023,3.0
890,https://hasaki.vn/san-pham/combo-2-serum-bi-dao-cocoon-lam-giam-mun-mo-tham-70ml-109272.html,"['96811', '109272']",109272,Trần Thị Kim Lài,Minh mua dùng thử nhưng ko hợp còn toner + serum bí đau ai lấy inbox mình nha 0931793958,"Serum Bí Đao Cocoon Làm Giảm Mụn, Mờ Thâm 70ml (Mới) Đã mua hàng online",14: 06 | 16/03/2023,5.0
891,https://hasaki.vn/san-pham/combo-2-serum-bi-dao-cocoon-lam-giam-mun-mo-tham-70ml-109272.html,"['96811', '109272']",109272,Minh Duong Quang,Bao bì đẹp và nặng chắc tay nhé❤️‍,"Serum Bí Đao Cocoon Làm Giảm Mụn, Mờ Thâm 70ml (Mới) Đã mua hàng online",10: 54 | 12/02/2023,5.0
892,https://hasaki.vn/san-pham/combo-2-serum-bi-dao-cocoon-lam-giam-mun-mo-tham-70ml-109272.html,"['96811', '109272']",109272,Huỳnh Diệu Thùy,"Mình dùng bản cũ thấy ổn hơn, bản mới dùng da khá rít dù để rất lâu cũng vẫn rít. Được cái không lên mụn, với gom cồi mụn ổn áp. Nhưng chắc do sản phẩm có BHA nên mình dùng mỗi ngày da bị bong tróc với hơi mẫn cảm.","Tinh Chất Bí Đao Cocoon Làm Giảm Mụn, Mờ Thâm 70ml (Mới) Đã mua hàng online",18: 59 | 18/12/2022,3.0
893,https://hasaki.vn/san-pham/combo-2-serum-bi-dao-cocoon-lam-giam-mun-mo-tham-70ml-109272.html,"['96811', '109272']",109272,Nguyễn Quỳnh Như,"Mình dùng không hợp, bị lên mụn, chắc do serum kiềm dầu nhiều trong khi da mình là da thường","Tinh Chất Bí Đao Cocoon Làm Giảm Mụn, Mờ Thâm 70ml (Mới) Đã mua hàng online",14: 27 | 23/11/2022,4.0
894,https://hasaki.vn/san-pham/combo-2-serum-bi-dao-cocoon-lam-giam-mun-mo-tham-70ml-109272.html,"['96811', '109272']",109272,chi Ngan,"xài không hợp, mụn đẩy lên rất nhiều","Tinh Chất Bí Đao Cocoon Làm Giảm Mụn, Mờ Thâm 70ml (Mới) Đã mua hàng online",11: 13 | 18/11/2022,3.0
895,https://hasaki.vn/san-pham/combo-2-serum-bi-dao-cocoon-lam-giam-mun-mo-tham-70ml-109272.html,"['96811', '109272']",109272,CHI TINH,Đã mua offline. Serum t thấy đặc hơn nước xíu. Dùng bị lên mụn nước li ti. Bất chấp dùng thì thấy có giảm thâm và trắng da. Da t kh dùng được kem chống nắng và che chắn bình thường. Có giảm mụn mà rất chậm.,"Tinh Chất Bí Đao Cocoon Làm Giảm Mụn, Mờ Thâm 70ml (Mới) Đã mua hàng online",09: 20 | 29/09/2022,5.0
896,https://hasaki.vn/san-pham/combo-2-serum-bi-dao-cocoon-lam-giam-mun-mo-tham-70ml-109272.html,"['96811', '109272']",109272,Ngọc Nguyễn,"giá mình bị mụn chai với mụn có nhân mình dùng 10 ngày thì giảm rõ rệt gần như hết mụn luôn, giảm thâm thì có nhưng tác dụng chậm hơn so với giảm mụn","Tinh Chất Bí Đao Cocoon Làm Giảm Mụn, Mờ Thâm 70ml (Mới) Đã mua hàng online",18: 48 | 13/08/2022,5.0
897,https://hasaki.vn/san-pham/combo-2-serum-bi-dao-cocoon-lam-giam-mun-mo-tham-70ml-109272.html,"['96811', '109272']",109272,Cao Thị Hồng Ngọc,"mình xài thấy rất hài lòng về sản phẩm này, lỏng thấm thấu nhanh thích hợp với da dầu như mình, giảm mụn hẳn","Tinh Chất Bí Đao Cocoon Làm Giảm Mụn, Mờ Thâm 70ml (Mới) Đã mua hàng online",23: 42 | 13/07/2022,5.0
898,https://hasaki.vn/san-pham/tinh-chat-chong-nang-sunplay-hieu-chinh-sac-da-50g-hong-93673.html,"['74010', '93673', '87613', '100855']",93673,Kim Tiền,kem rít và nhờn rất tệ,Tinh Chất Chống Nắng Hiệu Chỉnh Sắc Da Sunplay 50g Đã mua hàng online,12: 00 | 07/05/2019,1.0
899,https://hasaki.vn/san-pham/tinh-chat-chong-nang-sunplay-hieu-chinh-sac-da-50g-hong-93673.html,"['74010', '93673', '87613', '100855']",93673,User,"che khuyết điểm thì mình chưa thấy nhưng mà nâng tone đẹp và tự nhiên, giá cả hợp lý, chất cũng khá khó tán.","Tinh Chất Chống Nắng Sunplay Dưỡng Ẩm, Nâng Tông Da 50g Đã mua hàng online",11: 11 | 04/08/2020,4.0
900,https://hasaki.vn/san-pham/tinh-chat-chong-nang-sunplay-hieu-chinh-sac-da-50g-hong-93673.html,"['74010', '93673', '87613', '100855']",93673,Chung Nguyễn,"chất kem khô nhanh, ko bị bết nhưng nâng tông chưa thích lắm, với da mình thì nâng tông ko thấy mấy. Ngoài ra còn khó tán nữa. ko hài lòng với lớp finish lắm. Điểm cộng là ko bết dính và lâu trôi.",Tinh Chất Chống Nắng Hiệu Chỉnh Sắc Da Sunplay SPF50+/PA++++ 50g Đã mua hàng online,23: 15 | 08/07/2020,4.0
901,https://hasaki.vn/san-pham/tinh-chat-chong-nang-sunplay-hieu-chinh-sac-da-50g-hong-93673.html,"['74010', '93673', '87613', '100855']",93673,Truong Hoang Ha,"Rẻ và tốt, dùng cho cả body và face đều ko bị mụn.",Tinh Chất Chống Nắng Hiệu Chỉnh Sắc Da Sunplay SPF50+/PA++++ 50g Đã mua hàng online,06: 06 | 04/04/2020,5.0
902,https://hasaki.vn/san-pham/tinh-chat-chong-nang-sunplay-hieu-chinh-sac-da-50g-hong-93673.html,"['74010', '93673', '87613', '100855']",93673,Phuong Anh,chân ái cho đi du lịch vừa chống nắng vừa nâng tông da luôn,Tinh Chất Chống Nắng Sunplay Hiệu Chỉnh Sắc Da 50g (Tím),14: 18 | 30/06/2019,5.0
903,https://hasaki.vn/san-pham/tinh-chat-chong-nang-sunplay-hieu-chinh-sac-da-50g-hong-93673.html,"['74010', '93673', '87613', '100855']",93673,Trần Siêm,"Sản phẩm có bao bì đẹp, về công dụng nâng tông không quá rõ nhưng chất kem dễ tán, thấm nhanh , mùi dễ chịu. Mình sẽ mua lại sản phẩm này. Tuy nhiên hơi rít chút xíu thôi, mình da khô nên xài hợp. Mình nghĩ sản phẩm này không hợp với da dầu.",Tinh Chất Chống Nắng Hiệu Chỉnh Sắc Da Sunplay 50g Đã mua hàng online,21: 07 | 25/06/2019,4.0
904,https://hasaki.vn/san-pham/tinh-chat-chong-nang-sunplay-hieu-chinh-sac-da-50g-hong-93673.html,"['74010', '93673', '87613', '100855']",93673,ThanhPhong,mình sài rất Ok,Tinh Chất Chống Nắng Hiệu Chỉnh Sắc Da Sunplay 50g Đã mua hàng online,10: 36 | 17/06/2019,5.0
905,https://hasaki.vn/san-pham/tinh-chat-chong-nang-sunplay-hieu-chinh-sac-da-50g-hong-93673.html,"['74010', '93673', '87613', '100855']",93673,Thanh Huyền,"Da mình là hỗn hợp thiên dầu. Mình dùng KCN này thì bị đổ dầu chút. Mình thấy cũng ko nâng tone được bao nhiêu, vì có chức năng chống nước nữa nên khó tán, mất thời gian khi thoa",Tinh Chất Chống Nắng Hiệu Chỉnh Sắc Da Sunplay 50g Đã mua hàng online,15: 47 | 09/06/2019,3.0
906,https://hasaki.vn/san-pham/tinh-chat-chong-nang-sunplay-hieu-chinh-sac-da-50g-hong-93673.html,"['74010', '93673', '87613', '100855']",93673,Nguyen Hazel,,Tinh Chất Chống Nắng Hiệu Chỉnh Sắc Da Sunplay 50g Đã mua hàng online,18: 35 | 02/06/2019,5.0
907,https://hasaki.vn/san-pham/tinh-chat-chong-nang-sunplay-hieu-chinh-sac-da-50g-hong-93673.html,"['74010', '93673', '87613', '100855']",93673,Linh Trang Phan,"Kb nên mô tả là tốt hay không. Kem thấm nhanh, mát, nâng tone xíu xiu nói chung bôi lên thấy đẹp. Nhưng da mình quá dầu và giờ là mùa hè nên bôi xong cảm giác kb mình đã bôi chưa",Tinh Chất Chống Nắng Hiệu Chỉnh Sắc Da Sunplay 50g Đã mua hàng online,23: 08 | 31/05/2019,3.0
908,https://hasaki.vn/san-pham/tinh-chat-chong-nang-sunplay-hieu-chinh-sac-da-50g-hong-93673.html,"['74010', '93673', '87613', '100855']",93673,Nhung Nguyễn,"kem thấm nhanh, nâng tone nhẹ, ko để lại vệt trắng",Tinh Chất Chống Nắng Hiệu Chỉnh Sắc Da Sunplay 50g Đã mua hàng online,18: 02 | 29/05/2019,5.0
909,https://hasaki.vn/san-pham/tinh-chat-chong-nang-sunplay-hieu-chinh-sac-da-50g-hong-93673.html,"['74010', '93673', '87613', '100855']",93673,Lê Phương Linh,"nâng tone tạm, mùi thơm, cũng ổn",Tinh Chất Chống Nắng Sunplay Hiệu Chỉnh Sắc Da 50g #Hồng Đã mua hàng online,21: 01 | 11/06/2021,4.0
