,link_item,data_product_id_list,data_product_id,name_comment,content_comment,product_variant,datetime_comment,rating
303,https://hasaki.vn/san-pham/tinh-chat-chong-nang-sunplay-hieu-chinh-sac-da-50g-tim-74010.html,"['87613', '100855', '93673', '74010']",74010,Trần Thị Kim Lài,"mình toàn dùng sunlay, mua thử loại này da mình ko hợp , còn mới bạn nào hợp cần inox zalo 0931.79.39.58 mình để lại 50k nek",Tinh Chất Chống Nắng Sunplay Hiệu Chỉnh Sắc Da 50g (Tím) Đã mua hàng online,11: 41 | 11/03/2023,5.0
304,https://hasaki.vn/san-pham/tinh-chat-chong-nang-sunplay-hieu-chinh-sac-da-50g-tim-74010.html,"['87613', '100855', '93673', '74010']",74010,Le hoang anh,"ok thấm cực nhanh vào da nền đẹp ko quá trắng như mặt mộc luôn nhưng nền đẹp nha còn kiềm dầu hay ko chưa biết mới bôi lần à màu cam nha, màu cam kcn có màu mà mấy bà đòi nâng tông đâu ra trời nâng tông thì mua mấy màu kia kìa",Tinh Chất Chống Nắng Sunplay Hiệu Chỉnh Sắc Da 50g (Cam) Đã mua hàng online,16: 32 | 05/03/2023,5.0
305,https://hasaki.vn/san-pham/tinh-chat-chong-nang-sunplay-hieu-chinh-sac-da-50g-tim-74010.html,"['87613', '100855', '93673', '74010']",74010,Giang Thư,"Kem chống nắng khá ổn, lên tone cũng tốt mà gặp nước là trôi hết. Mình da khô nha.",Tinh Chất Chống Nắng Sunplay Hiệu Chỉnh Sắc Da 50g (Tím) Đã mua hàng online,14: 15 | 17/02/2023,5.0
306,https://hasaki.vn/san-pham/sua-chong-nang-sunplay-hieu-chinh-sac-da-50g-tim-75956.html,"['93675', '100857', '75956', '87611']",75956,Nguyễn Thảo Quyên,"kcn này kiềm dầu cực đỉnh luôn :>, em học thể dục mà mặt vẫn khô thoáng, bạn bè ai cũng khen hết","Sữa Chống Nắng Sunplay Kiềm Dầu, Hiệu Chỉnh Sắc Da 50g Đã mua hàng online",20: 31 | 07/10/2020,5.0
307,https://hasaki.vn/san-pham/sua-chong-nang-sunplay-hieu-chinh-sac-da-50g-tim-75956.html,"['93675', '100857', '75956', '87611']",75956,Thủy Tiên,"Apply lên da thấy có nâng tông xíu, cảm quan mịn đẹp kh rít bết. Mùi thơm thoang thoảng khá oke, kiềm dầu tạm. Được tặng kèm tuýp srm Hada Labo 20g nữa lalala=))","Sữa Chống Nắng Sunplay Kiềm Dầu, Nâng Tông Da 50g Đã mua hàng online",13: 09 | 21/08/2020,5.0
308,https://hasaki.vn/san-pham/sua-chong-nang-sunplay-hieu-chinh-sac-da-50g-tim-75956.html,"['93675', '100857', '75956', '87611']",75956,Phạm Như,che khuyết điểm thì ko thấy.nâng tone da cũng ko thấy rõ nhưng sp đc cái thẩm thấu nhanh.chất sữa lỏng dễ tán và kiềm dầu rất tốt.sẽ tiếp tục mua lại sản phẩm khi dùng hết,"Sữa Chống Nắng Sunplay Kiềm Dầu, Nâng Tông Da 50g Đã mua hàng online",14: 02 | 16/08/2020,5.0
309,https://hasaki.vn/san-pham/sua-chong-nang-sunplay-hieu-chinh-sac-da-50g-tim-75956.html,"['93675', '100857', '75956', '87611']",75956,Ty Ka,"giao hàng nhanh, sp thẩm thấu nhanh , mùi dễ chịu k nồng",Sữa Chống Nắng Kiềm Dầu Nâng Tông Che Khuyết Điểm Sunplay SPF50+ PA++++ 50g Đã mua hàng online,07: 06 | 06/07/2020,5.0
310,https://hasaki.vn/san-pham/sua-chong-nang-sunplay-hieu-chinh-sac-da-50g-tim-75956.html,"['93675', '100857', '75956', '87611']",75956,Nam Phương,,Sữa Chống Nắng Hiệu Chỉnh Sắc Da Sunplay SPF50+/PA++++ 50g Đã mua hàng online,22: 06 | 19/05/2020,4.0
311,https://hasaki.vn/san-pham/sua-chong-nang-sunplay-hieu-chinh-sac-da-50g-tim-75956.html,"['93675', '100857', '75956', '87611']",75956,Mai Thùy,mình da hỗn hợp thiên dầu xài thấy ok lắm nha,Sữa Chống Nắng Hiệu Chỉnh Sắc Da Sunplay SPF50+/PA++++ 50g Đã mua hàng online,20: 46 | 16/05/2020,5.0
312,https://hasaki.vn/san-pham/sua-chong-nang-sunplay-hieu-chinh-sac-da-50g-tim-75956.html,"['93675', '100857', '75956', '87611']",75956,Lê Mỷ Nhàn,"chất lỏng nhẹ, lên da có độ phản chiếu ánh sáng khá đẹp, nâng tone da nhẹ, giá cả hợp lý",Sữa Chống Nắng Hiệu Chỉnh Sắc Da Sunplay SPF50+/PA++++ 50g Đã mua hàng online,22: 34 | 04/04/2020,5.0
313,https://hasaki.vn/san-pham/sua-chong-nang-sunplay-hieu-chinh-sac-da-50g-tim-75956.html,"['93675', '100857', '75956', '87611']",75956,Doan Heidi,"Ui , em này có nhũ nha mọi người , bạn nào da mụn hay nhạy cảm nên cân nhắc Chất kem đặc sệt , có màu tím nhạt và khi thoa trên da sẽ nâng tone nhẹ và không có mùi gì khó chịu cả",Sữa Chống Nắng Sunplay Hiệu Chỉnh Sắc Da 50g #Tím Đã mua hàng online,10: 22 | 13/04/2021,5.0
314,https://hasaki.vn/san-pham/sua-chong-nang-sunplay-hieu-chinh-sac-da-50g-tim-75956.html,"['93675', '100857', '75956', '87611']",75956,Lệ Jumy,mình da dầu mà vẫn thấy khô da nè. dk lớp phủ đẹp và mịn. chống nc thic lắm,Sữa Chống Nắng Sunplay Hiệu Chỉnh Sắc Da 50g #Tím Đã mua hàng online,22: 42 | 10/04/2021,5.0
315,https://hasaki.vn/san-pham/sua-chong-nang-sunplay-hieu-chinh-sac-da-50g-tim-75956.html,"['93675', '100857', '75956', '87611']",75956,chị Vy,"Mình đã sử dụng qua nhiều KCN có thương hiệu của Hàn Quốc nhưng khi mình mua dùng thử Sữa Chống Nắng Sunplay Skin Aqua Tone Up UV Milk Mint Green SPF50+ PA++++ (50g) thì thật bất ngờ khi bôi lên da láng mịn khô ráo như phấn, còn nâng tone thì do da mình trắng nên thấy nó tiệp màu da mình",Sữa Chống Nắng Sunplay Hiệu Chỉnh Sắc Da 50g #Hồng Đã mua hàng online,12: 24 | 17/03/2021,5.0
316,https://hasaki.vn/san-pham/sua-chong-nang-sunplay-hieu-chinh-sac-da-50g-tim-75956.html,"['93675', '100857', '75956', '87611']",75956,Trà Chanh channel,"với người chỉ cần chống nắng cơ bản, màu da sáng và trắng hơn chút xíu thì đây là 1 lựa chọn cực kì hợp lý, mình mua 2 cái dạng milk màu xanh dùng khá thích, kiềm dầu TỐT trong 2 tiếng và giảm dần, bôi lên mặt cực sướng, cảm giác như phấn rôm em bé vậy, chim ưng lắm luôn, ai còn đang phân vân thì mình khuyên nên tậu thử 1 em nhé, mê đấy =)) TỐT VỚI GIÁ TIỀN 114K","Sữa Chống Nắng Sunplay Kiềm Dầu, Nâng Tông Da 50g Đã mua hàng online",21: 22 | 24/02/2021,5.0
317,https://hasaki.vn/san-pham/sua-chong-nang-sunplay-hieu-chinh-sac-da-50g-tim-75956.html,"['93675', '100857', '75956', '87611']",75956,Ngọc phụng,Sữa chống nắng dành cho da mặt dầu xài rất OK,"Sữa Chống Nắng Sunplay Kiềm Dầu, Nâng Tông Da 50g Đã mua hàng online",14: 53 | 15/01/2021,5.0
318,https://hasaki.vn/san-pham/sua-chong-nang-sunplay-hieu-chinh-sac-da-50g-tim-75956.html,"['93675', '100857', '75956', '87611']",75956,Linh K Pham,kiềm dầu tốt. khô ráo. màu hơi kì nếu không phủ thêm lớp phấn lên trên. che khuyết điểm nhẹ.,"Sữa Chống Nắng Sunplay Kiềm Dầu, Hiệu Chỉnh Sắc Da 50g Đã mua hàng online",23: 24 | 31/12/2020,5.0
319,https://hasaki.vn/san-pham/sua-chong-nang-sunplay-hieu-chinh-sac-da-50g-tim-75956.html,"['93675', '100857', '75956', '87611']",75956,User,"Sản phẩm thấm nhanh, sài tốt. Mua đợt sale có 114k mà còn được tặng bộ scrunchies xinh xinh :3 nói chung là thíchhh...","Sữa Chống Nắng Sunplay Kiềm Dầu, Nâng Tông Da 50g Đã mua hàng online",14: 32 | 06/12/2020,5.0
320,https://hasaki.vn/san-pham/sua-chong-nang-sunplay-hieu-chinh-sac-da-50g-tim-75956.html,"['93675', '100857', '75956', '87611']",75956,Hương Xuân,"Mình da dầu nhưng apply lên thấm rất nhanh, ko gây nhờn rít. Dùng đến chiều mới tẩy trang nhưng da vẫn thoáng ko đổ dầu nhiều, kiềm dầu tốt, dùng dạng sữa thích hơn dạng kem. Rất đáng để mua","Sữa Chống Nắng Sunplay Kiềm Dầu, Nâng Tông Da 50g Đã mua hàng online",15: 28 | 28/11/2020,5.0
321,https://hasaki.vn/san-pham/sua-chong-nang-sunplay-hieu-chinh-sac-da-50g-tim-75956.html,"['93675', '100857', '75956', '87611']",75956,Kiều Châu,,"Sữa Chống Nắng Sunplay Kiềm Dầu, Nâng Tông Da 50g Đã mua hàng online",17: 52 | 21/11/2020,5.0
322,https://hasaki.vn/san-pham/sua-chong-nang-sunplay-hieu-chinh-sac-da-50g-tim-75956.html,"['93675', '100857', '75956', '87611']",75956,Lê Thị Ngọc Nhi,"sp này thấm siêu nhanh, kiềm dầu tốt. đáng dùng","Sữa Chống Nắng Sunplay Kiềm Dầu, Hiệu Chỉnh Sắc Da 50g Đã mua hàng online",19: 43 | 12/10/2020,5.0
323,https://hasaki.vn/san-pham/sua-chong-nang-sunplay-hieu-chinh-sac-da-50g-tim-75956.html,"['93675', '100857', '75956', '87611']",75956,Hoàng,"kiềm dầu cũng ok nhưng có bị vón cục ngay khóe mũi.Nếu da mụn thì mik thấy nên tẩy trang kĩ hơn, có điều cái mùi của kcn theo mik thì hơi nồng.",Sữa Chống Nắng Sunplay Hiệu Chỉnh Sắc Da 50g #Xanh Đã mua hàng online,14: 01 | 19/08/2021,5.0
324,https://hasaki.vn/san-pham/sua-chong-nang-sunplay-hieu-chinh-sac-da-50g-tim-75956.html,"['93675', '100857', '75956', '87611']",75956,Yến Huỳnh,"kiềm dầu cực tốt nhưng hơi bột bột á, ko có đc mịn lắm với khá khô, nếu có dưỡng ẩm trc thì ok, da lên tông nhẹ, nếu thoa ko đều sẽ có hiện tượng vón cục ở những chỗ như khoé mũi, mắt chẳng hạn",Sữa Chống Nắng Sunplay Hiệu Chỉnh Sắc Da 50g #Xanh Đã mua hàng online,22: 28 | 01/08/2021,5.0
325,https://hasaki.vn/san-pham/sua-chong-nang-sunplay-hieu-chinh-sac-da-50g-tim-75956.html,"['93675', '100857', '75956', '87611']",75956,Bùi Ngọc Thiên Hương,"Kiềm dầu cực tốt, mùi thơm nhẹ, chất đặc hơn mấy kcn dạng milk khác, finish lì đẹp. Đáng mua nha",Sữa Chống Nắng Sunplay Hiệu Chỉnh Sắc Da 50g #Tím Đã mua hàng online,13: 01 | 28/06/2021,5.0
326,https://hasaki.vn/san-pham/sua-chong-nang-sunplay-hieu-chinh-sac-da-50g-tim-75956.html,"['93675', '100857', '75956', '87611']",75956,Lê Thị Thu Xuân,"Thơm, mịn, thật sự thích luôn á.",Sữa Chống Nắng Sunplay Hiệu Chỉnh Sắc Da 50g #Tím Đã mua hàng online,16: 43 | 06/06/2021,5.0
327,https://hasaki.vn/san-pham/sua-chong-nang-sunplay-hieu-chinh-sac-da-50g-tim-75956.html,"['93675', '100857', '75956', '87611']",75956,Trần Thị Hà Phương,"Xài 3 chai tinh chất màu tím giờ chuyển qua chai này, chất sửa màu hồng nhạt mùi thom dê chịu và mỏng nhẹ, k bị đổ dầu.",Sữa Chống Nắng Sunplay Hiệu Chỉnh Sắc Da 50g #Hồng Đã mua hàng online,13: 24 | 22/05/2021,5.0
328,https://hasaki.vn/san-pham/sua-chong-nang-sunplay-hieu-chinh-sac-da-50g-tim-75956.html,"['93675', '100857', '75956', '87611']",75956,Nguyenngocthanh10C,,Sữa Chống Nắng Sunplay Hiệu Chỉnh Sắc Da 50g #Tím Đã mua hàng online,13: 12 | 13/05/2021,5.0
329,https://hasaki.vn/san-pham/sua-chong-nang-sunplay-hieu-chinh-sac-da-50g-tim-75956.html,"['93675', '100857', '75956', '87611']",75956,Phương Thảo,"Mình da dầu dùng dạng milk thấy kiềm dầu rất tốt, đến cuối ngày vẫn không bị đổ dầu. Mình có hơi thấy khô căng, khó chịu trên da. Bạn nào da không quá dầu thì cân nhắc nhé, còn bạn nào da rất nhiều dầu thì dùng ok ạ. Thấm nhanh lắm luôn ý, thoa xong thấy rất mịn, nâng tone khá nhiều, phụ hợp dùng vào mùa hè.",Sữa Chống Nắng Sunplay Hiệu Chỉnh Sắc Da 50g #Xanh Đã mua hàng online,22: 40 | 10/05/2021,5.0
330,https://hasaki.vn/san-pham/sua-chong-nang-sunplay-hieu-chinh-sac-da-50g-tim-75956.html,"['93675', '100857', '75956', '87611']",75956,Khánh Tường,Da dầu xài dạng milk ok hơn nhiều nhé!,Sữa Chống Nắng Sunplay Hiệu Chỉnh Sắc Da 50g #Xanh Đã mua hàng online,14: 58 | 07/05/2021,5.0
331,https://hasaki.vn/san-pham/sua-chong-nang-sunplay-hieu-chinh-sac-da-50g-tim-75956.html,"['93675', '100857', '75956', '87611']",75956,Nguyễn Thanh Mai,ngửi kỹ không có mùi là duyệt giao hàng nhanh cực,Sữa Chống Nắng Sunplay Hiệu Chỉnh Sắc Da 50g #Xanh Đã mua hàng online,16: 08 | 27/04/2021,5.0
332,https://hasaki.vn/san-pham/sua-chong-nang-sunplay-hieu-chinh-sac-da-50g-tim-75956.html,"['93675', '100857', '75956', '87611']",75956,Nguyễn Hoàng Minh Thư,,Sữa Chống Nắng Sunplay Hiệu Chỉnh Sắc Da 50g #Tím Đã mua hàng online,16: 36 | 26/04/2021,4.0
333,https://hasaki.vn/san-pham/sua-chong-nang-sunplay-hieu-chinh-sac-da-50g-tim-75956.html,"['93675', '100857', '75956', '87611']",75956,Asla JB'k,sao lại dùng cho da dầu nhỉ.. thua loại đặc kia nữa.. k kiềm dầu đã đành.. còn tạo lớp mỏng khó chịu.. dau dầu có hợp đâu.. vậy mà chai da khô kia lại kiềm dầu nang tone mới ghê. chai sữa này đâu có nâng tone,Sữa Chống Nắng Sunplay Hiệu Chỉnh Sắc Da 50g #Tím Đã mua hàng online,09: 11 | 27/01/2022,3.0
334,https://hasaki.vn/san-pham/sua-chong-nang-sunplay-hieu-chinh-sac-da-50g-tim-75956.html,"['93675', '100857', '75956', '87611']",75956,Phạm Thị Bích Thùy,"sản phẩm kiềm dầu rất tốt, thấm nhanh nâng tone nhẹ",Sữa Chống Nắng Sunplay Hiệu Chỉnh Sắc Da 50g #Hồng Đã mua hàng online,19: 57 | 17/01/2022,5.0
335,https://hasaki.vn/san-pham/sua-chong-nang-sunplay-hieu-chinh-sac-da-50g-tim-75956.html,"['93675', '100857', '75956', '87611']",75956,hồ nguyễn ngọc hân,sản phẩm khá ok nâng tông nhẹ hợp vs da mình,Sữa Chống Nắng Sunplay Hiệu Chỉnh Sắc Da 50g #Xanh Đã mua hàng online,18: 02 | 23/12/2021,5.0
336,https://hasaki.vn/san-pham/sua-chong-nang-sunplay-hieu-chinh-sac-da-50g-tim-75956.html,"['93675', '100857', '75956', '87611']",75956,Nguyen Thi Phuong Thao,"thoa lên thấy nâng tông da, mịn và kiềm dầu tốt...",Sữa Chống Nắng Sunplay Hiệu Chỉnh Sắc Da 50g #Tím Đã mua hàng online,07: 59 | 16/11/2021,5.0
337,https://hasaki.vn/san-pham/sua-chong-nang-sunplay-hieu-chinh-sac-da-50g-tim-75956.html,"['93675', '100857', '75956', '87611']",75956,Đỗ Thuỳ Linh,,Sữa Chống Nắng Sunplay Hiệu Chỉnh Sắc Da 50g #Tím Đã mua hàng online,21: 55 | 10/11/2021,5.0
338,https://hasaki.vn/san-pham/sua-chong-nang-sunplay-hieu-chinh-sac-da-50g-tim-75956.html,"['93675', '100857', '75956', '87611']",75956,Nguyễn Thị Triệu Vi,Giao hàng nhanh nhân viên tư vấn dễ thương,Sữa Chống Nắng Sunplay Hiệu Chỉnh Sắc Da 50g #Tím Đã mua hàng online,17: 05 | 10/11/2021,5.0
339,https://hasaki.vn/san-pham/sua-chong-nang-sunplay-hieu-chinh-sac-da-50g-tim-75956.html,"['93675', '100857', '75956', '87611']",75956,Tiền Lê,kiềm dầu và nâng tông tốt trong tầm giá,Sữa Chống Nắng Sunplay Hiệu Chỉnh Sắc Da 50g #Tím Đã mua hàng online,19: 10 | 04/11/2021,5.0
340,https://hasaki.vn/san-pham/sua-chong-nang-sunplay-hieu-chinh-sac-da-50g-tim-75956.html,"['93675', '100857', '75956', '87611']",75956,Linh Chi,"Da mình da dầu ít mụn nhma kcn này xuất sắc luôn. Kiềm dầu đỉnh, ko gây khô da mà nâng tone xíu.",Sữa Chống Nắng Sunplay Hiệu Chỉnh Sắc Da 50g #Tím Đã mua hàng online,19: 01 | 26/10/2021,5.0
341,https://hasaki.vn/san-pham/sua-chong-nang-sunplay-hieu-chinh-sac-da-50g-tim-75956.html,"['93675', '100857', '75956', '87611']",75956,Nguyễn Cẩm,"Kiềm dầu cực kì tốt luôn, ưng ý và còn đáng đồng tiền nữa ❤️",Sữa Chống Nắng Sunplay Hiệu Chỉnh Sắc Da 50g #Tím Đã mua hàng online,15: 56 | 07/10/2021,5.0
342,https://hasaki.vn/san-pham/sua-chong-nang-sunplay-hieu-chinh-sac-da-50g-tim-75956.html,"['93675', '100857', '75956', '87611']",75956,Hà Nguyễn,"Kem chống nắng kiềm dầu ,nâng tông tự nhiên",Sữa Chống Nắng Sunplay Hiệu Chỉnh Sắc Da 50g #Tím Đã mua hàng online,12: 26 | 17/09/2021,5.0
343,https://hasaki.vn/san-pham/sua-chong-nang-sunplay-hieu-chinh-sac-da-50g-tim-75956.html,"['93675', '100857', '75956', '87611']",75956,Châu Nguyễn,đóng gói chắc chắn tầm 3-4 ngày giao tới sài da mình hỗn hợp thiên dầu thì mình thấy kiềm dầu ổn có bật tone bạn nào mún chắc chắn có thể sử dụng thêm phấn phủ,Sữa Chống Nắng Sunplay Hiệu Chỉnh Sắc Da 50g (Xanh) Đã mua hàng online,08: 00 | 08/05/2022,5.0
344,https://hasaki.vn/san-pham/sua-chong-nang-sunplay-hieu-chinh-sac-da-50g-tim-75956.html,"['93675', '100857', '75956', '87611']",75956,Nguyễn Thị Cẩm Tú,"Da dầu. Kem dễ tán, k có vệt, k bết dính, Lớp finish rất đẹp, Sau khi thấm tạo 1 lớp màng mướt, ánh hồng, láng mịn. K bít tắc, k gây mụn. Nói chung là mình đang tính mua lại thì thấy e này có chứa parapen nên đang cân nhắc",Sữa Chống Nắng Sunplay Hiệu Chỉnh Sắc Da 50g (Tím) Đã mua hàng online,14: 24 | 30/04/2022,4.0
345,https://hasaki.vn/san-pham/sua-chong-nang-sunplay-hieu-chinh-sac-da-50g-tim-75956.html,"['93675', '100857', '75956', '87611']",75956,Phương Chi,"Mình test thử thấy kiềm dầu khá tốt, nâng tone nữa, nói chung rất đáng tiền. Mng nên thử",Sữa Chống Nắng Sunplay Hiệu Chỉnh Sắc Da 50g (Màu Tím) Đã mua hàng online,14: 25 | 28/04/2022,5.0
346,https://hasaki.vn/san-pham/sua-chong-nang-sunplay-hieu-chinh-sac-da-50g-tim-75956.html,"['93675', '100857', '75956', '87611']",75956,Nguyễn Hồng Ngân,"Mình đã dùng tới lọ thứ 2 rồi, mình dùng dạng sữa màu xanh mint ấy. Ấn tượng đầu tiên của mình là em này kiềm dầu hơi bị ổn áp nha. Da mình là da hỗn hợp thiên dầu có khá nhiều mụn nhưng xài vẫn rất ổn, không bị kích ứng, lên thêm mụn hay là bóng dầu đâu nè. Còn phần lên tone thì chỉ lên tone nhẹ khoảng 30 phút đầu thôi, về sau thì tệp vào màu da bình thường rồi. Nói chung ai da dầu thì nên xài thử, đúng kiểu ngon bổ rẻ luôn.",Sữa Chống Nắng Sunplay Hiệu Chỉnh Sắc Da 50g (Màu Xanh) Đã mua hàng online,18: 24 | 26/04/2022,5.0
347,https://hasaki.vn/san-pham/sua-chong-nang-sunplay-hieu-chinh-sac-da-50g-tim-75956.html,"['93675', '100857', '75956', '87611']",75956,Trần Thị Ánh Ngọc,"Đánh giá theo cảm quan cá nhân Ưu điểm: +Giá thành hợp lý, thường xuyên có sale +Kết cấu mỏng nhẹ, dễ tán, không mùi +Nâng tone nhẹ nhàng nếu thoa lượng vừa phải +Kiềm dầu tốt (tầm 9-10t sau mới có hiện tượng đổ dầu hai bên cánh mũi) +Bảng thành phần khá an toàn nhưng do da mình rất nhạy cảm nên có 1 số ít lần bị ngứa hai bên viền mặt Nhược điểm: +Da ai không tẩy tbc thường xuyên, khi thoa sẽ lợn cợn +Đổ mồ hôi sẽ có vệt loang +Xuống tone sau khoản 4t +Khi thoa phải kết hợp vỗ nhẹ mới nhanh thấm",Sữa Chống Nắng Sunplay Hiệu Chỉnh Sắc Da 50g (Màu Tím) Đã mua hàng online,10: 07 | 05/04/2022,4.0
348,https://hasaki.vn/san-pham/sua-chong-nang-sunplay-hieu-chinh-sac-da-50g-tim-75956.html,"['93675', '100857', '75956', '87611']",75956,Pham Chau,"Đã nhận được SP KCN - Aqua lavender + Aqua rose. SP chống nắng kiềm dầu thần thánh, cứu rỗi được tuyến dầu của mình. Mình đã sd nhiều brand khác nhau và quay lại với Aqua chân ái. Dạng milk mỏng nhẹ, thấm nhanh & không để lại vệt trắng hay loang trên da, khi mới apply thì nâng tông rất rõ, sau 10’ - 15’ thì xuống tông tiệp hẳn màu da. Với những ngày bình thường không cần makeup thì chỉ 1 lớp KCN Aqua cũng đủ tự tin rồi nha ♥︎ ➥ Rất ưng ý - vote 5☆☆☆☆☆ nha!",Sữa Chống Nắng Sunplay Hiệu Chỉnh Sắc Da 50g (Màu Tím) Đã mua hàng online,15: 42 | 03/04/2022,5.0
349,https://hasaki.vn/san-pham/sua-chong-nang-sunplay-hieu-chinh-sac-da-50g-tim-75956.html,"['93675', '100857', '75956', '87611']",75956,ĐẶNG TẤN TÀI,"Xịn, ko nói nhiều, thấm nhanh ko bệt trắng, thoa xong da lên 2 tone, cảm giác chỉ thoáng mịn và rất nhẹ mặt. Tầm giá thì skin aqua vẫn ngon nhất, Rohto số 2 ko ai số 1 phân khúc dưới 200k",Sữa Chống Nắng Sunplay Hiệu Chỉnh Sắc Da 50g (Màu Xanh) Đã mua hàng online,10: 04 | 03/04/2022,5.0
350,https://hasaki.vn/san-pham/sua-chong-nang-sunplay-hieu-chinh-sac-da-50g-tim-75956.html,"['93675', '100857', '75956', '87611']",75956,Tam Nguyen,"Da mình dầu, xài nhiều loại từ centella đến surmedic, qua loại này thấy cũng ổn, tuy nhiên bị cay mắt. Ko biết có ai bị như mình ko",Sữa Chống Nắng Sunplay Hiệu Chỉnh Sắc Da 50g #Tím Đã mua hàng online,10: 52 | 12/02/2022,4.0
351,https://hasaki.vn/san-pham/sua-chong-nang-sunplay-hieu-chinh-sac-da-50g-tim-75956.html,"['93675', '100857', '75956', '87611']",75956,c dươg,,Sữa Chống Nắng Sunplay Hiệu Chỉnh Sắc Da 50g #Xanh Đã mua hàng online,22: 16 | 06/02/2022,5.0
352,https://hasaki.vn/san-pham/sua-chong-nang-sunplay-hieu-chinh-sac-da-50g-tim-75956.html,"['93675', '100857', '75956', '87611']",75956,Nguyễn Huỳnh Như,"Mình xài ok lắm. Có 1 thắc mắc lúc trc mình mua nắp vừa như in, lần này nắp đậy lại bị hở ra , mình xem lại nắp nhỏ hơn chai đợt trước mình mua",Sữa Chống Nắng Sunplay Hiệu Chỉnh Sắc Da 50g #Xanh Đã mua hàng online,08: 09 | 28/01/2022,5.0
353,https://hasaki.vn/san-pham/sua-chong-nang-sunplay-hieu-chinh-sac-da-50g-tim-75956.html,"['93675', '100857', '75956', '87611']",75956,Bảo Ngọc,"mình đã dùng cả 2 màu xanh và tím thì mình thấy màu tím chất lỏng dễ tán nhẹ mặt hơn, và cảm giác kiềm dầu cũng tốt hơn so với màu xanh, còn màu xanh thì mùi hương nồng hơn so với mấy bạn nhạy cảm với hương liệu, chất dày hơn chút nên khi tán kem toàn bị dính ở tay, và mình đã test ở hôm trời nồm 2 màu này thì thấy màu xanh kiềm dầu kém hơn chút",Sữa Chống Nắng Sunplay Hiệu Chỉnh Sắc Da 50g (Tím) Đã mua hàng online,09: 14 | 17/11/2022,5.0
354,https://hasaki.vn/san-pham/sua-chong-nang-sunplay-hieu-chinh-sac-da-50g-tim-75956.html,"['93675', '100857', '75956', '87611']",75956,Nguyễn Nhiên,"Chân ái đời mình, mình xài chắc chục chai rồi, khả năng kiềm dầu ổn chứ nhỉ, lên da để lại lớp finish cực kỳ đẹp, và một điều quan trọng nữa là khả năng chống nắng tốt, da mặt mình kết hợp một số loại mỹ phẩm khác và kcn này đc cái da ưng quá trời ưng, ai cũng bảo da mặt trắng hơn người, còn mịn nữa, da dầu mụn nên mua nha, da mình dầu lắm luôn mà xài rất ổn, mãi keo với kcn này của skin aqua",Sữa Chống Nắng Sunplay Hiệu Chỉnh Sắc Da 50g (Xanh) Đã mua hàng online,08: 28 | 13/11/2022,5.0
355,https://hasaki.vn/san-pham/sua-chong-nang-sunplay-hieu-chinh-sac-da-50g-tim-75956.html,"['93675', '100857', '75956', '87611']",75956,Vy,"Lần thứ 2 đặt lại, theo mình cảm nhận dùng em này có nâng tone nhẹ, che khuyết điểm ok đấy, khi thoa để lại lớp bóng nhẹ rồi khô nhanh giá hạt dẻ",Sữa Chống Nắng Sunplay Hiệu Chỉnh Sắc Da 50g (Xanh) Đã mua hàng online,16: 12 | 20/10/2022,5.0
356,https://hasaki.vn/san-pham/sua-chong-nang-sunplay-hieu-chinh-sac-da-50g-tim-75956.html,"['93675', '100857', '75956', '87611']",75956,Nguyễn Mỹ Hạnh,"Dùng chai này lần thứ 4 r ncl quá ổn da hơi ngăm thì dùng nâng tone là vừa đẹp treat thì k dùng dc bạn này, phù hợp hssv",Sữa Chống Nắng Sunplay Hiệu Chỉnh Sắc Da 50g (Xanh) Đã mua hàng online,20: 33 | 14/10/2022,5.0
357,https://hasaki.vn/san-pham/sua-chong-nang-sunplay-hieu-chinh-sac-da-50g-tim-75956.html,"['93675', '100857', '75956', '87611']",75956,Anh Thư,"sản phẩm giao nhanh, đóng gói cẩn thận",Sữa Chống Nắng Sunplay Hiệu Chỉnh Sắc Da 50g (Xanh) Đã mua hàng online,09: 08 | 13/10/2022,5.0
358,https://hasaki.vn/san-pham/sua-chong-nang-sunplay-hieu-chinh-sac-da-50g-tim-75956.html,"['93675', '100857', '75956', '87611']",75956,Phạm Quỳnh Anh,"Nâng tone nhẹ, tùy theo mức độ sữa mà mình lấy. Kiềm dầu nhưng không gây khô da. Bôi xong ra nắng sẽ thấy trên da xuất hiện lấp lánh.",Sữa Chống Nắng Sunplay Hiệu Chỉnh Sắc Da 50g (Tím) Đã mua hàng online,15: 35 | 05/09/2022,4.0
359,https://hasaki.vn/san-pham/sua-chong-nang-sunplay-hieu-chinh-sac-da-50g-tim-75956.html,"['93675', '100857', '75956', '87611']",75956,Phạm Ngọc Như Ý,"Mình xài 1 tuần thấy lên mụn, mấy bạn da nhạy cảm với da dầu chú ý nha.",Sữa Chống Nắng Sunplay Hiệu Chỉnh Sắc Da 50g (Xanh) Đã mua hàng online,18: 25 | 04/09/2022,4.0
360,https://hasaki.vn/san-pham/sua-chong-nang-sunplay-hieu-chinh-sac-da-50g-tim-75956.html,"['93675', '100857', '75956', '87611']",75956,Thảo Bùi,Không có tặng kèm bông tẩy trang,Sữa Chống Nắng Sunplay Hiệu Chỉnh Sắc Da 50g (Tím) Đã mua hàng online,07: 32 | 23/08/2022,4.0
361,https://hasaki.vn/san-pham/sua-chong-nang-sunplay-hieu-chinh-sac-da-50g-tim-75956.html,"['93675', '100857', '75956', '87611']",75956,Dung Tú,"mùi dễ chịu. lúc mới thoa sẽ bóng dầu, sau khi tệp vào da rất mịn khô thoáng, kiềm dầu tốt, da thường từ 7h sáng tới 3h chiều không đỗ dầu nhiều, khả năng lên tone kém, ko che được thâm mụn đỏ.",Sữa Chống Nắng Sunplay Hiệu Chỉnh Sắc Da 50g (Xanh) Đã mua hàng online,02: 31 | 24/07/2022,4.0
