,link_item,data_product_id_list,data_product_id,name_comment,content_comment,product_variant,datetime_comment,rating
439,https://hasaki.vn/san-pham/nuoc-tay-trang-bioderma-danh-cho-da-nhay-cam-250ml-1736.html,"['9740', '114912', '1736', '1735']",1736,Anh nguyen,Mình toàn mua mỹ phẩm của HASAKI chất lượng rất tuyệt vời. Mua với giá 315k gì có phiếu giảm giá và săn sale quá là ưng ý ❤️❤️❤️❤️,Nước Tẩy Trang Bioderma Dành Cho Da Nhạy Cảm 500ml Đã mua hàng online,20: 21 | 28/10/2021,5.0
440,https://hasaki.vn/san-pham/nuoc-tay-trang-bioderma-danh-cho-da-nhay-cam-250ml-1736.html,"['9740', '114912', '1736', '1735']",1736,VY,"sài rất ổn, mình chỉ sài loại này thôi.",Nước Tẩy Trang Bioderma Dành Cho Da Nhạy Cảm 500ml Đã mua hàng online,18: 13 | 18/10/2021,5.0
441,https://hasaki.vn/san-pham/nuoc-tay-trang-bioderma-danh-cho-da-nhay-cam-250ml-1736.html,"['9740', '114912', '1736', '1735']",1736,Trinh Phạm,"e này thì OK khỏi bàn, Thích nhất dịch vụ của giao hàng của hasaki, dù dịch như giao hàng ở tỉnh khá nhanh.",Nước Tẩy Trang Bioderma Dành Cho Da Nhạy Cảm 500ml Đã mua hàng online,16: 36 | 20/09/2021,5.0
442,https://hasaki.vn/san-pham/nuoc-tay-trang-bioderma-danh-cho-da-nhay-cam-250ml-1736.html,"['9740', '114912', '1736', '1735']",1736,Tường Vân,tẩy trang bio thì khỏi chê rồi đỉnh nhất trong các dòng mình từng dùng chân ái đời mình,Nước Tẩy Trang Bioderma Dành Cho Da Nhạy Cảm 500ml Đã mua hàng online,08: 19 | 13/09/2021,5.0
443,https://hasaki.vn/san-pham/nuoc-tay-trang-bioderma-danh-cho-da-nhay-cam-250ml-1736.html,"['9740', '114912', '1736', '1735']",1736,Phan Thuấn,Uy tín,Nước Tẩy Trang Bioderma Dành Cho Da Nhạy Cảm 500ml Đã mua hàng online,14: 52 | 14/08/2021,5.0
444,https://hasaki.vn/san-pham/nuoc-tay-trang-bioderma-danh-cho-da-nhay-cam-250ml-1736.html,"['9740', '114912', '1736', '1735']",1736,Đặng ái xuân,,Nước Tẩy Trang Bioderma Dành Cho Da Nhạy Cảm 500ml Đã mua hàng online,14: 14 | 09/07/2021,5.0
445,https://hasaki.vn/san-pham/nuoc-tay-trang-bioderma-danh-cho-da-nhay-cam-250ml-1736.html,"['9740', '114912', '1736', '1735']",1736,Ngọc Ty,jjghy,Nước Tẩy Trang Bioderma Dành Cho Da Nhạy Cảm 500ml Đã mua hàng online,15: 09 | 07/07/2021,5.0
446,https://hasaki.vn/san-pham/nuoc-tay-trang-bioderma-danh-cho-da-nhay-cam-250ml-1736.html,"['9740', '114912', '1736', '1735']",1736,@hì,Mua được giá khá hời còn được tặng thêm quà nữa nhưng mà mình ko biết dùng cái ở giữa trong bộ quà tặng sao luôn=))giao hàng nhanh nhưng mà shipper kiểu hời hợt ấy do hqua mình có mất đth nên là gọi ko đc xong mình mượn đth bạn đăng nhập zalo nhắn thì trả lời cứ như là mua hàng ko trả tiền á trả lời tin nhắn mình hẹn giao lại mà nói chuyện rất cục súc luôn ấy:(,Nước Tẩy Trang Bioderma Dành Cho Da Nhạy Cảm 500ml Đã mua hàng online,12: 05 | 22/05/2022,5.0
447,https://hasaki.vn/san-pham/nuoc-tay-trang-bioderma-danh-cho-da-nhay-cam-250ml-1736.html,"['9740', '114912', '1736', '1735']",1736,Sĩ Hoàng,test,Nước Tẩy Trang Bioderma Dành Cho Da Nhạy Cảm 500ml Đã mua hàng online,16: 26 | 05/03/2022,5.0
448,https://hasaki.vn/san-pham/nuoc-tay-trang-bioderma-danh-cho-da-nhay-cam-250ml-1736.html,"['9740', '114912', '1736', '1735']",1736,Lệ Bình Hứa,tot,Nước Tẩy Trang Bioderma Dành Cho Da Nhạy Cảm 500ml Đã mua hàng online,23: 28 | 28/02/2022,5.0
449,https://hasaki.vn/san-pham/nuoc-tay-trang-bioderma-danh-cho-da-nhay-cam-250ml-1736.html,"['9740', '114912', '1736', '1735']",1736,Trần Mạnh Hậu,Q,Nước Tẩy Trang Bioderma Dành Cho Da Nhạy Cảm 500ml Đã mua hàng online,10: 11 | 22/02/2022,5.0
450,https://hasaki.vn/san-pham/nuoc-tay-trang-bioderma-danh-cho-da-nhay-cam-250ml-1736.html,"['9740', '114912', '1736', '1735']",1736,Thanh Bình,"Mua nhiều lần ở đây rồi ạ. Sản phẩm ok, giá rẻ ship nhanh nữa chớ ❤️❤️❤️",Nước Tẩy Trang Bioderma Dành Cho Da Nhạy Cảm 500ml Đã mua hàng online,22: 49 | 17/02/2022,5.0
451,https://hasaki.vn/san-pham/nuoc-tay-trang-bioderma-danh-cho-da-nhay-cam-250ml-1736.html,"['9740', '114912', '1736', '1735']",1736,ddddddd,hay,Nước Tẩy Trang Bioderma Dành Cho Da Nhạy Cảm 500ml,10: 54 | 27/01/2022,4.0
452,https://hasaki.vn/san-pham/nuoc-tay-trang-bioderma-danh-cho-da-nhay-cam-250ml-1736.html,"['9740', '114912', '1736', '1735']",1736,hanh23894,""">",Nước Tẩy Trang Bioderma Dành Cho Da Nhạy Cảm 500ml Đã mua hàng online,14: 33 | 24/01/2022,5.0
453,https://hasaki.vn/san-pham/nuoc-tay-trang-bioderma-danh-cho-da-nhay-cam-250ml-1736.html,"['9740', '114912', '1736', '1735']",1736,Dung Doan,"giao hàng rất nhanh, đóng gói cẩn thận, shipper thân thiện",Nước Tẩy Trang Bioderma Dành Cho Da Nhạy Cảm 500ml,17: 33 | 20/01/2022,5.0
454,https://hasaki.vn/san-pham/nuoc-tay-trang-bioderma-danh-cho-da-nhay-cam-250ml-1736.html,"['9740', '114912', '1736', '1735']",1736,Toàn Nguyễn,Hhfh,Nước Tẩy Trang Bioderma Dành Cho Da Nhạy Cảm 500ml Đã mua hàng online,10: 57 | 19/01/2022,5.0
455,https://hasaki.vn/san-pham/nuoc-tay-trang-bioderma-danh-cho-da-nhay-cam-250ml-1736.html,"['9740', '114912', '1736', '1735']",1736,Hữu Lộc,acb,Nước Tẩy Trang Bioderma Dành Cho Da Nhạy Cảm 500ml Đã mua hàng online,15: 32 | 30/12/2021,5.0
456,https://hasaki.vn/san-pham/nuoc-tay-trang-bioderma-danh-cho-da-nhay-cam-250ml-1736.html,"['9740', '114912', '1736', '1735']",1736,Xuyến Moon,sài rất lâu lun ă ngày tẩy ba lần ok lắm nên mua nhưng mà với ai có trang điểm và son lì thì k ra hết đâu nhé,Nước Tẩy Trang Bioderma Dành Cho Da Nhạy Cảm 500ml Đã mua hàng online,06: 47 | 01/11/2022,5.0
457,https://hasaki.vn/san-pham/nuoc-tay-trang-bioderma-danh-cho-da-nhay-cam-250ml-1736.html,"['9740', '114912', '1736', '1735']",1736,Tùng Lê Văn,good,Nước Tẩy Trang Bioderma Dành Cho Da Nhạy Cảm 500ml Đã mua hàng online,21: 11 | 17/10/2022,4.0
458,https://hasaki.vn/san-pham/nuoc-tay-trang-bioderma-danh-cho-da-nhay-cam-250ml-1736.html,"['9740', '114912', '1736', '1735']",1736,Nguyễn Toan,Mình sài thấy ok,Nước Tẩy Trang Bioderma Dành Cho Da Nhạy Cảm 500ml Đã mua hàng online,11: 53 | 12/10/2022,5.0
459,https://hasaki.vn/san-pham/nuoc-tay-trang-bioderma-danh-cho-da-nhay-cam-250ml-1736.html,"['9740', '114912', '1736', '1735']",1736,Dung Nguyen,good,Nước Tẩy Trang Bioderma Dành Cho Da Nhạy Cảm 500ml Đã mua hàng online,01: 15 | 08/10/2022,5.0
460,https://hasaki.vn/san-pham/nuoc-tay-trang-bioderma-danh-cho-da-nhay-cam-250ml-1736.html,"['9740', '114912', '1736', '1735']",1736,Đặng Thảo Vy,Nói được tặng bông tẩy trang mà khi giao hàng không có tặng gì kể cả gel rửa mặt,Nước Tẩy Trang Bioderma Dành Cho Da Nhạy Cảm 500ml Đã mua hàng online,13: 35 | 16/09/2022,4.0
461,https://hasaki.vn/san-pham/nuoc-tay-trang-bioderma-danh-cho-da-nhay-cam-250ml-1736.html,"['9740', '114912', '1736', '1735']",1736,ngọc trang,gjio,Nước Tẩy Trang Bioderma Dành Cho Da Nhạy Cảm 500ml Đã mua hàng online,09: 13 | 10/09/2022,5.0
462,https://hasaki.vn/san-pham/nuoc-tay-trang-bioderma-danh-cho-da-nhay-cam-250ml-1736.html,"['9740', '114912', '1736', '1735']",1736,Hằng Ngô,so ok dùng được,Nước Tẩy Trang Bioderma Dành Cho Da Nhạy Cảm 500ml Đã mua hàng online,10: 41 | 05/09/2022,3.0
463,https://hasaki.vn/san-pham/nuoc-tay-trang-bioderma-danh-cho-da-nhay-cam-250ml-1736.html,"['9740', '114912', '1736', '1735']",1736,Huy Nguyễn,loại này dùng rất ok nha chắt tui mua thêm 1 chai nữa tặng cho bạn mới được,Nước Tẩy Trang Bioderma Dành Cho Da Nhạy Cảm 500ml,22: 14 | 17/08/2022,5.0
464,https://hasaki.vn/san-pham/nuoc-tay-trang-bioderma-danh-cho-da-nhay-cam-250ml-1736.html,"['9740', '114912', '1736', '1735']",1736,Nguyễn Mai Gia Huy,Loại này ai đang bị mụn ẩn ko nên sài. Vì nó sẽ xuất hiện mụn ẩn đấy.,Nước Tẩy Trang Bioderma Dành Cho Da Nhạy Cảm 500ml Đã mua hàng online,21: 43 | 22/07/2022,4.0
465,https://hasaki.vn/san-pham/nuoc-tay-trang-bioderma-danh-cho-da-nhay-cam-250ml-1736.html,"['9740', '114912', '1736', '1735']",1736,Võ Thị Ái,Này đúng chuẩn tẩy trang quốc dân luôn í,Nước Tẩy Trang Bioderma Dành Cho Da Nhạy Cảm 500ml,20: 04 | 21/07/2022,5.0
466,https://hasaki.vn/san-pham/nuoc-tay-trang-bioderma-danh-cho-da-nhay-cam-250ml-1736.html,"['9740', '114912', '1736', '1735']",1736,Nguyễn Hương,Tốt,Nước Tẩy Trang Bioderma Dành Cho Da Nhạy Cảm 500ml,21: 39 | 09/04/2023,5.0
467,https://hasaki.vn/san-pham/nuoc-tay-trang-bioderma-danh-cho-da-nhay-cam-250ml-1736.html,"['9740', '114912', '1736', '1735']",1736,Bảo Linh,Sp sử dụng qua mặt sach khỏi chê,Nước Tẩy Trang Bioderma Dành Cho Da Nhạy Cảm 500ml,19: 39 | 09/04/2023,5.0
468,https://hasaki.vn/san-pham/nuoc-tay-trang-bioderma-danh-cho-da-nhay-cam-250ml-1736.html,"['9740', '114912', '1736', '1735']",1736,Mỹ Uyên,Sp tốt dùng rất thích,Nước Tẩy Trang Bioderma Dành Cho Da Nhạy Cảm 500ml,17: 07 | 09/04/2023,5.0
469,https://hasaki.vn/san-pham/nuoc-tay-trang-bioderma-danh-cho-da-nhay-cam-250ml-1736.html,"['9740', '114912', '1736', '1735']",1736,Trần Ngọc Ánh,dạ mình dầu mụn nhưng sài màu này rất hợp.k có gì để chê.giao nhanh nhân viên thận thiện dễ thương.10đ,Nước Tẩy Trang Bioderma Dành Cho Da Nhạy Cảm 500ml Đã mua hàng online,10: 11 | 23/03/2023,5.0
470,https://hasaki.vn/san-pham/nuoc-tay-trang-bioderma-danh-cho-da-nhay-cam-250ml-1736.html,"['9740', '114912', '1736', '1735']",1736,Lê Thị Thu Hồng,"Mua chai thứ 4 5 gì rồi, đúng kiểu tiền nào của nấy, xài ok hơn nhiều, mà dùng tẩy trang hàng ngày nên hơi hao",Nước Tẩy Trang Bioderma Dành Cho Da Nhạy Cảm 500ml Đã mua hàng online,19: 08 | 04/03/2023,5.0
471,https://hasaki.vn/san-pham/nuoc-tay-trang-bioderma-danh-cho-da-nhay-cam-250ml-1736.html,"['9740', '114912', '1736', '1735']",1736,Cao Hải Ngân,Sản phẩm tốt. Giao hàng nhanh. Nhân viên tư vấn thân thiện.,Nước Tẩy Trang Bioderma Dành Cho Da Nhạy Cảm 500ml Đã mua hàng online,16: 45 | 27/02/2023,5.0
472,https://hasaki.vn/san-pham/nuoc-tay-trang-bioderma-danh-cho-da-nhay-cam-250ml-1736.html,"['9740', '114912', '1736', '1735']",1736,Thanh Thảo,ckcbnoavb o,Nước Tẩy Trang Bioderma Dành Cho Da Nhạy Cảm 500ml,12: 50 | 04/01/2023,5.0
473,https://hasaki.vn/san-pham/nuoc-tay-trang-bioderma-danh-cho-da-nhay-cam-250ml-1736.html,"['9740', '114912', '1736', '1735']",1736,Bảo Ngọc,"Em này đỉnh thiệt! Tẩy trang dịu nhẹ, sạch bụi bẩn luôn nè",Nước Tẩy Trang Bioderma Dành Cho Da Nhạy Cảm 250ml Đã mua hàng online,18: 58 | 27/12/2022,5.0
474,https://hasaki.vn/san-pham/nuoc-tay-trang-bioderma-danh-cho-da-nhay-cam-250ml-1736.html,"['9740', '114912', '1736', '1735']",1736,nguyễn á tiên,sản phẩm tốt,Nước Tẩy Trang Bioderma Dành Cho Da Nhạy Cảm 500ml Đã mua hàng online,15: 52 | 05/12/2022,5.0
475,https://hasaki.vn/san-pham/nuoc-tay-trang-bioderma-danh-cho-da-nhay-cam-250ml-1736.html,"['9740', '114912', '1736', '1735']",1736,chi Ngan,"đã dùng sang chai thứ 2. Da mình mụn viêm rất nhiều, chỉ có dùng BIODERMA là mới chịu được. Tất cả các nước tẩy trang khác, mình dùng là lên mụn ẩn, rồi phải quay về BIO. Có điều mắc thiệt",Nước Tẩy Trang Bioderma Dành Cho Da Nhạy Cảm 500ml Đã mua hàng online,08: 57 | 10/11/2022,5.0
476,https://hasaki.vn/san-pham/nuoc-tay-trang-bioderma-danh-cho-da-nhay-cam-250ml-1736.html,"['9740', '114912', '1736', '1735']",1736,Hồng Thu,"Sản phẩm dùng rất hiệu quả,cực kì phù hợp cho các bạn,giá thành oke nên mua nha",Nước Tẩy Trang Bioderma Dành Cho Da Nhạy Cảm 500ml,22: 26 | 15/04/2023,5.0
477,https://hasaki.vn/san-pham/nuoc-tay-trang-bioderma-danh-cho-da-nhay-cam-250ml-1736.html,"['9740', '114912', '1736', '1735']",1736,Nhung Vũ,Sản phẩm rất OK,Nước Tẩy Trang Bioderma Dành Cho Da Nhạy Cảm 500ml,13: 58 | 14/04/2023,5.0
478,https://hasaki.vn/san-pham/nuoc-tay-trang-bioderma-danh-cho-da-nhay-cam-250ml-1736.html,"['9740', '114912', '1736', '1735']",1736,Huyền Ni,"Mink dùng bioderma cảm thấy hợp , không bị khích ứng da. Mình thường xuyên trang điểm nên việc tẩy trang và lựa chọn dòng tẩy trang phục hợp khá kĩ lưỡng. Dùng cho cả những bạn da nhạy cảm lẫn da dầu ạ. Mình dùng 2 năm nay rùi",Nước Tẩy Trang Bioderma Dành Cho Da Nhạy Cảm 500ml,11: 40 | 14/04/2023,5.0
479,https://hasaki.vn/san-pham/nuoc-tay-trang-bioderma-danh-cho-da-nhay-cam-250ml-1736.html,"['9740', '114912', '1736', '1735']",1736,Phan Trinh,"Nước tẩy trang này thực sự rất thích, dùng sạch và cảm giác mềm, k bị khô",Nước Tẩy Trang Bioderma Dành Cho Da Nhạy Cảm 500ml,13: 44 | 12/04/2023,5.0
480,https://hasaki.vn/san-pham/nuoc-tay-trang-bioderma-danh-cho-da-nhay-cam-250ml-1736.html,"['9740', '114912', '1736', '1735']",1736,Nguyen Lien,Sản phẩm dùng tốt lắm,Nước Tẩy Trang Bioderma Dành Cho Da Nhạy Cảm 500ml,12: 53 | 12/04/2023,5.0
481,https://hasaki.vn/san-pham/nuoc-tay-trang-bioderma-danh-cho-da-nhay-cam-250ml-1736.html,"['9740', '114912', '1736', '1735']",1736,Yen Ta,Đơn hàng có kèm quà tặng nhưng khi nhận hàng thì lại ko có quà tặng,Nước Tẩy Trang Bioderma Dành Cho Da Nhạy Cảm 500ml Đã mua hàng online,11: 53 | 12/04/2023,4.0
482,https://hasaki.vn/san-pham/nuoc-tay-trang-bioderma-danh-cho-da-nhay-cam-250ml-1736.html,"['9740', '114912', '1736', '1735']",1736,Lê Thị Thanh Hương,Sản phẩm dùng tốt,Nước Tẩy Trang Bioderma Dành Cho Da Nhạy Cảm 500ml,15: 37 | 11/04/2023,5.0
483,https://hasaki.vn/san-pham/nuoc-tay-trang-bioderma-danh-cho-da-nhay-cam-250ml-1736.html,"['9740', '114912', '1736', '1735']",1736,Do vu thanh hoai,Sp tot,Nước Tẩy Trang Bioderma Dành Cho Da Nhạy Cảm 500ml,15: 10 | 10/04/2023,5.0
484,https://hasaki.vn/san-pham/nuoc-tay-trang-bioderma-danh-cho-da-nhay-cam-250ml-1736.html,"['9740', '114912', '1736', '1735']",1736,Hương Nguyễn,Tốt,Nước Tẩy Trang Bioderma Dành Cho Da Nhạy Cảm 500ml,12: 51 | 10/04/2023,5.0
485,https://hasaki.vn/san-pham/nuoc-tay-trang-bioderma-danh-cho-da-nhay-cam-250ml-1736.html,"['9740', '114912', '1736', '1735']",1736,Hổ Báo Sư Tử,Dfhscvhhf,Nước Tẩy Trang Bioderma Dành Cho Da Nhạy Cảm 500ml,21: 46 | 09/04/2023,4.0
486,https://hasaki.vn/san-pham/nuoc-tay-trang-bioderma-danh-cho-da-nhay-cam-250ml-1736.html,"['9740', '114912', '1736', '1735']",1736,MY MY,"Dong tẩy trang Bioderma dung cho da nhạy cảm rat hiệu quả ạ,san phẩm tốt❤️",Nước Tẩy Trang Bioderma Dành Cho Da Nhạy Cảm 500ml,20: 37 | 19/04/2023,5.0
487,https://hasaki.vn/san-pham/nuoc-tay-trang-bioderma-danh-cho-da-nhay-cam-250ml-1736.html,"['9740', '114912', '1736', '1735']",1736,판티트,Sản phẩm này rất tốt ạ,Nước Tẩy Trang Bioderma Dành Cho Da Nhạy Cảm 500ml,17: 15 | 19/04/2023,5.0
488,https://hasaki.vn/san-pham/nuoc-tay-trang-bioderma-danh-cho-da-nhay-cam-250ml-1736.html,"['9740', '114912', '1736', '1735']",1736,Nguyễn Oanh,"Nước tẩy trang chất lượng, phù hợp với giá tiền , dùng thích",Nước Tẩy Trang Bioderma Dành Cho Da Nhạy Cảm 500ml,16: 55 | 19/04/2023,5.0
489,https://hasaki.vn/san-pham/nuoc-tay-trang-bioderma-danh-cho-da-nhay-cam-250ml-1736.html,"['9740', '114912', '1736', '1735']",1736,Han Bây Bê,Tốt,Nước Tẩy Trang Bioderma Dành Cho Da Nhạy Cảm 500ml,13: 19 | 19/04/2023,5.0
490,https://hasaki.vn/san-pham/nuoc-tay-trang-bioderma-danh-cho-da-nhay-cam-250ml-1736.html,"['9740', '114912', '1736', '1735']",1736,Huyền Trang,"Mình đã dùng nước tẩy trang Bioderma. Dùng xong cảm thấy sạch da, phù hợp với da nhạy cảm như mình nhé",Nước Tẩy Trang Bioderma Dành Cho Da Nhạy Cảm 500ml,12: 18 | 19/04/2023,5.0
491,https://hasaki.vn/san-pham/nuoc-tay-trang-bioderma-danh-cho-da-nhay-cam-250ml-1736.html,"['9740', '114912', '1736', '1735']",1736,Nữ Hoàng Lạnh Lùng,Sản phẩm tốt lắm ạ,Nước Tẩy Trang Bioderma Dành Cho Da Nhạy Cảm 500ml,19: 48 | 17/04/2023,5.0
492,https://hasaki.vn/san-pham/nuoc-tay-trang-bioderma-danh-cho-da-nhay-cam-250ml-1736.html,"['9740', '114912', '1736', '1735']",1736,Ái Ái,sp dùng tốt,Nước Tẩy Trang Bioderma Dành Cho Da Nhạy Cảm 500ml,19: 11 | 17/04/2023,5.0
493,https://hasaki.vn/san-pham/nuoc-tay-trang-bioderma-danh-cho-da-nhay-cam-250ml-1736.html,"['9740', '114912', '1736', '1735']",1736,Trần Long,"Sản phẩm dùng rất hiệu quả,cực kì phù hợp cho các bạn,giá thành oke nên mua nha",Nước Tẩy Trang Bioderma Dành Cho Da Nhạy Cảm 500ml,13: 48 | 17/04/2023,5.0
494,https://hasaki.vn/san-pham/nuoc-tay-trang-bioderma-danh-cho-da-nhay-cam-250ml-1736.html,"['9740', '114912', '1736', '1735']",1736,Chu Mai,Sản phẩm tốt,Nước Tẩy Trang Bioderma Dành Cho Da Nhạy Cảm 500ml,11: 18 | 17/04/2023,5.0
495,https://hasaki.vn/san-pham/nuoc-tay-trang-bioderma-danh-cho-da-nhay-cam-250ml-1736.html,"['9740', '114912', '1736', '1735']",1736,Chồng Bé Hảo,San phẩm rất tốt ạ,Nước Tẩy Trang Bioderma Dành Cho Da Nhạy Cảm 500ml,12: 46 | 16/04/2023,5.0
496,https://hasaki.vn/san-pham/nuoc-tay-trang-bioderma-danh-cho-da-nhay-cam-250ml-1736.html,"['9740', '114912', '1736', '1735']",1736,lê thị hồng quí,Sản phẩm chất lượng đáng để sử dụng,Combo 2 Nước Tẩy Trang Bioderma Cho Da Nhạy Cảm 500ml,19: 25 | 29/02/2024,5.0
497,https://hasaki.vn/san-pham/nuoc-tay-trang-bioderma-danh-cho-da-nhay-cam-250ml-1736.html,"['9740', '114912', '1736', '1735']",1736,Lam Nguyễn,Dành tặng 5 sao cho sp tôi yêu thích,Nước Tẩy Trang Bioderma Dành Cho Da Nhạy Cảm 500ml,18: 20 | 29/02/2024,5.0
498,https://hasaki.vn/san-pham/nuoc-tay-trang-bioderma-danh-cho-da-nhay-cam-250ml-1736.html,"['9740', '114912', '1736', '1735']",1736,BonBon,Sản phẩm dùng rất ok. Da mình cực kỳ mẫn cảm đã thử qua các dòng tẩy trang rồi nhưng đều ko dùng được. Cảm ơn shop nhiều nha.,Nước Tẩy Trang Bioderma Dành Cho Da Nhạy Cảm 500ml,14: 06 | 21/02/2024,5.0
499,https://hasaki.vn/san-pham/nuoc-tay-trang-bioderma-danh-cho-da-nhay-cam-250ml-1736.html,"['9740', '114912', '1736', '1735']",1736,Quỳnh Thoa,Sản phẩm tốt đáng sử dụng,Nước Tẩy Trang Bioderma Dành Cho Da Nhạy Cảm 500ml,18: 42 | 11/01/2024,5.0
500,https://hasaki.vn/san-pham/nuoc-tay-trang-bioderma-danh-cho-da-nhay-cam-250ml-1736.html,"['9740', '114912', '1736', '1735']",1736,Nguyễn Thị Hậu,Sản phẩm chất lượng đáng để sử dụng,Nước Tẩy Trang Bioderma Dành Cho Da Nhạy Cảm 500ml,10: 42 | 09/01/2024,5.0
501,https://hasaki.vn/san-pham/nuoc-tay-trang-bioderma-danh-cho-da-nhay-cam-250ml-1736.html,"['9740', '114912', '1736', '1735']",1736,Linh Vo,"Sp tốt, đã mua Bioderma gồm tẩy trang và sữa rửa mặt",Nước Tẩy Trang Bioderma Dành Cho Da Nhạy Cảm 500ml Đã mua hàng online,08: 48 | 08/01/2024,5.0
502,https://hasaki.vn/san-pham/nuoc-tay-trang-bioderma-danh-cho-da-nhay-cam-250ml-1736.html,"['9740', '114912', '1736', '1735']",1736,Bé Lùnn,Sản phẩm đáng để sử dụng,Nước Tẩy Trang Bioderma Dành Cho Da Nhạy Cảm 500ml,12: 14 | 03/01/2024,5.0
503,https://hasaki.vn/san-pham/nuoc-tay-trang-bioderma-danh-cho-da-nhay-cam-250ml-1736.html,"['9740', '114912', '1736', '1735']",1736,Trần Hà,"Sản phẩm tốt , đáng để sử dụng",Nước Tẩy Trang Bioderma Dành Cho Da Nhạy Cảm 500ml,20: 30 | 25/12/2023,5.0
504,https://hasaki.vn/san-pham/nuoc-tay-trang-bioderma-danh-cho-da-nhay-cam-250ml-1736.html,"['9740', '114912', '1736', '1735']",1736,Ngô Duy Khánh,Sp tốt,Nước Tẩy Trang Bioderma Dành Cho Da Nhạy Cảm 500ml,09: 47 | 10/11/2023,5.0
505,https://hasaki.vn/san-pham/nuoc-tay-trang-bioderma-danh-cho-da-nhay-cam-250ml-1736.html,"['9740', '114912', '1736', '1735']",1736,Hòa Trịnh,Sp tốt,Nước Tẩy Trang Bioderma Dành Cho Da Nhạy Cảm 500ml,20: 55 | 16/10/2023,5.0
506,https://hasaki.vn/san-pham/serum-caryophy-giam-mun-mo-tham-se-lo-chan-long-30ml-98247.html,"['98247', '78142', '108008']",98247,Nguyễn Phúc,"Mụn viêm thoa lên sau 1 đêm sẽ khô còi nhân mụn, dùng 1 thời gian dài vết thâm tương đối mờ, mụn ẩn dưới cằm đã không còn.",Serum CARYOPHY Cho Da Mụn 10ml Đã mua hàng online,09: 31 | 07/03/2020,5.0
507,https://hasaki.vn/san-pham/serum-caryophy-giam-mun-mo-tham-se-lo-chan-long-30ml-98247.html,"['98247', '78142', '108008']",98247,Hồng Điểm,Rất hiệu quả. Mình dùng tầm 1 tuần là mụn trứng cá mụn ẩn tan hết.,Serum Caryophy Giảm Mụn Mờ Thâm Se Lỗ Chân Lông 10ml Đã mua hàng online,14: 28 | 27/08/2023,5.0
508,https://hasaki.vn/san-pham/serum-caryophy-giam-mun-mo-tham-se-lo-chan-long-30ml-98247.html,"['98247', '78142', '108008']",98247,TIẾN ĐẠT,công dụng rõ nhất của sản phẩm này khi mình sử dụng thì chủ yếu như kem dưỡng dưỡng ẩm kiềm dầu khá tốt làm dịu các nốt mụn mờ thâm với se lỗ chân lông thì không rõ lắm,Serum Caryophy Giảm Mụn Mờ Thâm Se Lỗ Chân Lông 10ml Đã mua hàng online,15: 25 | 30/07/2023,5.0
509,https://hasaki.vn/san-pham/serum-caryophy-giam-mun-mo-tham-se-lo-chan-long-30ml-98247.html,"['98247', '78142', '108008']",98247,Danh Thị Ngọc Châu,Dùng oke lắm nha mn nặn mụn xong mặt tấy đỏ bôi vào sáng hôm sau dậy thấy dịu hẳn luôn. Làm khô vết thương với đều màu da khá ok. 1 chai dùng hằng ngày là đúng 1 tháng sẽ hết nha kkk. Dùng ok cấp ẩm cũng tương đối thôi,Serum Caryophy Giảm Mụn Mờ Thâm Se Lỗ Chân Lông 10ml,14: 32 | 22/02/2023,4.0
510,https://hasaki.vn/san-pham/serum-caryophy-giam-mun-mo-tham-se-lo-chan-long-30ml-98247.html,"['98247', '78142', '108008']",98247,Huỳnh Ngọc,"Da khô mà bị mụn xài hiệu quả lắm luôn đợt mình bị mụn sài 1 chai là từ từ bớt, có se khít lcl , và đều màu da xài 3 chai là hết hẳn ngưng sử dụng ko bị bùng trở lại,lâu lâu mới nổi 1 vài cục, nhưng chị mình da dầu xài bị bí ko hợp còn lên mụn nhiều hơn nên da dầu mn nên xài loại nào thoáng hơn nha",Serum Caryophy Giảm Mụn Mờ Thâm Se Lỗ Chân Lông 10ml Đã mua hàng online,22: 52 | 12/01/2023,5.0
511,https://hasaki.vn/san-pham/serum-caryophy-giam-mun-mo-tham-se-lo-chan-long-30ml-98247.html,"['98247', '78142', '108008']",98247,C DIỆU,"Đã dùng em này, dưỡng ẩm tốt, còn trị mụn và thâm thì chưa hiệu quả lắm. Mau hết.",Serum Caryophy Giảm Mụn Mờ Thâm Se Lỗ Chân Lông 10ml Đã mua hàng online,13: 07 | 07/05/2022,3.0
512,https://hasaki.vn/san-pham/serum-caryophy-giam-mun-mo-tham-se-lo-chan-long-30ml-98247.html,"['98247', '78142', '108008']",98247,Nguyễn Thị Mỵ,"giao hàng nhanh, sản phẩm tốt, giá hợp lí",Serum Caryophy Giảm Mụn Mờ Thâm Se Lỗ Chân Lông 10ml Đã mua hàng online,16: 51 | 18/12/2021,5.0
513,https://hasaki.vn/san-pham/serum-caryophy-giam-mun-mo-tham-se-lo-chan-long-30ml-98247.html,"['98247', '78142', '108008']",98247,Vy Trần Phương,"Sử dụng được 3 chai rồi, da có cải thiện nhưng ko nhiều. Những bạn ít mụn xài chắc sẽ hết dứt điểm, còn ai nhiều mụn và bị mụn lâu ngày thì tầm vài chai cũng ko hết hẳn đâu. Cá nhân mình thấy làn da có cải thiện nhưng mụn mới vẫn lên, nên đang cân nhắc ko biết nên dùng tiếp ko vì giá thành cũng hơi cao",Serum Caryophy Giảm Mụn Mờ Thâm Se Lỗ Chân Lông 10ml Đã mua hàng online,14: 20 | 29/11/2021,3.0
514,https://hasaki.vn/san-pham/serum-caryophy-giam-mun-mo-tham-se-lo-chan-long-30ml-98247.html,"['98247', '78142', '108008']",98247,Trang Nguyễn,Da mình đỡ bị kích ứng hơn so với trước kia nhờ sử dụng nguyên bộ sp của thương hiệu này,Serum Caryophy Giảm Mụn Mờ Thâm Se Lỗ Chân Lông 10ml Đã mua hàng online,17: 57 | 15/10/2021,5.0
515,https://hasaki.vn/san-pham/serum-caryophy-giam-mun-mo-tham-se-lo-chan-long-30ml-98247.html,"['98247', '78142', '108008']",98247,Minh Thuận,"mình thấy xài ok lắm da bóng ,da sáng và về mụn thì nó đẩy mụn lên mà mình xài trong dịch như thế này thì kh có thể đi spa nặn mụn nên nặn ở nhà sợ thâm chet đi đc",Serum CARYOPHY Cho Da Mụn 10ml Đã mua hàng online,11: 46 | 26/07/2021,5.0
516,https://hasaki.vn/san-pham/serum-caryophy-giam-mun-mo-tham-se-lo-chan-long-30ml-98247.html,"['98247', '78142', '108008']",98247,Nam Thương,"Có thấy mịn da nhưng tác dụng trị mụn mình chưa thấy rõ, có lẽ sẽ mua lại thử lần nữa",Serum CARYOPHY Cho Da Mụn 10ml Đã mua hàng online,01: 42 | 15/05/2021,4.0
517,https://hasaki.vn/san-pham/sua-rua-mat-cocoon-chiet-xuat-tu-nghe-hung-yen-140ml-94277.html,"['94277', '101935']",94277,c nhi,"Giảm thâm mụn hiệu quả nè, nhưng hơi khô căng da",Sữa Rửa Mặt Cocoon Chiết Xuất Từ Nghệ Hưng Yên 140ml Đã mua hàng online,13: 54 | 12/02/2023,5.0
